clean_comment,label,comment,rating,source_url,keyword,date
"hiệu_suất màu_sắc phong_phú , phim cảm_giác đặc_biệt .",2,"Hiệu suất màu sắc rất phong phú, khi xem phim cảm giác đặc biệt tốt.",5,https://shopee.vn/M%C3%A0n-h%C3%ACnh-cong-LCD-Spin-24-27-inch-Full-HD-32-34-inch-2K-m%C3%A1y-t%C3%ADnh-ch%C6%A1i-game-100-165-180hz-i.1310764828.29206495568?extraParams=%7B%22display_model_id%22%3A187844599653%2C%22model_selection_logic%22%3A3%7D&sp_atk=a3f052bb-78b1-4308-b716-4bf387f3e134&xptdk=a3f052bb-78b1-4308-b716-4bf387f3e134,màn hình giá rẻ,2024-11-08
"chất_lượng âm_thanh , cảm_thấy đắm chìm phim .",2,"Chất lượng âm thanh tốt, khiến tôi cảm thấy đắm chìm khi xem phim.",5,https://shopee.vn/M%C3%A0n-h%C3%ACnh-cong-LCD-Spin-24-27-inch-Full-HD-32-34-inch-2K-m%C3%A1y-t%C3%ADnh-ch%C6%A1i-game-100-165-180hz-i.1310764828.29206495568?extraParams=%7B%22display_model_id%22%3A187844599653%2C%22model_selection_logic%22%3A3%7D&sp_atk=a3f052bb-78b1-4308-b716-4bf387f3e134&xptdk=a3f052bb-78b1-4308-b716-4bf387f3e134,màn hình giá rẻ,2024-10-19
"tần_số quét 100 hz cảm_nhận mượt_mà có_khi game , hình_ảnh sắc_nét , chắc_chắn mua !",2,"Tần số quét 100Hz khiến tôi cảm nhận được sự mượt mà chưa từng có khi chơi game, hình ảnh sắc nét, chắc chắn đáng để mua!",5,https://shopee.vn/M%C3%A0n-h%C3%ACnh-cong-LCD-Spin-24-27-inch-Full-HD-32-34-inch-2K-m%C3%A1y-t%C3%ADnh-ch%C6%A1i-game-100-165-180hz-i.1310764828.29206495568?extraParams=%7B%22display_model_id%22%3A187844599653%2C%22model_selection_logic%22%3A3%7D&sp_atk=a3f052bb-78b1-4308-b716-4bf387f3e134&xptdk=a3f052bb-78b1-4308-b716-4bf387f3e134,màn hình giá rẻ,2024-09-24
giao hàng nhanh_chóng đóng_gói cẩnvthaajn ủng_hộ cửa_hàng tiếp,2,Giao hàng nhanh chóng và đóng gói cẩnvthaajn lần sau ủng hộ shop tiếp,5,https://shopee.vn/M%C3%A0n-h%C3%ACnh-cong-LCD-Spin-24-27-inch-Full-HD-32-34-inch-2K-m%C3%A1y-t%C3%ADnh-ch%C6%A1i-game-100-165-180hz-i.1310764828.29206495568?extraParams=%7B%22display_model_id%22%3A187844599653%2C%22model_selection_logic%22%3A3%7D&sp_atk=a3f052bb-78b1-4308-b716-4bf387f3e134&xptdk=a3f052bb-78b1-4308-b716-4bf387f3e134,màn hình giá rẻ,2024-08-31
"điều_chỉnh độ màn_hình linh_hoạt , phù_hợp điều_kiện ánh_sáng .",2,"Việc điều chỉnh độ sáng của màn hình này rất linh hoạt, phù hợp với nhiều điều kiện ánh sáng khác nhau.",5,https://shopee.vn/M%C3%A0n-h%C3%ACnh-cong-LCD-Spin-24-27-inch-Full-HD-32-34-inch-2K-m%C3%A1y-t%C3%ADnh-ch%C6%A1i-game-100-165-180hz-i.1310764828.29206495568?extraParams=%7B%22display_model_id%22%3A187844599653%2C%22model_selection_logic%22%3A3%7D&sp_atk=a3f052bb-78b1-4308-b716-4bf387f3e134&xptdk=a3f052bb-78b1-4308-b716-4bf387f3e134,màn hình giá rẻ,2024-12-03
"chất_lượng sản_phẩm thiết_kế cong giúp cảm_thấy thoải_mái , tận_hưởng khoảnh_khắc .",2,"Chất lượng sản phẩm:tốt

Thiết kế cong giúp tôi cảm thấy thoải mái hơn khi xem, tận hưởng từng khoảnh khắc.",5,https://shopee.vn/M%C3%A0n-h%C3%ACnh-cong-LCD-Spin-24-27-inch-Full-HD-32-34-inch-2K-m%C3%A1y-t%C3%ADnh-ch%C6%A1i-game-100-165-180hz-i.1310764828.29206495568?extraParams=%7B%22display_model_id%22%3A187844599653%2C%22model_selection_logic%22%3A3%7D&sp_atk=a3f052bb-78b1-4308-b716-4bf387f3e134&xptdk=a3f052bb-78b1-4308-b716-4bf387f3e134,màn hình giá rẻ,2024-11-11
"hiệu_chỉnh màu_sắc , phù_hợp nhu_cầu thiết_kế .",2,"Hiệu chỉnh màu sắc rất tốt, rất phù hợp với nhu cầu thiết kế của tôi.",5,https://shopee.vn/M%C3%A0n-h%C3%ACnh-cong-LCD-Spin-24-27-inch-Full-HD-32-34-inch-2K-m%C3%A1y-t%C3%ADnh-ch%C6%A1i-game-100-165-180hz-i.1310764828.29206495568?extraParams=%7B%22display_model_id%22%3A187844599653%2C%22model_selection_logic%22%3A3%7D&sp_atk=a3f052bb-78b1-4308-b716-4bf387f3e134&xptdk=a3f052bb-78b1-4308-b716-4bf387f3e134,màn hình giá rẻ,2024-11-15
"hiệu_chỉnh màu_sắc , phù_hợp nhu_cầu thiết_kế .",2,"Hiệu chỉnh màu sắc rất tốt, rất phù hợp với nhu cầu thiết kế của tôi.",5,https://shopee.vn/M%C3%A0n-h%C3%ACnh-cong-LCD-Spin-24-27-inch-Full-HD-32-34-inch-2K-m%C3%A1y-t%C3%ADnh-ch%C6%A1i-game-100-165-180hz-i.1310764828.29206495568?extraParams=%7B%22display_model_id%22%3A187844599653%2C%22model_selection_logic%22%3A3%7D&sp_atk=a3f052bb-78b1-4308-b716-4bf387f3e134&xptdk=a3f052bb-78b1-4308-b716-4bf387f3e134,màn hình giá rẻ,2024-10-25
giá rẻ đánh_giá . mn yên_tâm mua . 5 cửa_hàng uy_tín !,2,Giá rẻ nhưng tôi đánh giá là dùng rất tốt. Mn yên tâm nên mua nhé. 5 sao shop uy tín!,5,https://shopee.vn/M%C3%A0n-h%C3%ACnh-cong-LCD-Spin-24-27-inch-Full-HD-32-34-inch-2K-m%C3%A1y-t%C3%ADnh-ch%C6%A1i-game-100-165-180hz-i.1310764828.29206495568?extraParams=%7B%22display_model_id%22%3A187844599653%2C%22model_selection_logic%22%3A3%7D&sp_atk=a3f052bb-78b1-4308-b716-4bf387f3e134&xptdk=a3f052bb-78b1-4308-b716-4bf387f3e134,màn hình giá rẻ,2024-08-31
"điều_chỉnh độ góc màn_hình thuận_tiện , phù_hợp sử_dụng .",2,"Việc điều chỉnh độ cao và góc nhìn của màn hình này rất thuận tiện, phù hợp với nhiều người sử dụng.",5,https://shopee.vn/M%C3%A0n-h%C3%ACnh-cong-LCD-Spin-24-27-inch-Full-HD-32-34-inch-2K-m%C3%A1y-t%C3%ADnh-ch%C6%A1i-game-100-165-180hz-i.1310764828.29206495568?extraParams=%7B%22display_model_id%22%3A187844599653%2C%22model_selection_logic%22%3A3%7D&sp_atk=a3f052bb-78b1-4308-b716-4bf387f3e134&xptdk=a3f052bb-78b1-4308-b716-4bf387f3e134,màn hình giá rẻ,2024-10-27
"độ tương_phản màu_sắc , nâng hiệu_suất làm_việc .",2,"Độ tương phản màu sắc rất tốt, nâng cao hiệu suất làm việc của tôi.",5,https://shopee.vn/M%C3%A0n-h%C3%ACnh-cong-LCD-Spin-24-27-inch-Full-HD-32-34-inch-2K-m%C3%A1y-t%C3%ADnh-ch%C6%A1i-game-100-165-180hz-i.1310764828.29206495568?extraParams=%7B%22display_model_id%22%3A187844599653%2C%22model_selection_logic%22%3A3%7D&sp_atk=a3f052bb-78b1-4308-b716-4bf387f3e134&xptdk=a3f052bb-78b1-4308-b716-4bf387f3e134,màn hình giá rẻ,2024-11-28
"quy_trình lắp_đặt đơn_giản tiện_lợi , tiết_kiệm thời_gian .",2,"Quy trình lắp đặt rất đơn giản và tiện lợi, tiết kiệm nhiều thời gian.",5,https://shopee.vn/M%C3%A0n-h%C3%ACnh-cong-LCD-Spin-24-27-inch-Full-HD-32-34-inch-2K-m%C3%A1y-t%C3%ADnh-ch%C6%A1i-game-100-165-180hz-i.1310764828.29206495568?extraParams=%7B%22display_model_id%22%3A187844599653%2C%22model_selection_logic%22%3A3%7D&sp_atk=a3f052bb-78b1-4308-b716-4bf387f3e134&xptdk=a3f052bb-78b1-4308-b716-4bf387f3e134,màn hình giá rẻ,2024-12-02
"game , chất_lượng hình_ảnh hài_lòng , vui .",2,"Trong game, chất lượng hình ảnh khiến tôi rất hài lòng, tôi chơi rất vui.",5,https://shopee.vn/M%C3%A0n-h%C3%ACnh-cong-LCD-Spin-24-27-inch-Full-HD-32-34-inch-2K-m%C3%A1y-t%C3%ADnh-ch%C6%A1i-game-100-165-180hz-i.1310764828.29206495568?extraParams=%7B%22display_model_id%22%3A187844599653%2C%22model_selection_logic%22%3A3%7D&sp_atk=a3f052bb-78b1-4308-b716-4bf387f3e134&xptdk=a3f052bb-78b1-4308-b716-4bf387f3e134,màn hình giá rẻ,2024-11-11
"thiết_kế cong nhẹ không_chỉ nâng trải_nghiệm hình_ảnh mà_còn cảm_thấy thoải_mái làm_việc , hoàn_hảo !",2,"Thiết kế cong nhẹ không chỉ nâng cao trải nghiệm hình ảnh mà còn khiến tôi cảm thấy thoải mái khi làm việc, thật hoàn hảo!",5,https://shopee.vn/M%C3%A0n-h%C3%ACnh-cong-LCD-Spin-24-27-inch-Full-HD-32-34-inch-2K-m%C3%A1y-t%C3%ADnh-ch%C6%A1i-game-100-165-180hz-i.1310764828.29206495568?extraParams=%7B%22display_model_id%22%3A187844599653%2C%22model_selection_logic%22%3A3%7D&sp_atk=a3f052bb-78b1-4308-b716-4bf387f3e134&xptdk=a3f052bb-78b1-4308-b716-4bf387f3e134,màn hình giá rẻ,2024-10-02
"hiệu_chỉnh màu_sắc , giúp tự_tin sáng_tạo .",2,"Hiệu chỉnh màu sắc rất tốt, giúp tôi tự tin hơn khi sáng tạo.",5,https://shopee.vn/M%C3%A0n-h%C3%ACnh-cong-LCD-Spin-24-27-inch-Full-HD-32-34-inch-2K-m%C3%A1y-t%C3%ADnh-ch%C6%A1i-game-100-165-180hz-i.1310764828.29206495568?extraParams=%7B%22display_model_id%22%3A187844599653%2C%22model_selection_logic%22%3A3%7D&sp_atk=a3f052bb-78b1-4308-b716-4bf387f3e134&xptdk=a3f052bb-78b1-4308-b716-4bf387f3e134,màn hình giá rẻ,2024-11-04
"màn_hình đẹp , độ bền sử_dụng 1 thời_gian đánh_giá đc , 5",2,"Màn hình đẹp, độ bền phải sử dụng 1 thời gian mới đánh giá đc, cho 5 sao",5,https://shopee.vn/M%C3%A0n-h%C3%ACnh-cong-LCD-Spin-24-27-inch-Full-HD-32-34-inch-2K-m%C3%A1y-t%C3%ADnh-ch%C6%A1i-game-100-165-180hz-i.1310764828.29206495568?extraParams=%7B%22display_model_id%22%3A187844599653%2C%22model_selection_logic%22%3A3%7D&sp_atk=a3f052bb-78b1-4308-b716-4bf387f3e134&xptdk=a3f052bb-78b1-4308-b716-4bf387f3e134,màn hình giá rẻ,2025-01-04
"tính_năng nổi_bật màu ổn chất_lượng sản_phẩm chất_lượng sản_phẩm ổn màn , ổn , chân lắp_hơi ổn",2,"Tính năng nổi bật:màu ổn
Chất lượng sản phẩm:chất lượng sản phẩm ổn

Màn ok , ổn , chân lắp hơi khó còn lại ổn hết",5,https://shopee.vn/M%C3%A0n-H%C3%ACnh-h%C3%A3ng-GLOWY-19-20-22-24-Inch-M%E1%BB%9Bi-100-FULL-BOX-B%E1%BA%A3o-h%C3%A0nh-24-th%C3%A1ng-!!-i.1304738911.29005047166?extraParams=%7B%22display_model_id%22%3A157852291209%2C%22model_selection_logic%22%3A3%7D&sp_atk=e93e51b8-d6af-48b9-bd73-486d1d1c1efd&xptdk=e93e51b8-d6af-48b9-bd73-486d1d1c1efd,màn hình giá rẻ,2025-02-12
"chất_lượng sản_phẩm tính_năng nổi_bật hiển_thị giá như_vậy đỏi hòi khả_năng hiển_thị chính_xác màu_sắc màn_hình . màn_hình hơi tối , so_sánh màn_hình , màu_sắc nịnh_mắt . phù_hợp giải_trí làm_việc yêu_cầu độ_chính_xác màu_sắc .",2,"Chất lượng sản phẩm:tốt
Tính năng nổi bật:hiển thị tốt

Với mức giá như vậy thì không còn đỏi hòi quá cao về khả năng hiển thị chính xác màu sắc của màn hình. Màn hình này hơi tối, nếu so sánh với các màn hình khác, màu sắc cho ra cũng khá nịnh mắt. Phù hợp với giải trí và làm việc không yêu cầu độ chính xác cao về màu sắc.",5,https://shopee.vn/M%C3%A0n-H%C3%ACnh-h%C3%A3ng-GLOWY-19-20-22-24-Inch-M%E1%BB%9Bi-100-FULL-BOX-B%E1%BA%A3o-h%C3%A0nh-24-th%C3%A1ng-!!-i.1304738911.29005047166?extraParams=%7B%22display_model_id%22%3A157852291209%2C%22model_selection_logic%22%3A3%7D&sp_atk=e93e51b8-d6af-48b9-bd73-486d1d1c1efd&xptdk=e93e51b8-d6af-48b9-bd73-486d1d1c1efd,màn hình giá rẻ,2025-06-09
"cửa_hàng giao hàng nhanh_chóng đóng_gói sản_phẩm cẩn_thận , sản_phẩm hoạt_động . tiếp_tục ủng_hộ shop .",2,"Shop giao hàng nhanh chóng và đóng gói sản phẩm rất cẩn thận, sản phẩm hoạt động rất tốt. Tiếp tục ủng hộ shop.",5,https://shopee.vn/M%C3%A0n-H%C3%ACnh-h%C3%A3ng-GLOWY-19-20-22-24-Inch-M%E1%BB%9Bi-100-FULL-BOX-B%E1%BA%A3o-h%C3%A0nh-24-th%C3%A1ng-!!-i.1304738911.29005047166?extraParams=%7B%22display_model_id%22%3A157852291209%2C%22model_selection_logic%22%3A3%7D&sp_atk=e93e51b8-d6af-48b9-bd73-486d1d1c1efd&xptdk=e93e51b8-d6af-48b9-bd73-486d1d1c1efd,màn hình giá rẻ,2025-09-14
sản_phẩm lỗi màn đẹp giá_trị màn mong bền ủng_hộ cửa_hàng tiếp,2,Sản phẩm tốt dùng chưa thấy lỗi gì màn cũng khá đẹp so với giá trị màn chỉ mong dùng bền sẽ ủng hộ shop tiếp khi cần,5,https://shopee.vn/M%C3%A0n-H%C3%ACnh-h%C3%A3ng-GLOWY-19-20-22-24-Inch-M%E1%BB%9Bi-100-FULL-BOX-B%E1%BA%A3o-h%C3%A0nh-24-th%C3%A1ng-!!-i.1304738911.29005047166?extraParams=%7B%22display_model_id%22%3A157852291209%2C%22model_selection_logic%22%3A3%7D&sp_atk=e93e51b8-d6af-48b9-bd73-486d1d1c1efd&xptdk=e93e51b8-d6af-48b9-bd73-486d1d1c1efd,màn hình giá rẻ,2025-08-01
chất_lượng sản_phẩm tầm_giá tính_năng nổi_bật tầm giá giá chê,2,"Chất lượng sản phẩm:trong tầm giá
Tính năng nổi bật:trong tầm giá

Với giá này thì không có gì để chê",5,https://shopee.vn/M%C3%A0n-H%C3%ACnh-h%C3%A3ng-GLOWY-19-20-22-24-Inch-M%E1%BB%9Bi-100-FULL-BOX-B%E1%BA%A3o-h%C3%A0nh-24-th%C3%A1ng-!!-i.1304738911.29005047166?extraParams=%7B%22display_model_id%22%3A157852291209%2C%22model_selection_logic%22%3A3%7D&sp_atk=e93e51b8-d6af-48b9-bd73-486d1d1c1efd&xptdk=e93e51b8-d6af-48b9-bd73-486d1d1c1efd,màn hình giá rẻ,2025-02-07
hiển_thị xắc nét nói_chung ổn tầm giá cho_dù hàng trung sd lâu_dài có_thể ổn,2,hiển thị rất xắc nét và nói chung là khá ổn trong tầm giá này cho dù là hàng trung nhưng sd lâu dài có thể ổn,5,https://shopee.vn/M%C3%A0n-H%C3%ACnh-h%C3%A3ng-GLOWY-19-20-22-24-Inch-M%E1%BB%9Bi-100-FULL-BOX-B%E1%BA%A3o-h%C3%A0nh-24-th%C3%A1ng-!!-i.1304738911.29005047166?extraParams=%7B%22display_model_id%22%3A157852291209%2C%22model_selection_logic%22%3A3%7D&sp_atk=e93e51b8-d6af-48b9-bd73-486d1d1c1efd&xptdk=e93e51b8-d6af-48b9-bd73-486d1d1c1efd,màn hình giá rẻ,2025-06-29
"cửa_hàng giao hàng nhanh_chóng đóng_gói sản_phẩm cẩn_thận , sản_phẩm hoạt_động . tiếp_tục ủng_hộ shop .",2,"Shop giao hàng nhanh chóng và đóng gói sản phẩm rất cẩn thận, sản phẩm hoạt động rất tốt. Tiếp tục ủng hộ shop.",5,https://shopee.vn/M%C3%A0n-H%C3%ACnh-h%C3%A3ng-GLOWY-19-20-22-24-Inch-M%E1%BB%9Bi-100-FULL-BOX-B%E1%BA%A3o-h%C3%A0nh-24-th%C3%A1ng-!!-i.1304738911.29005047166?extraParams=%7B%22display_model_id%22%3A157852291209%2C%22model_selection_logic%22%3A3%7D&sp_atk=e93e51b8-d6af-48b9-bd73-486d1d1c1efd&xptdk=e93e51b8-d6af-48b9-bd73-486d1d1c1efd,màn hình giá rẻ,2025-09-14
sản_phẩm chất_lượng tuyệt_vời mua cửa_hàng giao hàng,2,Sản phẩm chất lượng tuyệt vời mọi người nên mua shop giao hàng rất nhanh,5,https://shopee.vn/M%C3%A0n-H%C3%ACnh-h%C3%A3ng-GLOWY-19-20-22-24-Inch-M%E1%BB%9Bi-100-FULL-BOX-B%E1%BA%A3o-h%C3%A0nh-24-th%C3%A1ng-!!-i.1304738911.29005047166?extraParams=%7B%22display_model_id%22%3A157852291209%2C%22model_selection_logic%22%3A3%7D&sp_atk=e93e51b8-d6af-48b9-bd73-486d1d1c1efd&xptdk=e93e51b8-d6af-48b9-bd73-486d1d1c1efd,màn hình giá rẻ,2025-09-28
nhân_viên hàng bảo_hành hỗ_trợ,2,Nhân viên bán hàng và bảo hành hỗ trợ rất tốt,5,https://shopee.vn/M%C3%A0n-H%C3%ACnh-h%C3%A3ng-GLOWY-19-20-22-24-Inch-M%E1%BB%9Bi-100-FULL-BOX-B%E1%BA%A3o-h%C3%A0nh-24-th%C3%A1ng-!!-i.1304738911.29005047166?extraParams=%7B%22display_model_id%22%3A157852291209%2C%22model_selection_logic%22%3A3%7D&sp_atk=e93e51b8-d6af-48b9-bd73-486d1d1c1efd&xptdk=e93e51b8-d6af-48b9-bd73-486d1d1c1efd,màn hình giá rẻ,2025-12-09
"tính_năng nổi_bật sử_dụng . tổng_quang ổn chất_lượng sản_phẩm sản_phẩm đẹp , mô_tả . đánh_giá , sử_dụng 1 thời_gian . tạm 4 đi",2,"Tính năng nổi bật:chưa sử dụng nên chưa biết.nhìn tổng quang bên ngoài ổn
Chất lượng sản phẩm:chưa biết

Sp đẹp ,đúng mô tả.sẽ đánh giá sau,sau khi qua sử dụng 1 thời gian .
Tạm cho 4 ⭐ đi",4,https://shopee.vn/M%C3%A0n-H%C3%ACnh-h%C3%A3ng-GLOWY-19-20-22-24-Inch-M%E1%BB%9Bi-100-FULL-BOX-B%E1%BA%A3o-h%C3%A0nh-24-th%C3%A1ng-!!-i.1304738911.29005047166?extraParams=%7B%22display_model_id%22%3A157852291209%2C%22model_selection_logic%22%3A3%7D&sp_atk=e93e51b8-d6af-48b9-bd73-486d1d1c1efd&xptdk=e93e51b8-d6af-48b9-bd73-486d1d1c1efd,màn hình giá rẻ,2025-10-09
"sản_phẩm , ổn_áp ? giao nhnanh_chóng mua",2,"Sp tốt, ổn áp? Giao nhnanh chóng đến tay người mua",5,https://shopee.vn/M%C3%A0n-H%C3%ACnh-h%C3%A3ng-GLOWY-19-20-22-24-Inch-M%E1%BB%9Bi-100-FULL-BOX-B%E1%BA%A3o-h%C3%A0nh-24-th%C3%A1ng-!!-i.1304738911.29005047166?extraParams=%7B%22display_model_id%22%3A157852291209%2C%22model_selection_logic%22%3A3%7D&sp_atk=e93e51b8-d6af-48b9-bd73-486d1d1c1efd&xptdk=e93e51b8-d6af-48b9-bd73-486d1d1c1efd,màn hình giá rẻ,2025-07-20
đóng_gói ẩu_tả đường cẩn_thận đến_nơi méo_hộp bốc_dở 2 miếng xốp ngược_đầu đến_nơi bể 1 miếng xốp may màn_hình nguyên,0,Đóng gói ẩu tả; đường xa mà không cẩn thận; đến nơi méo hộp; ở trong thì bốc dở ra để lại vào 2 miếng xốp ngược đầu đến nơi bể 1 miếng xốp cũng may màn hình còn nguyên;,2,https://shopee.vn/M%C3%A0n-H%C3%ACnh-h%C3%A3ng-GLOWY-19-20-22-24-Inch-M%E1%BB%9Bi-100-FULL-BOX-B%E1%BA%A3o-h%C3%A0nh-24-th%C3%A1ng-!!-i.1304738911.29005047166?extraParams=%7B%22display_model_id%22%3A157852291209%2C%22model_selection_logic%22%3A3%7D&sp_atk=e93e51b8-d6af-48b9-bd73-486d1d1c1efd&xptdk=e93e51b8-d6af-48b9-bd73-486d1d1c1efd,màn hình giá rẻ,2026-01-15
"giao hàng hạn , bọc gói kỹ , tuy_nhiên tiền , màn to giá rẻ chất_lượng chống cháy , nhựa màn chân_đế rẻ_tiền , màn_hình màu sâu , màu nhạt hơi lóa , kiểu rẻ_tiền . bóc nilon màn thì_có nốt thâm , định_đổi cửa_hàng xài lỗi , cửa_hàng , ông_già màn to font chữ đổi . có_thể xài màn dell 24 full hd giá 5 củ chán . nói_chung a_e xác_định tối_ưu chi_phí hình mua .",2,"Giao hàng đúng hạn, bọc gói kỹ, tuy nhiên đúng tiền nào của nấy, màn to giá rẻ nên chất lượng chỉ ở mức chống cháy, nhựa màn chân đế khá rẻ tiền, màn hình màu ko sâu, tăng sáng thì màu nhạt hơi loá, kiểu tấm nền cũng rẻ tiền. Bóc nilon màn ra thì có một nốt thâm, định đổi nhưng shop nhờ xài nếu ko lỗi nặng, mà shop cũng xa, với ông già chỉ cần cái màn to tăng font chữ nhìn cho rõ nên thôi ko đổi nữa. Có thể do đang xài màn Dell 24 Full HD nhưng giá hơn 5 củ nên nhìn con này bị chán. Nói chung a e xác định tối ưu chi phí và chỉ cần nhìn thấy hình thì nên mua.",4,https://shopee.vn/M%C3%A0n-H%C3%ACnh-h%C3%A3ng-GLOWY-19-20-22-24-Inch-M%E1%BB%9Bi-100-FULL-BOX-B%E1%BA%A3o-h%C3%A0nh-24-th%C3%A1ng-!!-i.1304738911.29005047166?extraParams=%7B%22display_model_id%22%3A157852291209%2C%22model_selection_logic%22%3A3%7D&sp_atk=e93e51b8-d6af-48b9-bd73-486d1d1c1efd&xptdk=e93e51b8-d6af-48b9-bd73-486d1d1c1efd,màn hình giá rẻ,2026-01-07
"màu_sắc nịnh mắt hiển_thị xắc nét kết_nối hdmi giao hàng , đóng_gói cẩn_thận , thử cảm_ơn cửa_hàng",2,"Màu sắc:nịnh mắt
Hiển thị:xắc nét
Kết nối:hdmi

Giao hàng nhanh, đóng gói cẩn thận, chưa dùng thử cảm ơn shop ạ",5,https://shopee.vn/M%C3%A0n-H%C3%ACnh-h%C3%A3ng-GLOWY-19-20-22-24-Inch-M%E1%BB%9Bi-100-FULL-BOX-B%E1%BA%A3o-h%C3%A0nh-24-th%C3%A1ng-!!-i.1304738911.29005047166?extraParams=%7B%22display_model_id%22%3A157852291209%2C%22model_selection_logic%22%3A3%7D&sp_atk=e93e51b8-d6af-48b9-bd73-486d1d1c1efd&xptdk=e93e51b8-d6af-48b9-bd73-486d1d1c1efd,màn hình giá rẻ,2026-01-14
hàng mẫu . hình_ảnh đẹp . bền kg .,2,Hàng đúng mẫu. Hình ảnh đẹp. Không biết có bền kg .,5,https://shopee.vn/M%C3%A0n-H%C3%ACnh-h%C3%A3ng-GLOWY-19-20-22-24-Inch-M%E1%BB%9Bi-100-FULL-BOX-B%E1%BA%A3o-h%C3%A0nh-24-th%C3%A1ng-!!-i.1304738911.29005047166?extraParams=%7B%22display_model_id%22%3A157852291209%2C%22model_selection_logic%22%3A3%7D&sp_atk=e93e51b8-d6af-48b9-bd73-486d1d1c1efd&xptdk=e93e51b8-d6af-48b9-bd73-486d1d1c1efd,màn hình giá rẻ,2025-09-07
"chất_lượng sản_phẩm tính_năng nổi_bật rẻ hình_ảnh thông_số . có_điều đổi cao_cấp , như_thế cửa_hàng phản_hồi nhắc đổi cao_cấp im . báo 1 tiếng đc , ép . bảo_hành báo lỗi im trừ 2 hậu_mãi",1,"Chất lượng sản phẩm:Đúng
Tính năng nổi bật:Rẻ

Mọi cái đúng hình ảnh và thông số. Có điều khi nhận thấy ko thích muốn đổi sang loại cao cấp hơn, nt cho Shop có phản hồi nhưng khi nhắc đổi loại khác cao cấp hơn thì im luôn. Đc hay ko báo 1 tiếng là đc, có ai ép đâu. Sau bảo hành báo lỗi chắc im luôn quá nên trừ 2 * vì hậu mãi",3,https://shopee.vn/M%C3%A0n-H%C3%ACnh-h%C3%A3ng-GLOWY-19-20-22-24-Inch-M%E1%BB%9Bi-100-FULL-BOX-B%E1%BA%A3o-h%C3%A0nh-24-th%C3%A1ng-!!-i.1304738911.29005047166?extraParams=%7B%22display_model_id%22%3A157852291209%2C%22model_selection_logic%22%3A3%7D&sp_atk=e93e51b8-d6af-48b9-bd73-486d1d1c1efd&xptdk=e93e51b8-d6af-48b9-bd73-486d1d1c1efd,màn hình giá rẻ,2025-06-16
"chất_lượng sản_phẩm chất_lượng đảm_bảo tính_năng nổi_bật màn máy_tính 1 đánh_giá chất_lượng màn_hình tuyệt_vời , chạy ổn_định . độ nét , full hd mịn , màn mỏng nhẹ , cửa_hàng gói hàng vận_chuyển đảm_bảo",2,"Chất lượng sản phẩm:chất lượng đảm bảo
Tính năng nổi bật:màn máy tính

Đã dùng gần 1 tháng và đánh giá Chất lượng màn hình tuyệt vời, chạy ổn định. Độ nét tốt, full HD mịn, màn mỏng nhẹ, shop gói hàng vận chuyển đảm bảo",5,https://shopee.vn/M%C3%A0n-H%C3%ACnh-M%C3%A1y-T%C3%ADnh-Xiaomi-Monitor-A24i-EU-2026-IPS-144-Hz-6ms-1920-x-1080-FHD-24inch-B%E1%BA%A3o-H%C3%A0nh-36-Th%C3%A1ng-i.1167833879.41008562467?extraParams=%7B%22display_model_id%22%3A285721212623%2C%22model_selection_logic%22%3A3%7D&sp_atk=14e07f4e-07e3-484c-a03b-6cd6a3a031e3&xptdk=14e07f4e-07e3-484c-a03b-6cd6a3a031e3,màn hình giá rẻ,2026-01-01
tính_năng nổi_bật 120 hz chất_lượng sản_phẩm ok cửa_hàng đóng_gói cẩn_thận giao hàng . sản_phẩm mô_tả . ủng_hộ cửa_hàng .,2,"Tính năng nổi bật:120hz
Chất lượng sản phẩm:ok

Shop đóng gói cẩn thận và giao hàng nhanh. Sản phẩm đúng như mô tả. Sẽ ủng hộ shop lần sau nữa.",5,https://shopee.vn/M%C3%A0n-H%C3%ACnh-M%C3%A1y-T%C3%ADnh-Xiaomi-Monitor-A24i-EU-2026-IPS-144-Hz-6ms-1920-x-1080-FHD-24inch-B%E1%BA%A3o-H%C3%A0nh-36-Th%C3%A1ng-i.1167833879.41008562467?extraParams=%7B%22display_model_id%22%3A285721212623%2C%22model_selection_logic%22%3A3%7D&sp_atk=14e07f4e-07e3-484c-a03b-6cd6a3a031e3&xptdk=14e07f4e-07e3-484c-a03b-6cd6a3a031e3,màn hình giá rẻ,2025-10-26
"tính_năng nổi_bật ok chất_lượng sản_phẩm ok sản_phẩm chất_lượng , hiệu_quả . sản_phẩm hãng , giao hàng nhanh_chóng . đóng_gói cẩn_thận . sản_phẩm mô_tả .",2,"Tính năng nổi bật:Ok
Chất lượng sản phẩm:Ok

Sản phẩm chất lượng, hiệu quả. Sản phẩm chính hãng, giao hàng nhanh chóng. Đóng gói cẩn thận.Sản phẩm đúng mô tả.",5,https://shopee.vn/M%C3%A0n-H%C3%ACnh-M%C3%A1y-T%C3%ADnh-Xiaomi-Monitor-A24i-EU-2026-IPS-144-Hz-6ms-1920-x-1080-FHD-24inch-B%E1%BA%A3o-H%C3%A0nh-36-Th%C3%A1ng-i.1167833879.41008562467?extraParams=%7B%22display_model_id%22%3A285721212623%2C%22model_selection_logic%22%3A3%7D&sp_atk=14e07f4e-07e3-484c-a03b-6cd6a3a031e3&xptdk=14e07f4e-07e3-484c-a03b-6cd6a3a031e3,màn hình giá rẻ,2025-11-27
chất_lượng sản_phẩm ok tính_năng nổi_bật đẹp màn_hình xiaomi giá_cả phải_chăng mà_lại đẹp . xiaomi sử_dụng joystick đề_điều hướng tiện . bảo_hành 36 yếu_tố quyết_định mua .,2,"Chất lượng sản phẩm:ok
Tính năng nổi bật:đẹp

Màn hình Xiaomi giá cả phải chăng mà lại rất đẹp. Xiaomi sử dụng joystick đề điều hướng rất tiện. Bảo hành 36 tháng là yếu tố quyết định để tôi mua.",5,https://shopee.vn/M%C3%A0n-H%C3%ACnh-M%C3%A1y-T%C3%ADnh-Xiaomi-Monitor-A24i-EU-2026-IPS-144-Hz-6ms-1920-x-1080-FHD-24inch-B%E1%BA%A3o-H%C3%A0nh-36-Th%C3%A1ng-i.1167833879.41008562467?extraParams=%7B%22display_model_id%22%3A285721212623%2C%22model_selection_logic%22%3A3%7D&sp_atk=14e07f4e-07e3-484c-a03b-6cd6a3a031e3&xptdk=14e07f4e-07e3-484c-a03b-6cd6a3a031e3,màn hình giá rẻ,2025-10-14
"màn_hình đẹp , giá ổn tầm giá ok , đóng hàng kỹ chắc_chắn",2,"Màn hình đẹp, giá ổn trong tầm giá dùng ok, đóng hàng kỹ chắc chắn",5,https://shopee.vn/M%C3%A0n-H%C3%ACnh-M%C3%A1y-T%C3%ADnh-Xiaomi-Monitor-A24i-EU-2026-IPS-144-Hz-6ms-1920-x-1080-FHD-24inch-B%E1%BA%A3o-H%C3%A0nh-36-Th%C3%A1ng-i.1167833879.41008562467?extraParams=%7B%22display_model_id%22%3A285721212623%2C%22model_selection_logic%22%3A3%7D&sp_atk=14e07f4e-07e3-484c-a03b-6cd6a3a031e3&xptdk=14e07f4e-07e3-484c-a03b-6cd6a3a031e3,màn hình giá rẻ,2025-11-11
"sản_phẩm bao_bọc cẩn_thận , hiển_thị hình_ảnh mịn , đẹp , tuyệt_vời",2,"Sản phẩm được bao bọc cẩn thận, hiển thị hình ảnh mịn, đẹp, tuyệt vời",5,https://shopee.vn/M%C3%A0n-H%C3%ACnh-M%C3%A1y-T%C3%ADnh-Xiaomi-Monitor-A24i-EU-2026-IPS-144-Hz-6ms-1920-x-1080-FHD-24inch-B%E1%BA%A3o-H%C3%A0nh-36-Th%C3%A1ng-i.1167833879.41008562467?extraParams=%7B%22display_model_id%22%3A285721212623%2C%22model_selection_logic%22%3A3%7D&sp_atk=14e07f4e-07e3-484c-a03b-6cd6a3a031e3&xptdk=14e07f4e-07e3-484c-a03b-6cd6a3a031e3,màn hình giá rẻ,2025-12-22
"mua đợt nguyến mãi rẻ , màn_hình ổn , ngoại_hình đẹp , tiền",2,"mua đợt nguyến mãi nên khá rẻ, màn hình ổn, ngoại hình đẹp, đáng tiền",5,https://shopee.vn/M%C3%A0n-H%C3%ACnh-M%C3%A1y-T%C3%ADnh-Xiaomi-Monitor-A24i-EU-2026-IPS-144-Hz-6ms-1920-x-1080-FHD-24inch-B%E1%BA%A3o-H%C3%A0nh-36-Th%C3%A1ng-i.1167833879.41008562467?extraParams=%7B%22display_model_id%22%3A285721212623%2C%22model_selection_logic%22%3A3%7D&sp_atk=14e07f4e-07e3-484c-a03b-6cd6a3a031e3&xptdk=14e07f4e-07e3-484c-a03b-6cd6a3a031e3,màn hình giá rẻ,2025-10-22
