clean_comment,label,comment,rating,source_url,keyword,date
"máy chạy thật_sự khỏe , chạy hút ngóc nghách , tiếng kêu to ồn , chất_lượng chắc_độ bền cao_gói hàng cẩn_thận dập vỡ vận_chuyển , giao hàng tưởng_tượng , ( ( (",2,"máy chạy thật sự khoẻ luôn , chạy hút được mọi ngóc nghách trong nhà , tiếng kêu không bị to nên không ồn , chất lượng rất tốt chắc độ bền sẽ cao gói hàng cẩn thận không bị dập vỡ khi vận chuyển , giao hàng nhanh hơn mình tưởng tượng , =( =( =( =",5,https://shopee.vn/Robot-h%C3%BAt-b%E1%BB%A5i-lau-nh%C3%A0-ES330-l%E1%BB%B1c-h%C3%BAt-c%E1%BB%B1c-m%E1%BA%A1nh-3000PA-qu%C3%A9t-h%C3%BAt-lau-c%C3%B9ng-l%C3%BAc-b%E1%BA%A3o-h%C3%A0nh-24-Th%C3%A1ng.-i.1318936772.26457939772?extraParams=%7B%22display_model_id%22%3A410201441997%2C%22model_selection_logic%22%3A3%7D&sp_atk=587a7335-189c-42ab-bf5e-fd859382cde4&xptdk=587a7335-189c-42ab-bf5e-fd859382cde4,robot hút bụi lau nhà,2024-08-29
"đọc review cửa_hàng máy chạy mua quả_thật , giao hàng , sản_phẩm mô_tả , lực hút khỏe , ồn máy , mầu sắc_đẹp . ủng_hộ cửa_hàng hơn_nữa .",2,"Đọc review thấy shop bán máy này rất chạy nên nghe theo và mua thì quả thật, Giao hàng rất nhanh, sản phẩm đúng như mô tả, lực hút rất khỏe, không bị ồn và nặng như những máy khác, mầu sắc đẹp. Sẽ ủng hộ shop nhiều hơn nữa.",5,https://shopee.vn/Robot-h%C3%BAt-b%E1%BB%A5i-lau-nh%C3%A0-ES330-l%E1%BB%B1c-h%C3%BAt-c%E1%BB%B1c-m%E1%BA%A1nh-3000PA-qu%C3%A9t-h%C3%BAt-lau-c%C3%B9ng-l%C3%BAc-b%E1%BA%A3o-h%C3%A0nh-24-Th%C3%A1ng.-i.1318936772.26457939772?extraParams=%7B%22display_model_id%22%3A410201441997%2C%22model_selection_logic%22%3A3%7D&sp_atk=587a7335-189c-42ab-bf5e-fd859382cde4&xptdk=587a7335-189c-42ab-bf5e-fd859382cde4,robot hút bụi lau nhà,2024-08-28
giá_thành rẻ vậy_mà chất_lượng như_thế . phòng bình_thường lau_dọn hằng không_thể sạch sâu bụi mịn tóc kẹt gầm giường . mua,2,Mình không nghĩ với giá thành rẻ vậy mà chất lượng tốt như thế. Phòng mình bình thường lau dọn hằng ngày nhưng vẫn k thể sạch sâu bụi mịn và tóc trong kẹt dưới gầm giường. Đáng mua thật,5,https://shopee.vn/Robot-h%C3%BAt-b%E1%BB%A5i-lau-nh%C3%A0-ES330-l%E1%BB%B1c-h%C3%BAt-c%E1%BB%B1c-m%E1%BA%A1nh-3000PA-qu%C3%A9t-h%C3%BAt-lau-c%C3%B9ng-l%C3%BAc-b%E1%BA%A3o-h%C3%A0nh-24-Th%C3%A1ng.-i.1318936772.26457939772?extraParams=%7B%22display_model_id%22%3A410201441997%2C%22model_selection_logic%22%3A3%7D&sp_atk=587a7335-189c-42ab-bf5e-fd859382cde4&xptdk=587a7335-189c-42ab-bf5e-fd859382cde4,robot hút bụi lau nhà,2025-02-10
"cửa_hàng đóng_gói cẩn_thận , hộp nguyên_seal , thẻ bảo_hành kèm . sản_phẩm . cửa_hàng phục_vụ chuyên_nghiệp . thanks cửa_hàng tiếp_tục ủng_hộ .",2,"Shop đóng gói rất cẩn thận, hộp nguyên seal, có thẻ bảo hành kèm theo. Sản phẩm dùng tốt. Shop phục vụ rất chuyên nghiệp. Thanks shop và sẽ tiếp tục ủng hộ.",5,https://shopee.vn/Robot-h%C3%BAt-b%E1%BB%A5i-lau-nh%C3%A0-ES330-l%E1%BB%B1c-h%C3%BAt-c%E1%BB%B1c-m%E1%BA%A1nh-3000PA-qu%C3%A9t-h%C3%BAt-lau-c%C3%B9ng-l%C3%BAc-b%E1%BA%A3o-h%C3%A0nh-24-Th%C3%A1ng.-i.1318936772.26457939772?extraParams=%7B%22display_model_id%22%3A410201441997%2C%22model_selection_logic%22%3A3%7D&sp_atk=587a7335-189c-42ab-bf5e-fd859382cde4&xptdk=587a7335-189c-42ab-bf5e-fd859382cde4,robot hút bụi lau nhà,2024-08-24
"phục_vụ shop , sản_phẩm chất_lượng mong_đợi , bền , giá tiền , mua nhe_mn , chúc cửa_hàng mua mai đắt",2,"Thích cách phục vụ của shop, sản phẩm chất lượng hơn mong đợi, chỉ là ko biết có bền hay ko thôi, với giá tiền này mình thấy là quá OK rồi, nên mua nhe mn ,chúc shop mua mai bán đắt",5,https://shopee.vn/Robot-h%C3%BAt-b%E1%BB%A5i-lau-nh%C3%A0-ES330-l%E1%BB%B1c-h%C3%BAt-c%E1%BB%B1c-m%E1%BA%A1nh-3000PA-qu%C3%A9t-h%C3%BAt-lau-c%C3%B9ng-l%C3%BAc-b%E1%BA%A3o-h%C3%A0nh-24-Th%C3%A1ng.-i.1318936772.26457939772?extraParams=%7B%22display_model_id%22%3A410201441997%2C%22model_selection_logic%22%3A3%7D&sp_atk=587a7335-189c-42ab-bf5e-fd859382cde4&xptdk=587a7335-189c-42ab-bf5e-fd859382cde4,robot hút bụi lau nhà,2024-08-27
"cửa_hàng nhiệt_tình lắm kỹ cửa_hàng nhiệt_tình tư_vấn , cửa_hàng nhiệt_tình mua 1 e , tốt_nha 10",2,"shop này nhiệt tình lắm mình hỏi rất kỹ mà shop vẫn rất nhiệt tình tư vấn, vì shop nhiệt tình quá nên mua 1 e về dùng, ok nha 10 điểm",5,https://shopee.vn/Robot-h%C3%BAt-b%E1%BB%A5i-lau-nh%C3%A0-ES330-l%E1%BB%B1c-h%C3%BAt-c%E1%BB%B1c-m%E1%BA%A1nh-3000PA-qu%C3%A9t-h%C3%BAt-lau-c%C3%B9ng-l%C3%BAc-b%E1%BA%A3o-h%C3%A0nh-24-Th%C3%A1ng.-i.1318936772.26457939772?extraParams=%7B%22display_model_id%22%3A410201441997%2C%22model_selection_logic%22%3A3%7D&sp_atk=587a7335-189c-42ab-bf5e-fd859382cde4&xptdk=587a7335-189c-42ab-bf5e-fd859382cde4,robot hút bụi lau nhà,2024-08-30
trải_nghiệm thú_vị . hút cảm_biến nhạy bậc hè cầu_thang .,2,Dùng để trải nghiệm khá thú vị. Hút mạnh nhưng cảm biến ko nhạy khi ra bậc hè hoặc cầu thang.,5,https://shopee.vn/Robot-h%C3%BAt-b%E1%BB%A5i-lau-nh%C3%A0-ES330-l%E1%BB%B1c-h%C3%BAt-c%E1%BB%B1c-m%E1%BA%A1nh-3000PA-qu%C3%A9t-h%C3%BAt-lau-c%C3%B9ng-l%C3%BAc-b%E1%BA%A3o-h%C3%A0nh-24-Th%C3%A1ng.-i.1318936772.26457939772?extraParams=%7B%22display_model_id%22%3A410201441997%2C%22model_selection_logic%22%3A3%7D&sp_atk=587a7335-189c-42ab-bf5e-fd859382cde4&xptdk=587a7335-189c-42ab-bf5e-fd859382cde4,robot hút bụi lau nhà,2024-12-14
biết_bao_nhiêu cửa_hàng đánh_liều cửa_hàng dè_mừng rớt nước_mắt hàng đẹp hoạt_động êm_ru . cửa_hàng nhiệt_tình như_thế trl liền hè,2,Xem biết bao nhiêu cái shop mà đánh liều shop này Ai dè mừng rớt nước mắt nhận hàng đẹp mà hoạt động êm ru luôn🥰. Shop nhiệt tình nt hỏi là trl liền hè,5,https://shopee.vn/Robot-h%C3%BAt-b%E1%BB%A5i-lau-nh%C3%A0-ES330-l%E1%BB%B1c-h%C3%BAt-c%E1%BB%B1c-m%E1%BA%A1nh-3000PA-qu%C3%A9t-h%C3%BAt-lau-c%C3%B9ng-l%C3%BAc-b%E1%BA%A3o-h%C3%A0nh-24-Th%C3%A1ng.-i.1318936772.26457939772?extraParams=%7B%22display_model_id%22%3A410201441997%2C%22model_selection_logic%22%3A3%7D&sp_atk=587a7335-189c-42ab-bf5e-fd859382cde4&xptdk=587a7335-189c-42ab-bf5e-fd859382cde4,robot hút bụi lau nhà,2024-08-28
tính_năng nổi_bật sạc pin chạy 1 h30 chất_lượng sản_phẩm sử_dụng đọ_bền mô_tả ok hắn to . sản_phẩm,2,"Tính năng nổi bật:sạc đầy pin chạy được khoảng 1h30
Chất lượng sản phẩm:mới sử dụng nên chưa biết đọ bền
Đúng với mô tả:ok

Hắn to hơn mình nghĩ. Sp ok",5,https://shopee.vn/Robot-h%C3%BAt-b%E1%BB%A5i-lau-nh%C3%A0-ES330-l%E1%BB%B1c-h%C3%BAt-c%E1%BB%B1c-m%E1%BA%A1nh-3000PA-qu%C3%A9t-h%C3%BAt-lau-c%C3%B9ng-l%C3%BAc-b%E1%BA%A3o-h%C3%A0nh-24-Th%C3%A1ng.-i.1318936772.26457939772?extraParams=%7B%22display_model_id%22%3A410201441997%2C%22model_selection_logic%22%3A3%7D&sp_atk=587a7335-189c-42ab-bf5e-fd859382cde4&xptdk=587a7335-189c-42ab-bf5e-fd859382cde4,robot hút bụi lau nhà,2024-12-26
"sản_phẩm đóng_gói cẩn_thận , giao hàng hẹn , tiếng ồn to , hút bụi mịn bụi vải tóc hạt , gầm ghế gầm bàn gầm giường_hút sạch , nói_chung hài_lòng chất_lượng giá ổn , hoạt_động 2 hút đống bụi vệ_sinh , ủng_hộ cửa_hàng",2,"Sản phẩm đóng gói cẩn thận, giao hàng đúng hẹn, tiếng ồn ko quá to, hút được bụi mịn bụi vải tóc hạt nhỏ, gầm ghế gầm bàn gầm giường hút khá sạch, nói chung hài lòng với chất lượng và giá vậy cũng ổn, hoạt động 2 ngày hút được cả đống bụi 😂 dễ vệ sinh, sẽ còn ủng hộ shop 👍🏻",5,https://shopee.vn/Robot-h%C3%BAt-b%E1%BB%A5i-lau-nh%C3%A0-ES330-l%E1%BB%B1c-h%C3%BAt-c%E1%BB%B1c-m%E1%BA%A1nh-3000PA-qu%C3%A9t-h%C3%BAt-lau-c%C3%B9ng-l%C3%BAc-b%E1%BA%A3o-h%C3%A0nh-24-Th%C3%A1ng.-i.1318936772.26457939772?extraParams=%7B%22display_model_id%22%3A410201441997%2C%22model_selection_logic%22%3A3%7D&sp_atk=587a7335-189c-42ab-bf5e-fd859382cde4&xptdk=587a7335-189c-42ab-bf5e-fd859382cde4,robot hút bụi lau nhà,2024-08-29
"hàng . sạc pin xong ẻm . kkk . sen làm_việc trâu_bò ( 2 tiếng tắt ) ) ) , hài_lòng cửa_hàng",2,"Mình đã nhận hàng . Sau khi sạc pin xong là cho ẻm vào việc. Kkk. Con sen làm việc tốt và trâu bò (gần 2 tiếng thấy chưa tắt :))) , rất hài lòng nhé shop",5,https://shopee.vn/Robot-h%C3%BAt-b%E1%BB%A5i-lau-nh%C3%A0-ES330-l%E1%BB%B1c-h%C3%BAt-c%E1%BB%B1c-m%E1%BA%A1nh-3000PA-qu%C3%A9t-h%C3%BAt-lau-c%C3%B9ng-l%C3%BAc-b%E1%BA%A3o-h%C3%A0nh-24-Th%C3%A1ng.-i.1318936772.26457939772?extraParams=%7B%22display_model_id%22%3A410201441997%2C%22model_selection_logic%22%3A3%7D&sp_atk=587a7335-189c-42ab-bf5e-fd859382cde4&xptdk=587a7335-189c-42ab-bf5e-fd859382cde4,robot hút bụi lau nhà,2024-08-25
"chất_lượng sản_phẩm ok mô_tả máy hút , giá như_vậy rẻ xài ổn . diện_tích phòng . có_điều mau pin",2,"Chất lượng sản phẩm:ok
Đúng với mô tả:đúng

máy hút mạnh, giá như vậy là rẻ mà xài quá ổn. Chỉ dùng trong diện tích phòng thôi. Có điều mau hết pin",5,https://shopee.vn/Robot-h%C3%BAt-b%E1%BB%A5i-lau-nh%C3%A0-ES330-l%E1%BB%B1c-h%C3%BAt-c%E1%BB%B1c-m%E1%BA%A1nh-3000PA-qu%C3%A9t-h%C3%BAt-lau-c%C3%B9ng-l%C3%BAc-b%E1%BA%A3o-h%C3%A0nh-24-Th%C3%A1ng.-i.1318936772.26457939772?extraParams=%7B%22display_model_id%22%3A410201441997%2C%22model_selection_logic%22%3A3%7D&sp_atk=587a7335-189c-42ab-bf5e-fd859382cde4&xptdk=587a7335-189c-42ab-bf5e-fd859382cde4,robot hút bụi lau nhà,2025-04-25
"máy chạy êm ồn_ào máy cũ , chạy_khôn ngu máy cũ . máy to tưởng_tượng . cửa_hàng tv nhiệt_tình , rep tl clip gđ . chuẩn_bị hàng giao hàng nh",2,"Máy chạy êm k ồn ào như máy cũ,chạy khôn chứ k ngu như máy cũ trc dùng.máy to nặng hơn tưởng tượng. Shop tv nhiệt tình,rep tl khách rất nhanh có clip gđ rất dễ hiểu.chuẩn bị hàng và giao hàng rất nh",5,https://shopee.vn/Robot-h%C3%BAt-b%E1%BB%A5i-lau-nh%C3%A0-ES330-l%E1%BB%B1c-h%C3%BAt-c%E1%BB%B1c-m%E1%BA%A1nh-3000PA-qu%C3%A9t-h%C3%BAt-lau-c%C3%B9ng-l%C3%BAc-b%E1%BA%A3o-h%C3%A0nh-24-Th%C3%A1ng.-i.1318936772.26457939772?extraParams=%7B%22display_model_id%22%3A410201441997%2C%22model_selection_logic%22%3A3%7D&sp_atk=587a7335-189c-42ab-bf5e-fd859382cde4&xptdk=587a7335-189c-42ab-bf5e-fd859382cde4,robot hút bụi lau nhà,2024-08-29
"máy hút sạch , lau , ồn lắm . sạc máy có_thể chạy 60 phút , ngon tầm giá",2,"Máy hút sạch, không lau được, không ồn lắm. Sạc đầy máy có thể chạy được 60 phút, ngon trong tầm giá",5,https://shopee.vn/Robot-h%C3%BAt-b%E1%BB%A5i-lau-nh%C3%A0-ES330-l%E1%BB%B1c-h%C3%BAt-c%E1%BB%B1c-m%E1%BA%A1nh-3000PA-qu%C3%A9t-h%C3%BAt-lau-c%C3%B9ng-l%C3%BAc-b%E1%BA%A3o-h%C3%A0nh-24-Th%C3%A1ng.-i.1318936772.26457939772?extraParams=%7B%22display_model_id%22%3A410201441997%2C%22model_selection_logic%22%3A3%7D&sp_atk=587a7335-189c-42ab-bf5e-fd859382cde4&xptdk=587a7335-189c-42ab-bf5e-fd859382cde4,robot hút bụi lau nhà,2024-11-14
"cửa_hàng đóng_gói hàng chắc_chắn , cẩn_thận . sản_phẩm đẹp chất_lượng . xài bao_giờ ban_đầu hút . đi khắp chỗ , tiếng . mua chủ_yếu hút_bụi lông_cún hút , lau ổn phết lau khô ướt",2,"Shop đóng gói hàng chắc chắn, cẩn thận . Sản phẩm nhìn đẹp và chất lượng. Mình chưa xài những loại này bao giờ nên thấy ban đầu hút tốt. Nó đi khắp mọi chỗ trong nhà, tiếng nhỏ. Mua chủ yếu cho nó hút bụi và lông cún nhưng hút tốt, lau nhà thì cũng ổn ra phết lau cả khô và ướt",5,https://shopee.vn/Robot-h%C3%BAt-b%E1%BB%A5i-lau-nh%C3%A0-ES330-l%E1%BB%B1c-h%C3%BAt-c%E1%BB%B1c-m%E1%BA%A1nh-3000PA-qu%C3%A9t-h%C3%BAt-lau-c%C3%B9ng-l%C3%BAc-b%E1%BA%A3o-h%C3%A0nh-24-Th%C3%A1ng.-i.1318936772.26457939772?extraParams=%7B%22display_model_id%22%3A410201441997%2C%22model_selection_logic%22%3A3%7D&sp_atk=587a7335-189c-42ab-bf5e-fd859382cde4&xptdk=587a7335-189c-42ab-bf5e-fd859382cde4,robot hút bụi lau nhà,2024-08-28
"mô_tả hàng giao mô_tả . chất_lượng sản_phẩm sử_dụng ok . sản_phẩm giao hàng quảng_cáo , sử_dụng ok , hy_vọng sử_dụng lâu_dài , người_thân mua ủng_hộ cửa_hàng .",2,"Đúng với mô tả:hàng giao đúng mô tả.
Chất lượng sản phẩm:mới sử dụng thấy rất ok.

Sản phẩm giao hàng giống như quảng cáo, mới sử dụng rất ok, hy vọng sẽ sử dụng được lâu dài, nếu có thêm cho người thân sẽ mua ủng hộ shop lần sau.",5,https://shopee.vn/Robot-h%C3%BAt-b%E1%BB%A5i-lau-nh%C3%A0-ES330-l%E1%BB%B1c-h%C3%BAt-c%E1%BB%B1c-m%E1%BA%A1nh-3000PA-qu%C3%A9t-h%C3%BAt-lau-c%C3%B9ng-l%C3%BAc-b%E1%BA%A3o-h%C3%A0nh-24-Th%C3%A1ng.-i.1318936772.26457939772?extraParams=%7B%22display_model_id%22%3A410201441997%2C%22model_selection_logic%22%3A3%7D&sp_atk=587a7335-189c-42ab-bf5e-fd859382cde4&xptdk=587a7335-189c-42ab-bf5e-fd859382cde4,robot hút bụi lau nhà,2024-09-19
"máy chạy hút , gọn_nhẹ sử_dụng , vệ_sinh máy tón diện_tích , giao hàng , hôm 2 có_mặt . hài_lòng",2,"Máy chạy hút mạnh, gọn nhẹ dễ sử dụng, vệ sinh máy và không tón diện tích trong nhà, giao hàng nhanh, mới đặt hôm trc 2 ngày sau đã có mặt tại nhà. rất hài lòng",5,https://shopee.vn/Robot-h%C3%BAt-b%E1%BB%A5i-lau-nh%C3%A0-ES330-l%E1%BB%B1c-h%C3%BAt-c%E1%BB%B1c-m%E1%BA%A1nh-3000PA-qu%C3%A9t-h%C3%BAt-lau-c%C3%B9ng-l%C3%BAc-b%E1%BA%A3o-h%C3%A0nh-24-Th%C3%A1ng.-i.1318936772.26457939772?extraParams=%7B%22display_model_id%22%3A410201441997%2C%22model_selection_logic%22%3A3%7D&sp_atk=587a7335-189c-42ab-bf5e-fd859382cde4&xptdk=587a7335-189c-42ab-bf5e-fd859382cde4,robot hút bụi lau nhà,2024-08-25
"cảm_ơn cửa_hàng , mặt_hàng ngoại_hình , chất_lượng giá , độ bền_chờ thời_gian . mong_muốn mua . cảm_ơn",2,"Cảm ơn shop , mặt hàng tốt về ngoại hình , chất lượng ok với giá , độ bền chờ thời gian . mong muốn mua thêm . xin cảm ơn",5,https://shopee.vn/Robot-h%C3%BAt-b%E1%BB%A5i-lau-nh%C3%A0-ES330-l%E1%BB%B1c-h%C3%BAt-c%E1%BB%B1c-m%E1%BA%A1nh-3000PA-qu%C3%A9t-h%C3%BAt-lau-c%C3%B9ng-l%C3%BAc-b%E1%BA%A3o-h%C3%A0nh-24-Th%C3%A1ng.-i.1318936772.26457939772?extraParams=%7B%22display_model_id%22%3A410201441997%2C%22model_selection_logic%22%3A3%7D&sp_atk=587a7335-189c-42ab-bf5e-fd859382cde4&xptdk=587a7335-189c-42ab-bf5e-fd859382cde4,robot hút bụi lau nhà,2024-08-28
"mua lăn tăn_vi cửa_hàng , cửa_hàng chính_sách bảo_hành , an_tâm mua thời_gian sử_dụng thây sản_phẩm ưng_ý , hài_lòng sản_phẩm",2,"lúc mua thì cũng lăn tăn vi nhiều shop cũng bán, nhưng mình chọn shop này do có chính sách bảo hành, nên an tâm mua qua thời gian sử dụng thây sp khá ưng ý, thấy hài lòng về sp",5,https://shopee.vn/Robot-h%C3%BAt-b%E1%BB%A5i-lau-nh%C3%A0-ES330-l%E1%BB%B1c-h%C3%BAt-c%E1%BB%B1c-m%E1%BA%A1nh-3000PA-qu%C3%A9t-h%C3%BAt-lau-c%C3%B9ng-l%C3%BAc-b%E1%BA%A3o-h%C3%A0nh-24-Th%C3%A1ng.-i.1318936772.26457939772?extraParams=%7B%22display_model_id%22%3A410201441997%2C%22model_selection_logic%22%3A3%7D&sp_atk=587a7335-189c-42ab-bf5e-fd859382cde4&xptdk=587a7335-189c-42ab-bf5e-fd859382cde4,robot hút bụi lau nhà,2024-08-29
tính_năng nổi_bật nhẹ mô_tả chất_lượng sản_phẩm ổn giá_cả tạm ổn . test 2 chạy ok . tiếng kêu hơi to_chút .,2,"Tính năng nổi bật:Nhẹ
Đúng với mô tả:Đúng
Chất lượng sản phẩm:Ổn

So về giá cả thì cũng tạm ổn. Mình mới test 2 ngày thấy chạy ok. Tiếng kêu hơi to chút.",5,https://shopee.vn/Robot-h%C3%BAt-b%E1%BB%A5i-lau-nh%C3%A0-ES330-l%E1%BB%B1c-h%C3%BAt-c%E1%BB%B1c-m%E1%BA%A1nh-3000PA-qu%C3%A9t-h%C3%BAt-lau-c%C3%B9ng-l%C3%BAc-b%E1%BA%A3o-h%C3%A0nh-24-Th%C3%A1ng.-i.1318936772.26457939772?extraParams=%7B%22display_model_id%22%3A410201441997%2C%22model_selection_logic%22%3A3%7D&sp_atk=587a7335-189c-42ab-bf5e-fd859382cde4&xptdk=587a7335-189c-42ab-bf5e-fd859382cde4,robot hút bụi lau nhà,2025-07-09
"test thử liền . chạy ok , hút tóc lông chó mèo hiệu_quả . tiếng máy ồn lắm",2,"Nhận về test thử liền . Chạy cũng Ok, hút tóc và lông chó mèo rất hiệu quả. Tiếng máy cũng không ồn lắm",5,https://shopee.vn/Robot-h%C3%BAt-b%E1%BB%A5i-lau-nh%C3%A0-ES330-l%E1%BB%B1c-h%C3%BAt-c%E1%BB%B1c-m%E1%BA%A1nh-3000PA-qu%C3%A9t-h%C3%BAt-lau-c%C3%B9ng-l%C3%BAc-b%E1%BA%A3o-h%C3%A0nh-24-Th%C3%A1ng.-i.1318936772.26457939772?extraParams=%7B%22display_model_id%22%3A410201441997%2C%22model_selection_logic%22%3A3%7D&sp_atk=587a7335-189c-42ab-bf5e-fd859382cde4&xptdk=587a7335-189c-42ab-bf5e-fd859382cde4,robot hút bụi lau nhà,2024-08-23
"tính_năng nổi_bật hút bụi chất_lượng sản_phẩm tét mô_tả mô_tả đóng_gói cẩn_thận , giao hàng , tuy_nhiên chạy thẳng cửa , chắn rô_bốt . hút sợi tóc . độ bền đánh_giá bổ_sung .",2,"Tính năng nổi bật:hút bụi
Chất lượng sản phẩm:mới tét thấy cũng được
Đúng với mô tả:gần đúng mô tả

Đóng gói cẩn thận, giao hàng nhanh, tuy nhiên vẫn bị chạy thẳng ra cửa, phải có chắn thì rô bốt mới quay lại. Hút được cả sợi tóc dài . Độ bền thì đánh giá bổ sung sau. OK",5,https://shopee.vn/Robot-h%C3%BAt-b%E1%BB%A5i-lau-nh%C3%A0-ES330-l%E1%BB%B1c-h%C3%BAt-c%E1%BB%B1c-m%E1%BA%A1nh-3000PA-qu%C3%A9t-h%C3%BAt-lau-c%C3%B9ng-l%C3%BAc-b%E1%BA%A3o-h%C3%A0nh-24-Th%C3%A1ng.-i.1318936772.26457939772?extraParams=%7B%22display_model_id%22%3A410201441997%2C%22model_selection_logic%22%3A3%7D&sp_atk=587a7335-189c-42ab-bf5e-fd859382cde4&xptdk=587a7335-189c-42ab-bf5e-fd859382cde4,robot hút bụi lau nhà,2025-08-30
"sản_phẩm hàng giao , nhẹ , gọn tốn diện_tích , màu đẹp , sản_phẩm test ok , sử_dụng quảng_cáo cửa_hàng",2,"sản phẩm đúng với hàng giao bán, nhẹ, gọn k tốn diện tích, màu đẹp nhìn sang, sản phẩm test thấy cũng ok, sử dụng lâu sẽ quảng cáo cho shop",5,https://shopee.vn/Robot-h%C3%BAt-b%E1%BB%A5i-lau-nh%C3%A0-ES330-l%E1%BB%B1c-h%C3%BAt-c%E1%BB%B1c-m%E1%BA%A1nh-3000PA-qu%C3%A9t-h%C3%BAt-lau-c%C3%B9ng-l%C3%BAc-b%E1%BA%A3o-h%C3%A0nh-24-Th%C3%A1ng.-i.1318936772.26457939772?extraParams=%7B%22display_model_id%22%3A410201441997%2C%22model_selection_logic%22%3A3%7D&sp_atk=587a7335-189c-42ab-bf5e-fd859382cde4&xptdk=587a7335-189c-42ab-bf5e-fd859382cde4,robot hút bụi lau nhà,2024-08-29
"giao hàng , cửa_hàng nhiệt_tình tư_vấn hàng , mua sử_dụng , mua giúp mua sale rẻ . sử_dụng hút bụi sạch_sẻ . nói_chung tuyệt_vời",2,"Giao hàng nhanh, shop nhiệt tình tư vấn sau khi nhận hàng, mình đã mua sử dụng rồi, giờ mua giúp bạn lại mua được sale nên rất rẻ. Sử dụng hút bụi sạch sẻ. Nói chung là tuyệt vời ạ",5,https://shopee.vn/Robot-h%C3%BAt-b%E1%BB%A5i-lau-nh%C3%A0-ES330-l%E1%BB%B1c-h%C3%BAt-c%E1%BB%B1c-m%E1%BA%A1nh-3000PA-qu%C3%A9t-h%C3%BAt-lau-c%C3%B9ng-l%C3%BAc-b%E1%BA%A3o-h%C3%A0nh-24-Th%C3%A1ng.-i.1318936772.26457939772?extraParams=%7B%22display_model_id%22%3A410201441997%2C%22model_selection_logic%22%3A3%7D&sp_atk=587a7335-189c-42ab-bf5e-fd859382cde4&xptdk=587a7335-189c-42ab-bf5e-fd859382cde4,robot hút bụi lau nhà,2024-08-29
"lựa bao_nhiêu cửa_hàng cuối_cùng cửa_hàng , cửa_hàng nhiệt_tình nhẹ_nhàng lắm , hàng xong test ổn lắm nha , 1 thời_gian bền ủng_hộ tiếp",2,"lựa bao nhiêu shop cuối cùng chọn shop này , vì shop nhiệt tình và nhẹ nhàng lắm, nhận hàng xong test thấy ổn lắm nha, dùng 1 thời gian nếu bền sẽ quay lại ủng hộ tiếp",5,https://shopee.vn/Robot-h%C3%BAt-b%E1%BB%A5i-lau-nh%C3%A0-ES330-l%E1%BB%B1c-h%C3%BAt-c%E1%BB%B1c-m%E1%BA%A1nh-3000PA-qu%C3%A9t-h%C3%BAt-lau-c%C3%B9ng-l%C3%BAc-b%E1%BA%A3o-h%C3%A0nh-24-Th%C3%A1ng.-i.1318936772.26457939772?extraParams=%7B%22display_model_id%22%3A410201441997%2C%22model_selection_logic%22%3A3%7D&sp_atk=587a7335-189c-42ab-bf5e-fd859382cde4&xptdk=587a7335-189c-42ab-bf5e-fd859382cde4,robot hút bụi lau nhà,2024-12-13
"giao hàng , cửa_hàng nhiệt_tình tư_vấn hàng , mua sử_dụng lắm , mua giúp mua sale rẻ .",2,"Giao hàng nhanh, shop nhiệt tình tư vấn sau khi nhận hàng, mình đã mua sử dụng rồi ok lắm, giờ mua giúp bạn lại mua được sale nên rất rẻ.",5,https://shopee.vn/Robot-h%C3%BAt-b%E1%BB%A5i-lau-nh%C3%A0-ES330-l%E1%BB%B1c-h%C3%BAt-c%E1%BB%B1c-m%E1%BA%A1nh-3000PA-qu%C3%A9t-h%C3%BAt-lau-c%C3%B9ng-l%C3%BAc-b%E1%BA%A3o-h%C3%A0nh-24-Th%C3%A1ng.-i.1318936772.26457939772?extraParams=%7B%22display_model_id%22%3A410201441997%2C%22model_selection_logic%22%3A3%7D&sp_atk=587a7335-189c-42ab-bf5e-fd859382cde4&xptdk=587a7335-189c-42ab-bf5e-fd859382cde4,robot hút bụi lau nhà,2024-09-18
mô_tả chất_lượng sản_phẩm đung_tốt tính_năng nổi_bật hút bụi ổn đánh_giá,2,"Đúng với mô tả:đúng
Chất lượng sản phẩm:đung ok
Tính năng nổi bật:hút bụi

Dùng cũng ổn đánh giá nhận sao",5,https://shopee.vn/Robot-h%C3%BAt-b%E1%BB%A5i-lau-nh%C3%A0-ES330-l%E1%BB%B1c-h%C3%BAt-c%E1%BB%B1c-m%E1%BA%A1nh-3000PA-qu%C3%A9t-h%C3%BAt-lau-c%C3%B9ng-l%C3%BAc-b%E1%BA%A3o-h%C3%A0nh-24-Th%C3%A1ng.-i.1318936772.26457939772?extraParams=%7B%22display_model_id%22%3A410201441997%2C%22model_selection_logic%22%3A3%7D&sp_atk=587a7335-189c-42ab-bf5e-fd859382cde4&xptdk=587a7335-189c-42ab-bf5e-fd859382cde4,robot hút bụi lau nhà,2025-07-11
"hàng chất_lượng quảng_cáo , tìm_hiểu kỹ bình_luận quyết_định mua 1 chạy thử ok . giới_thiệu người_thân mua ủng_hộ cửa_hàng",2,"Hàng chất lượng đúng như quảng cáo, mình cũng tìm hiểu rất kỹ thấy nhiều người bình luận tốt nên cũng quyết định mua 1 con về chạy thử thấy khá là ok. mình sẽ giới thiệu người thân mua ủng hộ shop",5,https://shopee.vn/Robot-h%C3%BAt-b%E1%BB%A5i-lau-nh%C3%A0-ES330-l%E1%BB%B1c-h%C3%BAt-c%E1%BB%B1c-m%E1%BA%A1nh-3000PA-qu%C3%A9t-h%C3%BAt-lau-c%C3%B9ng-l%C3%BAc-b%E1%BA%A3o-h%C3%A0nh-24-Th%C3%A1ng.-i.1318936772.26457939772?extraParams=%7B%22display_model_id%22%3A410201441997%2C%22model_selection_logic%22%3A3%7D&sp_atk=587a7335-189c-42ab-bf5e-fd859382cde4&xptdk=587a7335-189c-42ab-bf5e-fd859382cde4,robot hút bụi lau nhà,2024-08-25
"mẫu hàng giao tương_đối , chất_lượng 1 thời_gian , giá rẻ",2,"Đúng mẫu đúng hàng Giao tương đối nhanh , chất lượng thì phải dùng 1 thời gian mới biết được , mà với giá rẻ vậy thì quá oke rồi",5,https://shopee.vn/Robot-h%C3%BAt-b%E1%BB%A5i-lau-nh%C3%A0-ES330-l%E1%BB%B1c-h%C3%BAt-c%E1%BB%B1c-m%E1%BA%A1nh-3000PA-qu%C3%A9t-h%C3%BAt-lau-c%C3%B9ng-l%C3%BAc-b%E1%BA%A3o-h%C3%A0nh-24-Th%C3%A1ng.-i.1318936772.26457939772?extraParams=%7B%22display_model_id%22%3A410201441997%2C%22model_selection_logic%22%3A3%7D&sp_atk=587a7335-189c-42ab-bf5e-fd859382cde4&xptdk=587a7335-189c-42ab-bf5e-fd859382cde4,robot hút bụi lau nhà,2024-08-28
"sản_phẩm giao mẫu . ưng phụ_kiện đi kèm đầy_đủ mua . test ok , máy_êm hoạt_động ồn , hút ..",2,"SP giao đúng như mẫu. Ưng cái là phụ kiện đi kèm cũng đầy đủ chứ k phải mua thêm gì hết. test thấy rất ok,máy êm mà hoạt động k gây ồn ,hút rất tốt..",5,https://shopee.vn/Robot-h%C3%BAt-b%E1%BB%A5i-lau-nh%C3%A0-ES330-l%E1%BB%B1c-h%C3%BAt-c%E1%BB%B1c-m%E1%BA%A1nh-3000PA-qu%C3%A9t-h%C3%BAt-lau-c%C3%B9ng-l%C3%BAc-b%E1%BA%A3o-h%C3%A0nh-24-Th%C3%A1ng.-i.1318936772.26457939772?extraParams=%7B%22display_model_id%22%3A410201441997%2C%22model_selection_logic%22%3A3%7D&sp_atk=587a7335-189c-42ab-bf5e-fd859382cde4&xptdk=587a7335-189c-42ab-bf5e-fd859382cde4,robot hút bụi lau nhà,2024-08-29
"chất_lượng sản_phẩm quảng_cáo tham_khảo đánh_giá mua , q_định mua 02 c 1,2_tr . hàng , đồng_kiểm , máy chạy thử , hài_lòng . cảm_ơn trang_tmđt shopee ct tnhh lacy vn mua !",2,"Chất lượng sản phẩm:Đúng quảng cáo

Tham khảo các đánh giá của khách mua trước, tôi q định mua 02c = 1,2 tr. Nhận hàng, đồng kiểm, cho máy chạy thử, thấy rất hài lòng. Rất cảm ơn trang TMĐT Shopee & CT TNHH LACY VN; nên mua mọi người ạ!",5,https://shopee.vn/Robot-h%C3%BAt-b%E1%BB%A5i-lau-nh%C3%A0-ES330-l%E1%BB%B1c-h%C3%BAt-c%E1%BB%B1c-m%E1%BA%A1nh-3000PA-qu%C3%A9t-h%C3%BAt-lau-c%C3%B9ng-l%C3%BAc-b%E1%BA%A3o-h%C3%A0nh-24-Th%C3%A1ng.-i.1318936772.26457939772?extraParams=%7B%22display_model_id%22%3A410201441997%2C%22model_selection_logic%22%3A3%7D&sp_atk=587a7335-189c-42ab-bf5e-fd859382cde4&xptdk=587a7335-189c-42ab-bf5e-fd859382cde4,robot hút bụi lau nhà,2025-02-26
