clean_comment,label,comment,rating,source_url,keyword,date
"cơ_quan , đơn_vị bộ_tư_lệnh thủ_đô hà_nội chủ_trì tổ_chức , triển_khai vận_chuyển , xây_dựng trận_địa bắn hiệp_đồng công_an thành_phố bảo_đảm an_ninh trật_tự , phòng cháy , chữa_cháy . công_an thành_phố xây_dựng phương_án an_ninh , giao_thông , phòng cháy , chữa_cháy , hướng_dẫn phân_luồng giao_thông , bảo_vệ an_ninh khu_vực bắn , , bắn pháo_hoa",2,"Các cơ quan, đơn vị gồm: Bộ Tư lệnh Thủ đô Hà Nội chủ trì tổ chức, triển khai vận chuyển, xây dựng trận địa bắn; hiệp đồng với Công an thành phố bảo đảm an ninh trật tự, phòng cháy, chữa cháy.

Công an thành phố xây dựng phương án an ninh, giao thông, phòng cháy, chữa cháy, hướng dẫn phân luồng giao thông, bảo vệ an ninh khu vực bắn trước, trong, sau khi bắn pháo hoa…",5,https://shopee.vn/Robot-h%C3%BAt-b%E1%BB%A5i-lau-nh%C3%A0-Xiaomi-Robot-Vacuum-X20-X20-Plus-L%E1%BB%B1c-h%C3%BAt-6000Pa-i.1396654883.29318291673?extraParams=%7B%22display_model_id%22%3A252078123004%2C%22model_selection_logic%22%3A3%7D&sp_atk=594e0978-23a2-4573-b7bd-e6907d479345&xptdk=594e0978-23a2-4573-b7bd-e6907d479345,robot hút bụi lau nhà,2025-07-25
xe_máy điện roma sx 2023 sở_hữu_động_cơ công_suất 1000 w . xe có_thể vận_hành vận_tốc tối_đa 60 km / h . 5 bình_ắc quy 60 v - 20 ah cấp_điện roma sx 2023 hoàn_toàn di_chuyển quãng đường 80 km sạc .,2,Xe máy điện DK Roma SX 2023 sở hữu động cơ công suất 1000W. Xe có thể vận hành với vận tốc tối đa 60km/h. Với 5 bình ắc quy 60V - 20Ah làm nguồn cấp điện thì DK Roma SX 2023 hoàn toàn di chuyển quãng đường hơn 80km trong một lần sạc đầy.,5,https://shopee.vn/Robot-h%C3%BAt-b%E1%BB%A5i-lau-nh%C3%A0-Xiaomi-Robot-Vacuum-X20-X20-Plus-L%E1%BB%B1c-h%C3%BAt-6000Pa-i.1396654883.29318291673?extraParams=%7B%22display_model_id%22%3A252078123004%2C%22model_selection_logic%22%3A3%7D&sp_atk=594e0978-23a2-4573-b7bd-e6907d479345&xptdk=594e0978-23a2-4573-b7bd-e6907d479345,robot hút bụi lau nhà,2025-12-10
"lau sạch , ưng",2,"Lau rất sạch, rất ưng",5,https://shopee.vn/Robot-h%C3%BAt-b%E1%BB%A5i-lau-nh%C3%A0-Xiaomi-Robot-Vacuum-X20-X20-Plus-L%E1%BB%B1c-h%C3%BAt-6000Pa-i.1396654883.29318291673?extraParams=%7B%22display_model_id%22%3A252078123004%2C%22model_selection_logic%22%3A3%7D&sp_atk=594e0978-23a2-4573-b7bd-e6907d479345&xptdk=594e0978-23a2-4573-b7bd-e6907d479345,robot hút bụi lau nhà,2025-06-22
chất_lượng sản_phẩm phù_hợp giá tiền ý_kiến,2,Chất lượng sản phẩm khá phù hợp với giá tiền nên không có ý kiến gì thêm nữa,5,https://shopee.vn/Robot-h%C3%BAt-b%E1%BB%A5i-lau-nh%C3%A0-Xiaomi-Robot-Vacuum-X20-X20-Plus-L%E1%BB%B1c-h%C3%BAt-6000Pa-i.1396654883.29318291673?extraParams=%7B%22display_model_id%22%3A252078123004%2C%22model_selection_logic%22%3A3%7D&sp_atk=594e0978-23a2-4573-b7bd-e6907d479345&xptdk=594e0978-23a2-4573-b7bd-e6907d479345,robot hút bụi lau nhà,2025-12-22
. sản_phẩm . ủng_hộ . tiếp_tục ủng_hộ sản_phẩm,2,Tốt . Sản phẩm rất là tốt . Mọi người nên ủng hộ . Tiếp tục ủng hộ sản phẩm,5,https://shopee.vn/Robot-h%C3%BAt-b%E1%BB%A5i-lau-nh%C3%A0-Xiaomi-Robot-Vacuum-X20-X20-Plus-L%E1%BB%B1c-h%C3%BAt-6000Pa-i.1396654883.29318291673?extraParams=%7B%22display_model_id%22%3A252078123004%2C%22model_selection_logic%22%3A3%7D&sp_atk=594e0978-23a2-4573-b7bd-e6907d479345&xptdk=594e0978-23a2-4573-b7bd-e6907d479345,robot hút bụi lau nhà,2025-09-10
phù_hợp giá tiền mua thử sử_dụng đánh_giá xu,2,Phù hợp với giá tiền đáng mua nên thử sử dụng mọi đánh giá chỉ để nhận xu,5,https://shopee.vn/Robot-h%C3%BAt-b%E1%BB%A5i-lau-nh%C3%A0-Xiaomi-Robot-Vacuum-X20-X20-Plus-L%E1%BB%B1c-h%C3%BAt-6000Pa-i.1396654883.29318291673?extraParams=%7B%22display_model_id%22%3A252078123004%2C%22model_selection_logic%22%3A3%7D&sp_atk=594e0978-23a2-4573-b7bd-e6907d479345&xptdk=594e0978-23a2-4573-b7bd-e6907d479345,robot hút bụi lau nhà,2026-01-15
"chuộng hàng_đầu hyundai thành_công việt_nam thị_trường việt_nam . ra_mắt thế_hệ 3/2022 , thời_điểm hiện_tại , creta 33.000 xe . hyundai creta mẫu xe nằm top đầu doanh_số phân_khúc bảng xếp_hạng",2,"chuộng hàng đầu của Hyundai Thành Công Việt Nam cũng như tại thị trường Việt Nam. Được ra mắt thế hệ mới từ tháng 3/2022, tính đến thời điểm hiện tại, Creta đã bán được hơn 33.000 xe. Hyundai Creta là mẫu xe luôn nằm trong top đầu về doanh số trong phân khúc cũng như bảng xếp hạng các",5,https://shopee.vn/Robot-h%C3%BAt-b%E1%BB%A5i-lau-nh%C3%A0-Xiaomi-Robot-Vacuum-X20-X20-Plus-L%E1%BB%B1c-h%C3%BAt-6000Pa-i.1396654883.29318291673?extraParams=%7B%22display_model_id%22%3A252078123004%2C%22model_selection_logic%22%3A3%7D&sp_atk=594e0978-23a2-4573-b7bd-e6907d479345&xptdk=594e0978-23a2-4573-b7bd-e6907d479345,robot hút bụi lau nhà,2025-11-12
"pin sạc , tạm chấp_nhận",2,"Pin hay phải sạc, còn lại tạm chấp nhận",5,https://shopee.vn/Robot-h%C3%BAt-b%E1%BB%A5i-lau-nh%C3%A0-Xiaomi-Robot-Vacuum-X20-X20-Plus-L%E1%BB%B1c-h%C3%BAt-6000Pa-i.1396654883.29318291673?extraParams=%7B%22display_model_id%22%3A252078123004%2C%22model_selection_logic%22%3A3%7D&sp_atk=594e0978-23a2-4573-b7bd-e6907d479345&xptdk=594e0978-23a2-4573-b7bd-e6907d479345,robot hút bụi lau nhà,2025-12-15
"1 tgian sử_dụng đánh_giá nè , mua nha , hợp_lý",2,"Sau 1 tgian sử dụng mới quay lại đánh giá nè, nên mua nha, quá hợp lý luôn",5,https://shopee.vn/Robot-h%C3%BAt-b%E1%BB%A5i-lau-nh%C3%A0-Xiaomi-Robot-Vacuum-X20-X20-Plus-L%E1%BB%B1c-h%C3%BAt-6000Pa-i.1396654883.29318291673?extraParams=%7B%22display_model_id%22%3A252078123004%2C%22model_selection_logic%22%3A3%7D&sp_atk=594e0978-23a2-4573-b7bd-e6907d479345&xptdk=594e0978-23a2-4573-b7bd-e6907d479345,robot hút bụi lau nhà,2025-07-21
sản_phẩm . mong bền . ủng cửa_hàng . giao hàng . giao hàng . hình_ảnh tính_chất_minh họa,2,Sản phẩm dùng khá tốt. Mong dùng bền dùng lâu. Sẽ ủng shop thêm. Giao hàng rất nhanh. Giao hàng rất nhanh. Hình ảnh mang tính chất minh hoạ,5,https://shopee.vn/Robot-h%C3%BAt-b%E1%BB%A5i-lau-nh%C3%A0-Xiaomi-Robot-Vacuum-X20-X20-Plus-L%E1%BB%B1c-h%C3%BAt-6000Pa-i.1396654883.29318291673?extraParams=%7B%22display_model_id%22%3A252078123004%2C%22model_selection_logic%22%3A3%7D&sp_atk=594e0978-23a2-4573-b7bd-e6907d479345&xptdk=594e0978-23a2-4573-b7bd-e6907d479345,robot hút bụi lau nhà,2025-11-23
"cửa_hàng đóng_gói cẩn_thận , giao hàng , gửi mẫu , chất_lượng",2,"Shop đóng gói cẩn thận, giao hàng nhanh, gửi đúng mẫu, chất lượng ok",5,https://shopee.vn/Robot-h%C3%BAt-b%E1%BB%A5i-lau-nh%C3%A0-Xiaomi-Robot-Vacuum-X20-X20-Plus-L%E1%BB%B1c-h%C3%BAt-6000Pa-i.1396654883.29318291673?extraParams=%7B%22display_model_id%22%3A252078123004%2C%22model_selection_logic%22%3A3%7D&sp_atk=594e0978-23a2-4573-b7bd-e6907d479345&xptdk=594e0978-23a2-4573-b7bd-e6907d479345,robot hút bụi lau nhà,2026-01-07
sản_phẩm robot hút bụi lau xiaomi vacuum x20 plus công_suất / lực hút 6000 pa pin lithium dung_lượng 5200 mah_kích_thước robot 350 x 350 x 97 mm thời_gian sạc pin 5-6_h điện_áp 100 - 240 v_dung_tích ngăn đựng rác 350 ml tiện_ích điều_khiển điện_thoại thông_báo giọng tự_động sạc pin,2,"Tên sản phẩm: Robot hút bụi lau nhà Xiaomi Vacuum X20 Plus

📍Công suất/ lực hút: 6000Pa

📍Pin: Lithium

📍Dung lượng: 5200mAh

📍Kích thước robot: 350 x 350 x 97mm

📍Thời gian sạc pin: 5-6h

📍Điện áp: 100-240V

📍Dung tích ngăn đựng rác: 350ml

📍Tiện ích

📍Điều khiển trên điện thoại

📍Thông báo bằng giọng nói

📍Tự động sạc pin",5,https://shopee.vn/Robot-h%C3%BAt-b%E1%BB%A5i-lau-nh%C3%A0-Xiaomi-Robot-Vacuum-X20-X20-Plus-L%E1%BB%B1c-h%C3%BAt-6000Pa-i.1396654883.29318291673?extraParams=%7B%22display_model_id%22%3A252078123004%2C%22model_selection_logic%22%3A3%7D&sp_atk=594e0978-23a2-4573-b7bd-e6907d479345&xptdk=594e0978-23a2-4573-b7bd-e6907d479345,robot hút bụi lau nhà,2025-12-03
"mua e lúc_nào sạch , đi sạch đỡ mệt_mỏi",2,"Từ khi mua e nó nhà lúc nào cũng sạch, đi làm về thấy nhà sạch là đỡ mệt mỏi hơn rồi🥰",5,https://shopee.vn/Robot-h%C3%BAt-b%E1%BB%A5i-lau-nh%C3%A0-Xiaomi-Robot-Vacuum-X20-X20-Plus-L%E1%BB%B1c-h%C3%BAt-6000Pa-i.1396654883.29318291673?extraParams=%7B%22display_model_id%22%3A252078123004%2C%22model_selection_logic%22%3A3%7D&sp_atk=594e0978-23a2-4573-b7bd-e6907d479345&xptdk=594e0978-23a2-4573-b7bd-e6907d479345,robot hút bụi lau nhà,2025-12-16
tính_năng nổi_bật lau sach mô_tả_dung chất_lượng sản_phẩm ok giao hàng đóng_gói kỹ mua sale giá,2,"Tính năng nổi bật:lau sach
Đúng với mô tả:dung
Chất lượng sản phẩm:ok

Giao hàng nhanh đóng gói rất kỹ mua được sale giá tốt",5,https://shopee.vn/Robot-h%C3%BAt-b%E1%BB%A5i-lau-nh%C3%A0-Xiaomi-Robot-Vacuum-X20-X20-Plus-L%E1%BB%B1c-h%C3%BAt-6000Pa-i.1396654883.29318291673?extraParams=%7B%22display_model_id%22%3A252078123004%2C%22model_selection_logic%22%3A3%7D&sp_atk=594e0978-23a2-4573-b7bd-e6907d479345&xptdk=594e0978-23a2-4573-b7bd-e6907d479345,robot hút bụi lau nhà,2026-01-12
tính_năng nổi_bật robot hut bui mô_tả mô_tả sử_dụng thời_gian,2,"Tính năng nổi bật:robot hut bui
Đúng với mô tả:đúng với mô tả

Mới sử dụng chưa biết cần thời gian",5,https://shopee.vn/Robot-h%C3%BAt-b%E1%BB%A5i-lau-nh%C3%A0-Xiaomi-Robot-Vacuum-X20-X20-Plus-L%E1%BB%B1c-h%C3%BAt-6000Pa-i.1396654883.29318291673?extraParams=%7B%22display_model_id%22%3A252078123004%2C%22model_selection_logic%22%3A3%7D&sp_atk=594e0978-23a2-4573-b7bd-e6907d479345&xptdk=594e0978-23a2-4573-b7bd-e6907d479345,robot hút bụi lau nhà,2025-10-15
thử mấy ok . bàn . tội cắt tóc gỡ,2,Dùng thử mấy lần khá là ok. Chưa có gì để bàn cả. Mỗi tội ko có cắt tóc nên phải gỡ,5,https://shopee.vn/Robot-h%C3%BAt-b%E1%BB%A5i-lau-nh%C3%A0-Xiaomi-Robot-Vacuum-X20-X20-Plus-L%E1%BB%B1c-h%C3%BAt-6000Pa-i.1396654883.29318291673?extraParams=%7B%22display_model_id%22%3A252078123004%2C%22model_selection_logic%22%3A3%7D&sp_atk=594e0978-23a2-4573-b7bd-e6907d479345&xptdk=594e0978-23a2-4573-b7bd-e6907d479345,robot hút bụi lau nhà,2025-12-08
"hàng hóa chất_lượng , đóng_gói hàng kỹ_càng , giao_hành",2,"Hàng hoá chất lượng cao, đóng gói hàng kỹ càng, giao hành nhanh",5,https://shopee.vn/Robot-h%C3%BAt-b%E1%BB%A5i-lau-nh%C3%A0-Xiaomi-Robot-Vacuum-X20-X20-Plus-L%E1%BB%B1c-h%C3%BAt-6000Pa-i.1396654883.29318291673?extraParams=%7B%22display_model_id%22%3A252078123004%2C%22model_selection_logic%22%3A3%7D&sp_atk=594e0978-23a2-4573-b7bd-e6907d479345&xptdk=594e0978-23a2-4573-b7bd-e6907d479345,robot hút bụi lau nhà,2025-09-23
"chất_lượng sản_phẩm hai mô_tả mô_tả tính_năng nổi_bật lau hút bụi lau sạch , sử_dụng thời_gian",2,"Chất lượng sản phẩm:hai lòng
Đúng với mô tả:đúng mô tả
Tính năng nổi bật:lau và hút bụi

Mình thấy dùng ok lau khá sạch, sử dụng thêm một thời gian nữa xem sao",4,https://shopee.vn/Robot-h%C3%BAt-b%E1%BB%A5i-lau-nh%C3%A0-Xiaomi-Robot-Vacuum-X20-X20-Plus-L%E1%BB%B1c-h%C3%BAt-6000Pa-i.1396654883.29318291673?extraParams=%7B%22display_model_id%22%3A252078123004%2C%22model_selection_logic%22%3A3%7D&sp_atk=594e0978-23a2-4573-b7bd-e6907d479345&xptdk=594e0978-23a2-4573-b7bd-e6907d479345,robot hút bụi lau nhà,2025-09-23
tính_năng nổi_bật lau mô_tả chất_lượng sản_phẩm kk cửa_hàng đóng_gói cẳn thận shiper nhiệt_tình ủng_hộ cửa_hàng,2,"Tính năng nổi bật:lau nhà
Đúng với mô tả:đúng
Chất lượng sản phẩm:kk

Shop đóng gói cẳn thận shiper nhiệt tình sẽ ủng hộ shop lần sau",5,https://shopee.vn/Robot-h%C3%BAt-b%E1%BB%A5i-lau-nh%C3%A0-Xiaomi-Robot-Vacuum-X20-X20-Plus-L%E1%BB%B1c-h%C3%BAt-6000Pa-i.1396654883.29318291673?extraParams=%7B%22display_model_id%22%3A252078123004%2C%22model_selection_logic%22%3A3%7D&sp_atk=594e0978-23a2-4573-b7bd-e6907d479345&xptdk=594e0978-23a2-4573-b7bd-e6907d479345,robot hút bụi lau nhà,2025-08-16
hài_lòng sản_phẩm đóng_gói cẩn_thận kỹ_càng cửa_hàng,2,rất hài lòng về sản phẩm đóng gói cẩn thận kỹ càng cho shop năm sao,5,https://shopee.vn/Robot-h%C3%BAt-b%E1%BB%A5i-lau-nh%C3%A0-Xiaomi-Robot-Vacuum-X20-X20-Plus-L%E1%BB%B1c-h%C3%BAt-6000Pa-i.1396654883.29318291673?extraParams=%7B%22display_model_id%22%3A252078123004%2C%22model_selection_logic%22%3A3%7D&sp_atk=594e0978-23a2-4573-b7bd-e6907d479345&xptdk=594e0978-23a2-4573-b7bd-e6907d479345,robot hút bụi lau nhà,2025-08-23
"robot chạy , giặt giẻ_lau lau nóng , vật_cản vực . khả_năng vẽ bản_đồ hơi kém",2,"Robot chạy tốt, giặt giẻ lau và lau nhà bằng nước nóng, biết tránh vật cản và vực. Khả năng vẽ bản đồ hơi kém",5,https://shopee.vn/Robot-h%C3%BAt-b%E1%BB%A5i-lau-nh%C3%A0-Xiaomi-Robot-Vacuum-X20-X20-Plus-L%E1%BB%B1c-h%C3%BAt-6000Pa-i.1396654883.29318291673?extraParams=%7B%22display_model_id%22%3A252078123004%2C%22model_selection_logic%22%3A3%7D&sp_atk=594e0978-23a2-4573-b7bd-e6907d479345&xptdk=594e0978-23a2-4573-b7bd-e6907d479345,robot hút bụi lau nhà,2025-11-28
"hút bụi sạch , lau sạch 8/10 . máy nhàn hẳn . xứng_đáng mua .",2,"Hút bụi sạch, lau sạch 8/10. Từ ngày có máy nhàn hẳn. Rất xứng đáng để mua.",5,https://shopee.vn/Robot-h%C3%BAt-b%E1%BB%A5i-lau-nh%C3%A0-Xiaomi-Robot-Vacuum-X20-X20-Plus-L%E1%BB%B1c-h%C3%BAt-6000Pa-i.1396654883.29318291673?extraParams=%7B%22display_model_id%22%3A252078123004%2C%22model_selection_logic%22%3A3%7D&sp_atk=594e0978-23a2-4573-b7bd-e6907d479345&xptdk=594e0978-23a2-4573-b7bd-e6907d479345,robot hút bụi lau nhà,2025-11-11
"mô_tả , sạch , độ bền thời_gian",2,"Đúng với mô tả, lâu sạch, độ bền cần thời gian",5,https://shopee.vn/Robot-h%C3%BAt-b%E1%BB%A5i-lau-nh%C3%A0-Xiaomi-Robot-Vacuum-X20-X20-Plus-L%E1%BB%B1c-h%C3%BAt-6000Pa-i.1396654883.29318291673?extraParams=%7B%22display_model_id%22%3A252078123004%2C%22model_selection_logic%22%3A3%7D&sp_atk=594e0978-23a2-4573-b7bd-e6907d479345&xptdk=594e0978-23a2-4573-b7bd-e6907d479345,robot hút bụi lau nhà,2025-09-13
giao hàng . sử_dụng thời_gian đánh_giá .,2,Giao hàng nhanh. Sử dụng thời gian đánh giá sau.,5,https://shopee.vn/Robot-h%C3%BAt-b%E1%BB%A5i-lau-nh%C3%A0-Xiaomi-Robot-Vacuum-X20-X20-Plus-L%E1%BB%B1c-h%C3%BAt-6000Pa-i.1396654883.29318291673?extraParams=%7B%22display_model_id%22%3A252078123004%2C%22model_selection_logic%22%3A3%7D&sp_atk=594e0978-23a2-4573-b7bd-e6907d479345&xptdk=594e0978-23a2-4573-b7bd-e6907d479345,robot hút bụi lau nhà,2025-12-30
"lau sạch , bền",2,"Lau sạch, dùng lâu mới rõ bền ko",5,https://shopee.vn/Robot-h%C3%BAt-b%E1%BB%A5i-lau-nh%C3%A0-Xiaomi-Robot-Vacuum-X20-X20-Plus-L%E1%BB%B1c-h%C3%BAt-6000Pa-i.1396654883.29318291673?extraParams=%7B%22display_model_id%22%3A252078123004%2C%22model_selection_logic%22%3A3%7D&sp_atk=594e0978-23a2-4573-b7bd-e6907d479345&xptdk=594e0978-23a2-4573-b7bd-e6907d479345,robot hút bụi lau nhà,2025-05-30
sài 1 . ngon_lành,2,Sài được 1 tháng rồi.ngon lành,5,https://shopee.vn/Robot-h%C3%BAt-b%E1%BB%A5i-lau-nh%C3%A0-Xiaomi-Robot-Vacuum-X20-X20-Plus-L%E1%BB%B1c-h%C3%BAt-6000Pa-i.1396654883.29318291673?extraParams=%7B%22display_model_id%22%3A252078123004%2C%22model_selection_logic%22%3A3%7D&sp_atk=594e0978-23a2-4573-b7bd-e6907d479345&xptdk=594e0978-23a2-4573-b7bd-e6907d479345,robot hút bụi lau nhà,2025-06-17
ok . cơ_bản đáp_ứng nhu_cầu,2,Ok. Cơ bản đáp ứng dc nhu cầu,5,https://shopee.vn/Robot-h%C3%BAt-b%E1%BB%A5i-lau-nh%C3%A0-Xiaomi-Robot-Vacuum-X20-X20-Plus-L%E1%BB%B1c-h%C3%BAt-6000Pa-i.1396654883.29318291673?extraParams=%7B%22display_model_id%22%3A252078123004%2C%22model_selection_logic%22%3A3%7D&sp_atk=594e0978-23a2-4573-b7bd-e6907d479345&xptdk=594e0978-23a2-4573-b7bd-e6907d479345,robot hút bụi lau nhà,2025-08-18
"giá 1 robot tính_năng giặt_dẻ , đổ rác . bình_châm dung_dịch lau , phụ_kiện tháo rác quấn chổi .",2,"Giá tốt cho 1 robot vừa có tính năng giặt dẻ, tự đổ rác. Con này ko có bình châm dung dịch lau nhà, ko có phụ kiện tháo rác quấn chổi.",5,https://shopee.vn/Robot-h%C3%BAt-b%E1%BB%A5i-lau-nh%C3%A0-Xiaomi-Robot-Vacuum-X20-X20-Plus-L%E1%BB%B1c-h%C3%BAt-6000Pa-i.1396654883.29318291673?extraParams=%7B%22display_model_id%22%3A252078123004%2C%22model_selection_logic%22%3A3%7D&sp_atk=594e0978-23a2-4573-b7bd-e6907d479345&xptdk=594e0978-23a2-4573-b7bd-e6907d479345,robot hút bụi lau nhà,2024-05-15
chất_lượng sản_phẩm hàng mô_tả mô_tả tính_năng nổi_bật hút_bụi lau thử chi ưng_ý . đầu_tiên mua áp_sản_phẩm tiền như_vậy . phân_vân . nhưg tuyệt_vời,2,"Chất lượng sản phẩm:hàng tốt
Đúng với mô tả:đúng mô tả
Tính năng nổi bật:hút bụi và lau nhà

Về dùng thử rất chi là ưng ý. Lần đầu tiên mua trên áp sản phẩm nhiều tiền như vậy. Cũng phân vân. Nhưg giờ dùng quá tuyệt vời",5,https://shopee.vn/Robot-h%C3%BAt-b%E1%BB%A5i-lau-nh%C3%A0-Xiaomi-Robot-Vacuum-X20-X20-Plus-L%E1%BB%B1c-h%C3%BAt-6000Pa-i.1396654883.29318291673?extraParams=%7B%22display_model_id%22%3A252078123004%2C%22model_selection_logic%22%3A3%7D&sp_atk=594e0978-23a2-4573-b7bd-e6907d479345&xptdk=594e0978-23a2-4573-b7bd-e6907d479345,robot hút bụi lau nhà,2025-07-12
"mô_tả mô_tả tính_năng nổi_bật hoạt_động êm_ái , thông_minh chất_lượng sản_phẩm tốt_máy hoạt_động , êm , ổn_định , tối_ưu đường chạy . phù_hợp căn_hộ chung_cư , diện_tích vừa_phải",2,"Đúng với mô tả:Đúng mô tả
Tính năng nổi bật:hoạt động êm ái, thông minh
Chất lượng sản phẩm:tốt

Máy hoạt động, êm, ổn định, tối ưu được đường chạy.
Phù hợp với căn hộ chung cư, diện tích nhà vừa phải",5,https://shopee.vn/Robot-h%C3%BAt-b%E1%BB%A5i-lau-nh%C3%A0-Xiaomi-Robot-Vacuum-X20-X20-Plus-L%E1%BB%B1c-h%C3%BAt-6000Pa-i.1396654883.29318291673?extraParams=%7B%22display_model_id%22%3A252078123004%2C%22model_selection_logic%22%3A3%7D&sp_atk=594e0978-23a2-4573-b7bd-e6907d479345&xptdk=594e0978-23a2-4573-b7bd-e6907d479345,robot hút bụi lau nhà,2025-10-11
"mô_tả tính_năng nổi_bật giặc chất_lượng sản_phẩm ok giới_thiệu mua , sản_phẩm tốt_nha . túi_tiền đầy_đủ công_dụng . săn sale được_giá",2,"Đúng với mô tả:đúng
Tính năng nổi bật:tự giặc
Chất lượng sản phẩm:ok

Thấy giới thiệu nhiều nên mua, nhưng sản phẩm OK nha. Vừa túi tiền mà đầy đủ công dụng. Săn sale nên được giá tốt",5,https://shopee.vn/Robot-h%C3%BAt-b%E1%BB%A5i-lau-nh%C3%A0-Xiaomi-Robot-Vacuum-X20-X20-Plus-L%E1%BB%B1c-h%C3%BAt-6000Pa-i.1396654883.29318291673?extraParams=%7B%22display_model_id%22%3A252078123004%2C%22model_selection_logic%22%3A3%7D&sp_atk=594e0978-23a2-4573-b7bd-e6907d479345&xptdk=594e0978-23a2-4573-b7bd-e6907d479345,robot hút bụi lau nhà,2024-11-14
"bình chứa nước_sạch dơ to , cài_đặt dễ_dàng app mi home , tiếc rôbốt tiếng việt , app hiện chữ việt",2,"Bình chứa nước sạch và dơ rất to , cài đặt dễ dàng với app Mi Home, chỉ tiếc là con rôbốt không có nói tiếng Việt, app thì có hiện chữ Việt",5,https://shopee.vn/Robot-h%C3%BAt-b%E1%BB%A5i-lau-nh%C3%A0-Xiaomi-Robot-Vacuum-X20-X20-Plus-L%E1%BB%B1c-h%C3%BAt-6000Pa-i.1396654883.29318291673?extraParams=%7B%22display_model_id%22%3A252078123004%2C%22model_selection_logic%22%3A3%7D&sp_atk=594e0978-23a2-4573-b7bd-e6907d479345&xptdk=594e0978-23a2-4573-b7bd-e6907d479345,robot hút bụi lau nhà,2024-07-20
"săn sale giá rẻ ngon !_hút , lau sạch . ok !",2,"Săn sale giá rẻ ngon! Hút khá là mạnh, lau sạch. Quá là ok!",5,https://shopee.vn/Robot-h%C3%BAt-b%E1%BB%A5i-lau-nh%C3%A0-Xiaomi-Robot-Vacuum-X20-X20-Plus-L%E1%BB%B1c-h%C3%BAt-6000Pa-i.1396654883.29318291673?extraParams=%7B%22display_model_id%22%3A252078123004%2C%22model_selection_logic%22%3A3%7D&sp_atk=594e0978-23a2-4573-b7bd-e6907d479345&xptdk=594e0978-23a2-4573-b7bd-e6907d479345,robot hút bụi lau nhà,2025-01-19
"săn sale giá rẻ mua , robot hút sạch , thử ổn , cài_đặt app dễ_dàng",2,"Săn sale được giá rẻ hơn mua ở ngoài, robot hút sạch, dùng thử ổn, cài đặt app dễ dàng",5,https://shopee.vn/Robot-h%C3%BAt-b%E1%BB%A5i-lau-nh%C3%A0-Xiaomi-Robot-Vacuum-X20-X20-Plus-L%E1%BB%B1c-h%C3%BAt-6000Pa-i.1396654883.29318291673?extraParams=%7B%22display_model_id%22%3A252078123004%2C%22model_selection_logic%22%3A3%7D&sp_atk=594e0978-23a2-4573-b7bd-e6907d479345&xptdk=594e0978-23a2-4573-b7bd-e6907d479345,robot hút bụi lau nhà,2024-08-15
"chất_lượng sản_phẩm tính_năng nổi_bật hút lau mô_tả sài ổn , robot thông_minh , hút sạch",2,"Chất lượng sản phẩm:tốt
Tính năng nổi bật:hút + lau
Đúng với mô tả:👍

Mới sài thấy ổn, robot thông minh, hút sạch 👍👍👍👍",5,https://shopee.vn/Robot-h%C3%BAt-b%E1%BB%A5i-lau-nh%C3%A0-Xiaomi-Robot-Vacuum-X20-X20-Plus-L%E1%BB%B1c-h%C3%BAt-6000Pa-i.1396654883.29318291673?extraParams=%7B%22display_model_id%22%3A252078123004%2C%22model_selection_logic%22%3A3%7D&sp_atk=594e0978-23a2-4573-b7bd-e6907d479345&xptdk=594e0978-23a2-4573-b7bd-e6907d479345,robot hút bụi lau nhà,2022-09-06
"chất_lượng sản_phẩm tính_năng nổi_bật hút_bụi lau mô_tả 10/10 máy_hút lau sạch , cài hẹn hoạt_động , ồn lắm",2,"Chất lượng sản phẩm:tốt
Tính năng nổi bật:hút bụi và lau nhà
Đúng với mô tả:10/10

Máy hút và lau sạch, cài hẹn giờ cứ thế mà hoạt động thôi, ko ồn lắm đâu",5,https://shopee.vn/Robot-h%C3%BAt-b%E1%BB%A5i-lau-nh%C3%A0-Xiaomi-Robot-Vacuum-X20-X20-Plus-L%E1%BB%B1c-h%C3%BAt-6000Pa-i.1396654883.29318291673?extraParams=%7B%22display_model_id%22%3A252078123004%2C%22model_selection_logic%22%3A3%7D&sp_atk=594e0978-23a2-4573-b7bd-e6907d479345&xptdk=594e0978-23a2-4573-b7bd-e6907d479345,robot hút bụi lau nhà,2022-06-16
tiện dọn_dẹp nhà_cửa . cài_đặt lau 2 ổn ! mua 2 máy,2,rất tiện cho việc dọn dẹp nhà cửa. Cài đặt ngày lau 2 lần là ổn! đã mua 2 máy,5,https://shopee.vn/Robot-h%C3%BAt-b%E1%BB%A5i-lau-nh%C3%A0-Xiaomi-Robot-Vacuum-X20-X20-Plus-L%E1%BB%B1c-h%C3%BAt-6000Pa-i.1396654883.29318291673?extraParams=%7B%22display_model_id%22%3A252078123004%2C%22model_selection_logic%22%3A3%7D&sp_atk=594e0978-23a2-4573-b7bd-e6907d479345&xptdk=594e0978-23a2-4573-b7bd-e6907d479345,robot hút bụi lau nhà,2025-03-09
"chất_lượng sản_phẩm ổn tính_năng nổi_bật hút bụi , lau mô_tả mô_tả sử_dụng máy chạy êm , lau sạch",2,"Chất lượng sản phẩm:Ổn
Tính năng nổi bật:Hút bụi, lau nhà
Đúng với mô tả:Đúng mô tả

Mới sử dụng thấy máy chạy êm, lau nhà sạch",5,https://shopee.vn/Robot-h%C3%BAt-b%E1%BB%A5i-lau-nh%C3%A0-Xiaomi-Robot-Vacuum-X20-X20-Plus-L%E1%BB%B1c-h%C3%BAt-6000Pa-i.1396654883.29318291673?extraParams=%7B%22display_model_id%22%3A252078123004%2C%22model_selection_logic%22%3A3%7D&sp_atk=594e0978-23a2-4573-b7bd-e6907d479345&xptdk=594e0978-23a2-4573-b7bd-e6907d479345,robot hút bụi lau nhà,2022-10-29
"robot dòng xài hút bụi lau sạch lắm , giặt_sấy miếng lau . mua hàng mall hãng tiện bảo_hành sau_này",2,"Robot dòng này xài hút bụi lau nhà sạch lắm, tự giặt sấy miếng lau . Mua hàng mall chính hãng có gì tiện cho bảo hành sau này",5,https://shopee.vn/Robot-h%C3%BAt-b%E1%BB%A5i-lau-nh%C3%A0-Xiaomi-Robot-Vacuum-X20-X20-Plus-L%E1%BB%B1c-h%C3%BAt-6000Pa-i.1396654883.29318291673?extraParams=%7B%22display_model_id%22%3A252078123004%2C%22model_selection_logic%22%3A3%7D&sp_atk=594e0978-23a2-4573-b7bd-e6907d479345&xptdk=594e0978-23a2-4573-b7bd-e6907d479345,robot hút bụi lau nhà,2024-10-04
ưng nha mn . tuy_nhiên mua xong đợt sale . tiếc hùi_hụi . thùng đựng dung_tích đi đổ lắm . siêng máy lau . thảm_tự nâng giẻ lau màu đen tuyệt,2,"Ưng nha mn ơi. Tuy nhiên mình mua xong thì có đợt sale. Tiếc hùi hụi. 
Thùng đựng nước dung tích này nhanh phải đi đổ nước lắm. Hay tại siêng cho máy lau quá nhỉ. Gặp thảm tự nâng giẻ lau 😍😍😍 kể có màu đen thì tuyệt",5,https://shopee.vn/Robot-h%C3%BAt-b%E1%BB%A5i-lau-nh%C3%A0-Xiaomi-Robot-Vacuum-X20-X20-Plus-L%E1%BB%B1c-h%C3%BAt-6000Pa-i.1396654883.29318291673?extraParams=%7B%22display_model_id%22%3A252078123004%2C%22model_selection_logic%22%3A3%7D&sp_atk=594e0978-23a2-4573-b7bd-e6907d479345&xptdk=594e0978-23a2-4573-b7bd-e6907d479345,robot hút bụi lau nhà,2024-02-26
