clean_comment,label,comment,rating,source_url,keyword,date
chất_lượng sản_phẩm hình tính_năng nổi_bật dính keo mô_tả nha mn,2,"Chất lượng sản phẩm:đúng như trong hình
Tính năng nổi bật:dính keo ngoài

đúng như mô tả nha mn",5,https://shopee.vn/M%C3%A0n-h%C3%ACnh-m%C3%A1y-vi-t%C3%ADnh-Dell-hp-22i-20in-19in-17in-15in-wide-Vuong-h%C3%A0ng-c%C3%B4ng-ty-%C4%91%E1%BA%B9p-gi%C3%A1-chi-200k-b%E1%BA%A3o-h%C3%A0nh-chu-%C4%91%C3%A1o-t%E1%BA%A1i-shop-i.233603705.29781252988?extraParams=%7B%22display_model_id%22%3A385460453489%2C%22model_selection_logic%22%3A3%7D&sp_atk=fbfb3d51-7de0-4441-8918-61eda95bd70d&xptdk=fbfb3d51-7de0-4441-8918-61eda95bd70d,màn hình giá rẻ,2025-11-02
"đẹp , miêu_tả , gói hàng cẩn_thận",2,"Đẹp như mới , đúng như miêu tả , gói hàng cẩn thận",5,https://shopee.vn/M%C3%A0n-h%C3%ACnh-m%C3%A1y-vi-t%C3%ADnh-Dell-hp-22i-20in-19in-17in-15in-wide-Vuong-h%C3%A0ng-c%C3%B4ng-ty-%C4%91%E1%BA%B9p-gi%C3%A1-chi-200k-b%E1%BA%A3o-h%C3%A0nh-chu-%C4%91%C3%A1o-t%E1%BA%A1i-shop-i.233603705.29781252988?extraParams=%7B%22display_model_id%22%3A385460453489%2C%22model_selection_logic%22%3A3%7D&sp_atk=fbfb3d51-7de0-4441-8918-61eda95bd70d&xptdk=fbfb3d51-7de0-4441-8918-61eda95bd70d,màn hình giá rẻ,2025-07-29
chủ nhiệt_tình ạhhhh hàng,2,anh chủ rất nhiệt tình ạhhhh hàng tốt,5,https://shopee.vn/M%C3%A0n-h%C3%ACnh-m%C3%A1y-vi-t%C3%ADnh-Dell-hp-22i-20in-19in-17in-15in-wide-Vuong-h%C3%A0ng-c%C3%B4ng-ty-%C4%91%E1%BA%B9p-gi%C3%A1-chi-200k-b%E1%BA%A3o-h%C3%A0nh-chu-%C4%91%C3%A1o-t%E1%BA%A1i-shop-i.233603705.29781252988?extraParams=%7B%22display_model_id%22%3A385460453489%2C%22model_selection_logic%22%3A3%7D&sp_atk=fbfb3d51-7de0-4441-8918-61eda95bd70d&xptdk=fbfb3d51-7de0-4441-8918-61eda95bd70d,màn hình giá rẻ,2025-08-12
"hàng mong_đợi giải_quyết , chấp_nhận",2,"Hàng chưa như mong đợi nhưng người bán giải quyết nhanh, chấp nhận ok",4,https://shopee.vn/M%C3%A0n-h%C3%ACnh-m%C3%A1y-vi-t%C3%ADnh-Dell-hp-22i-20in-19in-17in-15in-wide-Vuong-h%C3%A0ng-c%C3%B4ng-ty-%C4%91%E1%BA%B9p-gi%C3%A1-chi-200k-b%E1%BA%A3o-h%C3%A0nh-chu-%C4%91%C3%A1o-t%E1%BA%A1i-shop-i.233603705.29781252988?extraParams=%7B%22display_model_id%22%3A385460453489%2C%22model_selection_logic%22%3A3%7D&sp_atk=fbfb3d51-7de0-4441-8918-61eda95bd70d&xptdk=fbfb3d51-7de0-4441-8918-61eda95bd70d,màn hình giá rẻ,2025-10-25
", xài ! máy đẹp",2,"Tốt ,xài ok ! Máy vẫn còn đẹp",5,https://shopee.vn/M%C3%A0n-h%C3%ACnh-m%C3%A1y-vi-t%C3%ADnh-Dell-hp-22i-20in-19in-17in-15in-wide-Vuong-h%C3%A0ng-c%C3%B4ng-ty-%C4%91%E1%BA%B9p-gi%C3%A1-chi-200k-b%E1%BA%A3o-h%C3%A0nh-chu-%C4%91%C3%A1o-t%E1%BA%A1i-shop-i.233603705.29781252988?extraParams=%7B%22display_model_id%22%3A385460453489%2C%22model_selection_logic%22%3A3%7D&sp_atk=fbfb3d51-7de0-4441-8918-61eda95bd70d&xptdk=fbfb3d51-7de0-4441-8918-61eda95bd70d,màn hình giá rẻ,2025-08-26
sản_phẩm y_như hình_very good cửa_hàng,2,Sản phẩm đúng y như hình very good shop ơi,5,https://shopee.vn/M%C3%A0n-h%C3%ACnh-m%C3%A1y-vi-t%C3%ADnh-Dell-hp-22i-20in-19in-17in-15in-wide-Vuong-h%C3%A0ng-c%C3%B4ng-ty-%C4%91%E1%BA%B9p-gi%C3%A1-chi-200k-b%E1%BA%A3o-h%C3%A0nh-chu-%C4%91%C3%A1o-t%E1%BA%A1i-shop-i.233603705.29781252988?extraParams=%7B%22display_model_id%22%3A385460453489%2C%22model_selection_logic%22%3A3%7D&sp_atk=fbfb3d51-7de0-4441-8918-61eda95bd70d&xptdk=fbfb3d51-7de0-4441-8918-61eda95bd70d,màn hình giá rẻ,2025-09-03
nói_chuyện cộc lốc dây vga màn_hình đểu hỏng qcao đẹp,0,"Nói chuyện với khách thì cộc lốc
Bán thì ko có dây vga
Màn hình thì đểu hỏng mà qcao là đẹp",1,https://shopee.vn/M%C3%A0n-h%C3%ACnh-m%C3%A1y-vi-t%C3%ADnh-Dell-hp-22i-20in-19in-17in-15in-wide-Vuong-h%C3%A0ng-c%C3%B4ng-ty-%C4%91%E1%BA%B9p-gi%C3%A1-chi-200k-b%E1%BA%A3o-h%C3%A0nh-chu-%C4%91%C3%A1o-t%E1%BA%A1i-shop-i.233603705.29781252988?extraParams=%7B%22display_model_id%22%3A385460453489%2C%22model_selection_logic%22%3A3%7D&sp_atk=fbfb3d51-7de0-4441-8918-61eda95bd70d&xptdk=fbfb3d51-7de0-4441-8918-61eda95bd70d,màn hình giá rẻ,2025-10-01
"đay đánh_giá , mua đánh_giá ảo , hình_ảnh tính_chất xu , anh_em mua đi ngại ! ! ! 50 , anh_chị_em thông_cảm",2,"Đay là đánh giá thật, k phải mua đánh giá ảo, hình ảnh chỉ mang tính chất làm cho có để lấy xu, anh em cứ mua đi k phải ngại!!!  không biết tới đây đã đủ 50 từ chưa , anh chị em thông cảm",5,https://shopee.vn/M%C3%A0n-h%C3%ACnh-m%C3%A1y-vi-t%C3%ADnh-Dell-hp-22i-20in-19in-17in-15in-wide-Vuong-h%C3%A0ng-c%C3%B4ng-ty-%C4%91%E1%BA%B9p-gi%C3%A1-chi-200k-b%E1%BA%A3o-h%C3%A0nh-chu-%C4%91%C3%A1o-t%E1%BA%A1i-shop-i.233603705.29781252988?extraParams=%7B%22display_model_id%22%3A385460453489%2C%22model_selection_logic%22%3A3%7D&sp_atk=fbfb3d51-7de0-4441-8918-61eda95bd70d&xptdk=fbfb3d51-7de0-4441-8918-61eda95bd70d,màn hình giá rẻ,2026-01-16
chất_lượng sản_phẩm tính_năng nổi_bật rẻ,2,"Chất lượng sản phẩm:tốt
Tính năng nổi bật:rẻ

Ok",5,https://shopee.vn/M%C3%A0n-h%C3%ACnh-m%C3%A1y-vi-t%C3%ADnh-Dell-hp-22i-20in-19in-17in-15in-wide-Vuong-h%C3%A0ng-c%C3%B4ng-ty-%C4%91%E1%BA%B9p-gi%C3%A1-chi-200k-b%E1%BA%A3o-h%C3%A0nh-chu-%C4%91%C3%A1o-t%E1%BA%A1i-shop-i.233603705.29781252988?extraParams=%7B%22display_model_id%22%3A385460453489%2C%22model_selection_logic%22%3A3%7D&sp_atk=fbfb3d51-7de0-4441-8918-61eda95bd70d&xptdk=fbfb3d51-7de0-4441-8918-61eda95bd70d,màn hình giá rẻ,2025-11-27
chất_lượng sản_phẩm tuyệt_nhất nút,0,"Chất lượng sản phẩm:như🦋

Tuyệt nhất là mất nút nguồn",1,https://shopee.vn/M%C3%A0n-h%C3%ACnh-m%C3%A1y-vi-t%C3%ADnh-Dell-hp-22i-20in-19in-17in-15in-wide-Vuong-h%C3%A0ng-c%C3%B4ng-ty-%C4%91%E1%BA%B9p-gi%C3%A1-chi-200k-b%E1%BA%A3o-h%C3%A0nh-chu-%C4%91%C3%A1o-t%E1%BA%A1i-shop-i.233603705.29781252988?extraParams=%7B%22display_model_id%22%3A385460453489%2C%22model_selection_logic%22%3A3%7D&sp_atk=fbfb3d51-7de0-4441-8918-61eda95bd70d&xptdk=fbfb3d51-7de0-4441-8918-61eda95bd70d,màn hình giá rẻ,2025-05-18
"chi_tiết thỏa_thuận công_bố , giới quan_sát thuế nhập_khẩu đối_với thép , nhôm ô_tô khả_năng trọng_tâm đàm_phán",2,"Dù chi tiết thỏa thuận chưa được công bố, giới quan sát cho rằng thuế nhập khẩu đối với thép, nhôm và ô tô nhiều khả năng là trọng tâm đàm phán",5,https://shopee.vn/M%C3%A0n-h%C3%ACnh-m%C3%A1y-vi-t%C3%ADnh-Dell-hp-22i-20in-19in-17in-15in-wide-Vuong-h%C3%A0ng-c%C3%B4ng-ty-%C4%91%E1%BA%B9p-gi%C3%A1-chi-200k-b%E1%BA%A3o-h%C3%A0nh-chu-%C4%91%C3%A1o-t%E1%BA%A1i-shop-i.233603705.29781252988?extraParams=%7B%22display_model_id%22%3A385460453489%2C%22model_selection_logic%22%3A3%7D&sp_atk=fbfb3d51-7de0-4441-8918-61eda95bd70d&xptdk=fbfb3d51-7de0-4441-8918-61eda95bd70d,màn hình giá rẻ,2025-05-09
"cửa_hàng giao hàng cẩu_thả , màn_hình dơ bụi , vệ_sinh sạch_sẽ xài",0,"Shop giao hàng cẩu thả, màn hình rất dơ và bụi, phải vệ sinh sạch sẽ mới xài được",1,https://shopee.vn/M%C3%A0n-h%C3%ACnh-m%C3%A1y-vi-t%C3%ADnh-Dell-hp-22i-20in-19in-17in-15in-wide-Vuong-h%C3%A0ng-c%C3%B4ng-ty-%C4%91%E1%BA%B9p-gi%C3%A1-chi-200k-b%E1%BA%A3o-h%C3%A0nh-chu-%C4%91%C3%A1o-t%E1%BA%A1i-shop-i.233603705.29781252988?extraParams=%7B%22display_model_id%22%3A385460453489%2C%22model_selection_logic%22%3A3%7D&sp_atk=fbfb3d51-7de0-4441-8918-61eda95bd70d&xptdk=fbfb3d51-7de0-4441-8918-61eda95bd70d,màn hình giá rẻ,2025-06-19
hàng hơi xước_tí ngon,2,Hàng hơi xước tí thôi nhưng dùng ngon,5,https://shopee.vn/M%C3%A0n-h%C3%ACnh-m%C3%A1y-vi-t%C3%ADnh-Dell-hp-22i-20in-19in-17in-15in-wide-Vuong-h%C3%A0ng-c%C3%B4ng-ty-%C4%91%E1%BA%B9p-gi%C3%A1-chi-200k-b%E1%BA%A3o-h%C3%A0nh-chu-%C4%91%C3%A1o-t%E1%BA%A1i-shop-i.233603705.29781252988?extraParams=%7B%22display_model_id%22%3A385460453489%2C%22model_selection_logic%22%3A3%7D&sp_atk=fbfb3d51-7de0-4441-8918-61eda95bd70d&xptdk=fbfb3d51-7de0-4441-8918-61eda95bd70d,màn hình giá rẻ,2025-10-05
màn cắm gò điện,2,Màn cắm vào bị gò điện,4,https://shopee.vn/M%C3%A0n-h%C3%ACnh-m%C3%A1y-vi-t%C3%ADnh-Dell-hp-22i-20in-19in-17in-15in-wide-Vuong-h%C3%A0ng-c%C3%B4ng-ty-%C4%91%E1%BA%B9p-gi%C3%A1-chi-200k-b%E1%BA%A3o-h%C3%A0nh-chu-%C4%91%C3%A1o-t%E1%BA%A1i-shop-i.233603705.29781252988?extraParams=%7B%22display_model_id%22%3A385460453489%2C%22model_selection_logic%22%3A3%7D&sp_atk=fbfb3d51-7de0-4441-8918-61eda95bd70d&xptdk=fbfb3d51-7de0-4441-8918-61eda95bd70d,màn hình giá rẻ,2025-11-11
"giao hàng_không mẫu , trầy_xước",1,"Giao hàng ko đúng mẫu, trầy xước quá nhiều",3,https://shopee.vn/M%C3%A0n-h%C3%ACnh-m%C3%A1y-vi-t%C3%ADnh-Dell-hp-22i-20in-19in-17in-15in-wide-Vuong-h%C3%A0ng-c%C3%B4ng-ty-%C4%91%E1%BA%B9p-gi%C3%A1-chi-200k-b%E1%BA%A3o-h%C3%A0nh-chu-%C4%91%C3%A1o-t%E1%BA%A1i-shop-i.233603705.29781252988?extraParams=%7B%22display_model_id%22%3A385460453489%2C%22model_selection_logic%22%3A3%7D&sp_atk=fbfb3d51-7de0-4441-8918-61eda95bd70d&xptdk=fbfb3d51-7de0-4441-8918-61eda95bd70d,màn hình giá rẻ,2025-11-12
"tính_năng nổi_bật tot chất_lượng sản_phẩm giá rẻ không_thể đòi_hỏi đồ ngon_đx , màn date_hơi tận 2008 , hao_điện",2,"Tính năng nổi bật:tot
Chất lượng sản phẩm:được

Giá rẻ thì ko thể đòi hỏi đồ quá ngon đx, màn còn khá ok nhưng date hơi xa tận 2008 , không biết có hao điện dữ ko",5,https://shopee.vn/M%C3%A0n-h%C3%ACnh-m%C3%A1y-vi-t%C3%ADnh-Dell-hp-22i-20in-19in-17in-15in-wide-Vuong-h%C3%A0ng-c%C3%B4ng-ty-%C4%91%E1%BA%B9p-gi%C3%A1-chi-200k-b%E1%BA%A3o-h%C3%A0nh-chu-%C4%91%C3%A1o-t%E1%BA%A1i-shop-i.233603705.29781252988?extraParams=%7B%22display_model_id%22%3A385460453489%2C%22model_selection_logic%22%3A3%7D&sp_atk=fbfb3d51-7de0-4441-8918-61eda95bd70d&xptdk=fbfb3d51-7de0-4441-8918-61eda95bd70d,màn hình giá rẻ,2025-06-01
"màn_hình kém chất_lượng mờ , bóng viền cửa_hàng quảng_cáo màn_hình đẹp . trung_thực",1,"Màn hình kém chất lượng: mờ, có bóng viền không như shop quảng cáo màn hình đẹp. Không trung thực",3,https://shopee.vn/M%C3%A0n-h%C3%ACnh-m%C3%A1y-vi-t%C3%ADnh-Dell-hp-22i-20in-19in-17in-15in-wide-Vuong-h%C3%A0ng-c%C3%B4ng-ty-%C4%91%E1%BA%B9p-gi%C3%A1-chi-200k-b%E1%BA%A3o-h%C3%A0nh-chu-%C4%91%C3%A1o-t%E1%BA%A1i-shop-i.233603705.29781252988?extraParams=%7B%22display_model_id%22%3A385460453489%2C%22model_selection_logic%22%3A3%7D&sp_atk=fbfb3d51-7de0-4441-8918-61eda95bd70d&xptdk=fbfb3d51-7de0-4441-8918-61eda95bd70d,màn hình giá rẻ,2025-11-22
"hàng , gửi đầy_đủ dây kèm , màn_hình trước_mắt , sử_dụng",2,"Đã nhận được hàng, gửi nhanh có đầy đủ dây kèm theo, màn hình trước mắt xem rất tốt, không biết sử dụng có lâu không",5,https://shopee.vn/M%C3%A0n-h%C3%ACnh-m%C3%A1y-vi-t%C3%ADnh-Dell-hp-22i-20in-19in-17in-15in-wide-Vuong-h%C3%A0ng-c%C3%B4ng-ty-%C4%91%E1%BA%B9p-gi%C3%A1-chi-200k-b%E1%BA%A3o-h%C3%A0nh-chu-%C4%91%C3%A1o-t%E1%BA%A1i-shop-i.233603705.29781252988?extraParams=%7B%22display_model_id%22%3A385460453489%2C%22model_selection_logic%22%3A3%7D&sp_atk=fbfb3d51-7de0-4441-8918-61eda95bd70d&xptdk=fbfb3d51-7de0-4441-8918-61eda95bd70d,màn hình giá rẻ,2025-08-16
"giao hàng , cửa_hàng đóng_gói cẩn_thận , mô_tả cục tín_đâu chân tặng cửa_hàng 5",2,"Giao hàng nhanh, shop đóng gói cẩn thận, đúng mô tả có cục nguồn nữa mà tín đâu có chân tặng shop 5 sao",5,https://shopee.vn/M%C3%A0n-h%C3%ACnh-m%C3%A1y-vi-t%C3%ADnh-Dell-hp-22i-20in-19in-17in-15in-wide-Vuong-h%C3%A0ng-c%C3%B4ng-ty-%C4%91%E1%BA%B9p-gi%C3%A1-chi-200k-b%E1%BA%A3o-h%C3%A0nh-chu-%C4%91%C3%A1o-t%E1%BA%A1i-shop-i.233603705.29781252988?extraParams=%7B%22display_model_id%22%3A385460453489%2C%22model_selection_logic%22%3A3%7D&sp_atk=fbfb3d51-7de0-4441-8918-61eda95bd70d&xptdk=fbfb3d51-7de0-4441-8918-61eda95bd70d,màn hình giá rẻ,2025-10-18
"cửa_hàng giao hàng màn_hình hiển_thị_chuẩn , dịp mua ủng_hộ",2,"Shop giao hàng nhanh màn hình hiển thị chuẩn, nếu có dịp sẽ mua lại ủng hộ",5,https://shopee.vn/M%C3%A0n-h%C3%ACnh-m%C3%A1y-vi-t%C3%ADnh-Dell-hp-22i-20in-19in-17in-15in-wide-Vuong-h%C3%A0ng-c%C3%B4ng-ty-%C4%91%E1%BA%B9p-gi%C3%A1-chi-200k-b%E1%BA%A3o-h%C3%A0nh-chu-%C4%91%C3%A1o-t%E1%BA%A1i-shop-i.233603705.29781252988?extraParams=%7B%22display_model_id%22%3A385460453489%2C%22model_selection_logic%22%3A3%7D&sp_atk=fbfb3d51-7de0-4441-8918-61eda95bd70d&xptdk=fbfb3d51-7de0-4441-8918-61eda95bd70d,màn hình giá rẻ,2025-11-24
đẹp mong_đợi_sẻ ủng_hộ cửa_hàng,2,Quá đẹp hơn mong đợi sẻ ủng hộ shop thêm,5,https://shopee.vn/M%C3%A0n-h%C3%ACnh-m%C3%A1y-vi-t%C3%ADnh-Dell-hp-22i-20in-19in-17in-15in-wide-Vuong-h%C3%A0ng-c%C3%B4ng-ty-%C4%91%E1%BA%B9p-gi%C3%A1-chi-200k-b%E1%BA%A3o-h%C3%A0nh-chu-%C4%91%C3%A1o-t%E1%BA%A1i-shop-i.233603705.29781252988?extraParams=%7B%22display_model_id%22%3A385460453489%2C%22model_selection_logic%22%3A3%7D&sp_atk=fbfb3d51-7de0-4441-8918-61eda95bd70d&xptdk=fbfb3d51-7de0-4441-8918-61eda95bd70d,màn hình giá rẻ,2025-12-18
hoàn_hảo chê mua tiếp,2,Hoàn hảo không có gì để chê lần sau mua tiếp,5,https://shopee.vn/M%C3%A0n-h%C3%ACnh-m%C3%A1y-vi-t%C3%ADnh-Dell-hp-22i-20in-19in-17in-15in-wide-Vuong-h%C3%A0ng-c%C3%B4ng-ty-%C4%91%E1%BA%B9p-gi%C3%A1-chi-200k-b%E1%BA%A3o-h%C3%A0nh-chu-%C4%91%C3%A1o-t%E1%BA%A1i-shop-i.233603705.29781252988?extraParams=%7B%22display_model_id%22%3A385460453489%2C%22model_selection_logic%22%3A3%7D&sp_atk=fbfb3d51-7de0-4441-8918-61eda95bd70d&xptdk=fbfb3d51-7de0-4441-8918-61eda95bd70d,màn hình giá rẻ,2025-12-27
chất_lượng sản_phẩm tính_năng nổi_bật hỏng,0,"Chất lượng sản phẩm:😠😠
Tính năng nổi bật:hỏng",1,https://shopee.vn/M%C3%A0n-h%C3%ACnh-m%C3%A1y-vi-t%C3%ADnh-Dell-hp-22i-20in-19in-17in-15in-wide-Vuong-h%C3%A0ng-c%C3%B4ng-ty-%C4%91%E1%BA%B9p-gi%C3%A1-chi-200k-b%E1%BA%A3o-h%C3%A0nh-chu-%C4%91%C3%A1o-t%E1%BA%A1i-shop-i.233603705.29781252988?extraParams=%7B%22display_model_id%22%3A385460453489%2C%22model_selection_logic%22%3A3%7D&sp_atk=fbfb3d51-7de0-4441-8918-61eda95bd70d&xptdk=fbfb3d51-7de0-4441-8918-61eda95bd70d,màn hình giá rẻ,2025-07-06
"tính_năng nổi_bật màn_hình phụ chất_lượng sản_phẩm màn_hình oke , giá phù_hợp hssv , tần_số quét độ phủ xài ổn , màn phụ không_thể chê",2,"Tính năng nổi bật:màn hình phụ
Chất lượng sản phẩm:tốt

Màn hình oke, mức giá phù hợp với hssv, có tần số quét và độ phủ ở mức xài ổn, làm màn phụ ko thể chê",5,https://shopee.vn/M%C3%80N-H%C3%8CNH-GAMING-EDRA-EGM24F100S-EGM27F120S-EGM22F100H-EGM24F100PV-GI%C3%81-R%E1%BA%BA-CH%C3%8DNH-H%C3%83NG-i.1019908131.25319004225?extraParams=%7B%22display_model_id%22%3A250945707308%2C%22model_selection_logic%22%3A3%7D&sp_atk=d4f08a34-49e4-437d-9696-86c4f235a728&xptdk=d4f08a34-49e4-437d-9696-86c4f235a728,màn hình giá rẻ,2024-09-29
"tính_năng nổi_bật manhinh màn_hình đẹp , nét , to màn lap . đầu_tư . săn sale giá . cửa_hàng giao hàng . đóng_gói cẩn_thận",2,"Tính năng nổi bật:manhinh

Màn hình đẹp, rõ nét, dùng to rõ thích hơn màn lap. Nên đầu tư. Săn sale giá tốt. Shop giao hàng nhanh. Đóng gói cẩn thận",5,https://shopee.vn/M%C3%80N-H%C3%8CNH-GAMING-EDRA-EGM24F100S-EGM27F120S-EGM22F100H-EGM24F100PV-GI%C3%81-R%E1%BA%BA-CH%C3%8DNH-H%C3%83NG-i.1019908131.25319004225?extraParams=%7B%22display_model_id%22%3A250945707308%2C%22model_selection_logic%22%3A3%7D&sp_atk=d4f08a34-49e4-437d-9696-86c4f235a728&xptdk=d4f08a34-49e4-437d-9696-86c4f235a728,màn hình giá rẻ,2025-08-09
tính_năng nổi_bật xuất_hình đẹp chất_lượng sản_phẩm tầm giá đòi_hỏi hình_ảnh tươi_sáng mong sử_dụng bền_lâu cửa_hàng 5 s,2,"Tính năng nổi bật:xuất hình đẹp
Chất lượng sản phẩm:tốt

Trong tầm giá này ko đòi hỏi gì thêm nhưng hình ảnh mang lại vẫn rất tươi sáng tốt rõ mong là sẽ sử dụng được bền lâu cho shop 5s",5,https://shopee.vn/M%C3%80N-H%C3%8CNH-GAMING-EDRA-EGM24F100S-EGM27F120S-EGM22F100H-EGM24F100PV-GI%C3%81-R%E1%BA%BA-CH%C3%8DNH-H%C3%83NG-i.1019908131.25319004225?extraParams=%7B%22display_model_id%22%3A250945707308%2C%22model_selection_logic%22%3A3%7D&sp_atk=d4f08a34-49e4-437d-9696-86c4f235a728&xptdk=d4f08a34-49e4-437d-9696-86c4f235a728,màn hình giá rẻ,2025-05-09
"chất_lượng sản_phẩm chất_lượng sản_phẩm , mua màn_hình ngon , giao hàng , giá hợp_lý",2,"Chất lượng sản phẩm:chất lượng của sản phẩm tốt nhé, mình mua về dùng làm màn hình chính ngon, giao hàng nhanh, giá hợp lý",5,https://shopee.vn/M%C3%80N-H%C3%8CNH-GAMING-EDRA-EGM24F100S-EGM27F120S-EGM22F100H-EGM24F100PV-GI%C3%81-R%E1%BA%BA-CH%C3%8DNH-H%C3%83NG-i.1019908131.25319004225?extraParams=%7B%22display_model_id%22%3A250945707308%2C%22model_selection_logic%22%3A3%7D&sp_atk=d4f08a34-49e4-437d-9696-86c4f235a728&xptdk=d4f08a34-49e4-437d-9696-86c4f235a728,màn hình giá rẻ,2025-05-05
"chất_lượng sản_phẩm tính_năng nổi_bật màn_hình pc giao hàng mẫu_mã đẹp , đóng_gói chắc_chắn , chất luợng thời_gian đánh_giá",2,"Chất lượng sản phẩm:tốt
Tính năng nổi bật:màn hình pc

Giao hàng nhanh; mẫu mã đẹp, đóng gói chắc chắn, chất luợng cần thời gian để đánh giá",5,https://shopee.vn/M%C3%80N-H%C3%8CNH-GAMING-EDRA-EGM24F100S-EGM27F120S-EGM22F100H-EGM24F100PV-GI%C3%81-R%E1%BA%BA-CH%C3%8DNH-H%C3%83NG-i.1019908131.25319004225?extraParams=%7B%22display_model_id%22%3A250945707308%2C%22model_selection_logic%22%3A3%7D&sp_atk=d4f08a34-49e4-437d-9696-86c4f235a728&xptdk=d4f08a34-49e4-437d-9696-86c4f235a728,màn hình giá rẻ,2025-04-08
"máy 0 , 0 chê lói quá_sức sắc giá tiền , màu hình_ảnh đẹp máy siêu_mỏng nhẹ màn_hình to_đùng tràn viền",2,"Máy đúng là 0 điểm , 0 điểm nào để chê phải lói là quá sức sắc so với giá tiền , màu hình ảnh quá đẹp máy siêu mỏng nhẹ màn hình to đùng muốn tràn viền 😍😍😍",5,https://shopee.vn/M%C3%80N-H%C3%8CNH-GAMING-EDRA-EGM24F100S-EGM27F120S-EGM22F100H-EGM24F100PV-GI%C3%81-R%E1%BA%BA-CH%C3%8DNH-H%C3%83NG-i.1019908131.25319004225?extraParams=%7B%22display_model_id%22%3A250945707308%2C%22model_selection_logic%22%3A3%7D&sp_atk=d4f08a34-49e4-437d-9696-86c4f235a728&xptdk=d4f08a34-49e4-437d-9696-86c4f235a728,màn hình giá rẻ,2024-08-19
tính_năng nổi_bật màng_hình mỏng nhẹ chất_lượng sản_phẩm cửa_hàng tư_vấn hỗ_trợ nhiệt_tình giao hàng dài_lâu hiện_tại giá màng_hình như_vậy ổn mãi yêu cửa_hàng,2,"Tính năng nổi bật:màng hình mỏng nhẹ
Chất lượng sản phẩm:tốt

Shop tư vấn hỗ trợ nhiệt tình giao hàng nhanh thích quá luôn á chưa biết dùng dài lâu ra sao nhưng hiện tại giá đó mà đc màng hình như vậy là ổn rồi mãi yêu Shop",5,https://shopee.vn/M%C3%80N-H%C3%8CNH-GAMING-EDRA-EGM24F100S-EGM27F120S-EGM22F100H-EGM24F100PV-GI%C3%81-R%E1%BA%BA-CH%C3%8DNH-H%C3%83NG-i.1019908131.25319004225?extraParams=%7B%22display_model_id%22%3A250945707308%2C%22model_selection_logic%22%3A3%7D&sp_atk=d4f08a34-49e4-437d-9696-86c4f235a728&xptdk=d4f08a34-49e4-437d-9696-86c4f235a728,màn hình giá rẻ,2024-11-04
"chất_lượng sản_phẩm tầm_giá sản_phẩm tuyệt_vời , shiper nhiệt_tình 10",2,"Chất lượng sản phẩm:rất tốt so với tầm giá

Sản phẩm rất tốt và tuyệt vời, shiper rất nhiệt tình 10 điểm ko có nhưng",5,https://shopee.vn/M%C3%80N-H%C3%8CNH-GAMING-EDRA-EGM24F100S-EGM27F120S-EGM22F100H-EGM24F100PV-GI%C3%81-R%E1%BA%BA-CH%C3%8DNH-H%C3%83NG-i.1019908131.25319004225?extraParams=%7B%22display_model_id%22%3A250945707308%2C%22model_selection_logic%22%3A3%7D&sp_atk=d4f08a34-49e4-437d-9696-86c4f235a728&xptdk=d4f08a34-49e4-437d-9696-86c4f235a728,màn hình giá rẻ,2024-09-12
"tính_năng nổi_bật màn_hình máy_tính chất_lượng sản_phẩm hàng hãng , giá . vận_chuyển , đóng_gói cẩn_thận",2,"Tính năng nổi bật:màn hình máy tính
Chất lượng sản phẩm:tốt

Hàng chính hãng, giá tốt. Ship nhanh, đóng gói cẩn thận",5,https://shopee.vn/M%C3%80N-H%C3%8CNH-GAMING-EDRA-EGM24F100S-EGM27F120S-EGM22F100H-EGM24F100PV-GI%C3%81-R%E1%BA%BA-CH%C3%8DNH-H%C3%83NG-i.1019908131.25319004225?extraParams=%7B%22display_model_id%22%3A250945707308%2C%22model_selection_logic%22%3A3%7D&sp_atk=d4f08a34-49e4-437d-9696-86c4f235a728&xptdk=d4f08a34-49e4-437d-9696-86c4f235a728,màn hình giá rẻ,2024-12-13
hình_ảnh màu_sắc độ bền thời_gian đc . hàng giá rẻ sx tinh_giảm . cửa_hàng hỗ_trợ nhiệt_tình .,2,Hình ảnh màu sắc khá ok còn độ bền thì thời gian mới biết đc. Hàng giá rẻ nên nhà sx cũng tinh giảm là điều dễ hiểu. Shop hỗ trợ nhiệt tình.,5,https://shopee.vn/M%C3%80N-H%C3%8CNH-GAMING-EDRA-EGM24F100S-EGM27F120S-EGM22F100H-EGM24F100PV-GI%C3%81-R%E1%BA%BA-CH%C3%8DNH-H%C3%83NG-i.1019908131.25319004225?extraParams=%7B%22display_model_id%22%3A250945707308%2C%22model_selection_logic%22%3A3%7D&sp_atk=d4f08a34-49e4-437d-9696-86c4f235a728&xptdk=d4f08a34-49e4-437d-9696-86c4f235a728,màn hình giá rẻ,2025-05-25
tuyệt_vời ! chất_lượng ổn giá_thành ! sản_phẩm xứng_đáng tiền thiết_kế gọn_nhẹ giao hàng nhanh_chóng ! ! !,2,"Tuyệt vời! Chất lượng ổn so với giá thành !
Sản phẩm xứng đáng với số tiền 
Thiết kế gọn nhẹ 👍👍👍
Giao hàng nhanh chóng!!!",5,https://shopee.vn/M%C3%80N-H%C3%8CNH-GAMING-EDRA-EGM24F100S-EGM27F120S-EGM22F100H-EGM24F100PV-GI%C3%81-R%E1%BA%BA-CH%C3%8DNH-H%C3%83NG-i.1019908131.25319004225?extraParams=%7B%22display_model_id%22%3A250945707308%2C%22model_selection_logic%22%3A3%7D&sp_atk=d4f08a34-49e4-437d-9696-86c4f235a728&xptdk=d4f08a34-49e4-437d-9696-86c4f235a728,màn hình giá rẻ,2025-03-09
tính_năng nổi_bật ổn chất_lượng sản_phẩm ổn giá hợp_lý màn cửa_hàng tv nhiệt_tình sản_phẩm ổn tâdm giá ns ổn,2,"Tính năng nổi bật:ổn
Chất lượng sản phẩm:ổn

Giá hợp lý màn ok shop tv nhiệt tình sp ổn trong tâdm giá ns chung ổn",5,https://shopee.vn/M%C3%80N-H%C3%8CNH-GAMING-EDRA-EGM24F100S-EGM27F120S-EGM22F100H-EGM24F100PV-GI%C3%81-R%E1%BA%BA-CH%C3%8DNH-H%C3%83NG-i.1019908131.25319004225?extraParams=%7B%22display_model_id%22%3A250945707308%2C%22model_selection_logic%22%3A3%7D&sp_atk=d4f08a34-49e4-437d-9696-86c4f235a728&xptdk=d4f08a34-49e4-437d-9696-86c4f235a728,màn hình giá rẻ,2025-10-26
"tính_năng nổi_bật màn_pc chất_lượng sản_phẩm giao hàng , đóg_gói sản_phẩm chắc_chắn , chất_lượng thời_gian kiểm_chứng . hình_ảnh tính_chất xu .",2,"Tính năng nổi bật:màn pc
Chất lượng sản phẩm:tốt

Giao hàng nhanh,đóg gói sản phẩm chắc chắn, chất lượng cần thời gian để kiểm chứng. Hình ảnh mang tính chất nhận xu.",5,https://shopee.vn/M%C3%80N-H%C3%8CNH-GAMING-EDRA-EGM24F100S-EGM27F120S-EGM22F100H-EGM24F100PV-GI%C3%81-R%E1%BA%BA-CH%C3%8DNH-H%C3%83NG-i.1019908131.25319004225?extraParams=%7B%22display_model_id%22%3A250945707308%2C%22model_selection_logic%22%3A3%7D&sp_atk=d4f08a34-49e4-437d-9696-86c4f235a728&xptdk=d4f08a34-49e4-437d-9696-86c4f235a728,màn hình giá rẻ,2025-08-27
"chất_lượng sản_phẩm màn_hình sắc nét , chất_lượng , cửa_hàng đóng_gói hàng cẩn_thận",2,"Chất lượng sản phẩm:tốt

Màn hình sắc nét, chất lượng tốt, shop đóng gói hàng cẩn thận",5,https://shopee.vn/M%C3%80N-H%C3%8CNH-GAMING-EDRA-EGM24F100S-EGM27F120S-EGM22F100H-EGM24F100PV-GI%C3%81-R%E1%BA%BA-CH%C3%8DNH-H%C3%83NG-i.1019908131.25319004225?extraParams=%7B%22display_model_id%22%3A250945707308%2C%22model_selection_logic%22%3A3%7D&sp_atk=d4f08a34-49e4-437d-9696-86c4f235a728&xptdk=d4f08a34-49e4-437d-9696-86c4f235a728,màn hình giá rẻ,2024-12-30
"chất_lượng sản_phẩm chất_lượng mô_tả tính_năng nổi_bật màn_hình máy_tính hiển_thị sắc_nét , độ",2,"Chất lượng sản phẩm:chất lượng tốt như mô tả
Tính năng nổi bật:màn hình máy tính

Hiển thị sắc nét, độ sáng cao",5,https://shopee.vn/M%C3%80N-H%C3%8CNH-GAMING-EDRA-EGM24F100S-EGM27F120S-EGM22F100H-EGM24F100PV-GI%C3%81-R%E1%BA%BA-CH%C3%8DNH-H%C3%83NG-i.1019908131.25319004225?extraParams=%7B%22display_model_id%22%3A250945707308%2C%22model_selection_logic%22%3A3%7D&sp_atk=d4f08a34-49e4-437d-9696-86c4f235a728&xptdk=d4f08a34-49e4-437d-9696-86c4f235a728,màn hình giá rẻ,2024-09-05
màn_hình màu đẹp đóng hàng kĩ cẩn_thận màn_hình xài mua đợt sale giá ! cám_ơn cửa_hàng trải_nghiệm !,2,"Màn hình màu rất đẹp 
Đóng hàng rất kĩ và cẩn thận
Màn hình xài rất tốt
Mua ngay đợt sale giá rất tốt ! 
Cám ơn shop vì lần trải nghiệm này !",5,https://shopee.vn/M%C3%80N-H%C3%8CNH-GAMING-EDRA-EGM24F100S-EGM27F120S-EGM22F100H-EGM24F100PV-GI%C3%81-R%E1%BA%BA-CH%C3%8DNH-H%C3%83NG-i.1019908131.25319004225?extraParams=%7B%22display_model_id%22%3A250945707308%2C%22model_selection_logic%22%3A3%7D&sp_atk=d4f08a34-49e4-437d-9696-86c4f235a728&xptdk=d4f08a34-49e4-437d-9696-86c4f235a728,màn hình giá rẻ,2025-04-05
