clean_comment,label,comment,rating,source_url,keyword,date
"10 nha_shop , máy lắm , giá mong_đợi",2,"10 điểm nha shop, máy ok lắm ạ, với giá này hơn cả mong đợi của mình",5,https://shopee.vn/Robot-h%C3%BAt-b%E1%BB%A5i-lau-nh%C3%A0-ES330-l%E1%BB%B1c-h%C3%BAt-c%E1%BB%B1c-m%E1%BA%A1nh-3000PA-qu%C3%A9t-h%C3%BAt-lau-c%C3%B9ng-l%C3%BAc-b%E1%BA%A3o-h%C3%A0nh-24-Th%C3%A1ng.-i.1318936772.26457939772?extraParams=%7B%22display_model_id%22%3A410201441997%2C%22model_selection_logic%22%3A3%7D&sp_atk=587a7335-189c-42ab-bf5e-fd859382cde4&xptdk=587a7335-189c-42ab-bf5e-fd859382cde4,robot hút bụi lau nhà,2025-01-02
"máy hoạt_động , bền mua",2,"máy hoạt động tốt, dùng bền sẽ mua thêm",5,https://shopee.vn/Robot-h%C3%BAt-b%E1%BB%A5i-lau-nh%C3%A0-ES330-l%E1%BB%B1c-h%C3%BAt-c%E1%BB%B1c-m%E1%BA%A1nh-3000PA-qu%C3%A9t-h%C3%BAt-lau-c%C3%B9ng-l%C3%BAc-b%E1%BA%A3o-h%C3%A0nh-24-Th%C3%A1ng.-i.1318936772.26457939772?extraParams=%7B%22display_model_id%22%3A410201441997%2C%22model_selection_logic%22%3A3%7D&sp_atk=587a7335-189c-42ab-bf5e-fd859382cde4&xptdk=587a7335-189c-42ab-bf5e-fd859382cde4,robot hút bụi lau nhà,2025-04-23
đắn_đo mãi mua hàng hài_lòng,2,đắn đo mãi mới mua nhưng nhận hàng rồi thì rất hài lòng,5,https://shopee.vn/Robot-h%C3%BAt-b%E1%BB%A5i-lau-nh%C3%A0-ES330-l%E1%BB%B1c-h%C3%BAt-c%E1%BB%B1c-m%E1%BA%A1nh-3000PA-qu%C3%A9t-h%C3%BAt-lau-c%C3%B9ng-l%C3%BAc-b%E1%BA%A3o-h%C3%A0nh-24-Th%C3%A1ng.-i.1318936772.26457939772?extraParams=%7B%22display_model_id%22%3A410201441997%2C%22model_selection_logic%22%3A3%7D&sp_atk=587a7335-189c-42ab-bf5e-fd859382cde4&xptdk=587a7335-189c-42ab-bf5e-fd859382cde4,robot hút bụi lau nhà,2024-12-31
máy shiper thân_thiện bảo_đợi tí khó_chịu,1,máy dùng tốt nhưng shiper k thân thiện bảo đợi có tí mà khó chịu,3,https://shopee.vn/Robot-h%C3%BAt-b%E1%BB%A5i-lau-nh%C3%A0-ES330-l%E1%BB%B1c-h%C3%BAt-c%E1%BB%B1c-m%E1%BA%A1nh-3000PA-qu%C3%A9t-h%C3%BAt-lau-c%C3%B9ng-l%C3%BAc-b%E1%BA%A3o-h%C3%A0nh-24-Th%C3%A1ng.-i.1318936772.26457939772?extraParams=%7B%22display_model_id%22%3A410201441997%2C%22model_selection_logic%22%3A3%7D&sp_atk=587a7335-189c-42ab-bf5e-fd859382cde4&xptdk=587a7335-189c-42ab-bf5e-fd859382cde4,robot hút bụi lau nhà,2025-02-10
"giao hàng lắm , máy hoạt_động",2,"giao hàng nhanh lắm, máy hoạt động tốt",5,https://shopee.vn/Robot-h%C3%BAt-b%E1%BB%A5i-lau-nh%C3%A0-ES330-l%E1%BB%B1c-h%C3%BAt-c%E1%BB%B1c-m%E1%BA%A1nh-3000PA-qu%C3%A9t-h%C3%BAt-lau-c%C3%B9ng-l%C3%BAc-b%E1%BA%A3o-h%C3%A0nh-24-Th%C3%A1ng.-i.1318936772.26457939772?extraParams=%7B%22display_model_id%22%3A410201441997%2C%22model_selection_logic%22%3A3%7D&sp_atk=587a7335-189c-42ab-bf5e-fd859382cde4&xptdk=587a7335-189c-42ab-bf5e-fd859382cde4,robot hút bụi lau nhà,2024-10-21
"cửa_hàng cửa_hàng nhiệt_tình mua , mua tiếp",2,"tôi thấy shop này shop nhiệt tình nên mua dùng xem sao, ok sẽ mua tiếp",5,https://shopee.vn/Robot-h%C3%BAt-b%E1%BB%A5i-lau-nh%C3%A0-ES330-l%E1%BB%B1c-h%C3%BAt-c%E1%BB%B1c-m%E1%BA%A1nh-3000PA-qu%C3%A9t-h%C3%BAt-lau-c%C3%B9ng-l%C3%BAc-b%E1%BA%A3o-h%C3%A0nh-24-Th%C3%A1ng.-i.1318936772.26457939772?extraParams=%7B%22display_model_id%22%3A410201441997%2C%22model_selection_logic%22%3A3%7D&sp_atk=587a7335-189c-42ab-bf5e-fd859382cde4&xptdk=587a7335-189c-42ab-bf5e-fd859382cde4,robot hút bụi lau nhà,2024-09-18
"sản_phẩm tạm ổn , hoạt_động , độ bền thời_gian",2,"Sản phẩm tạm ổn, cũng hoạt động tốt, còn độ bền thì cần thời gian mới biết được",5,https://shopee.vn/Robot-h%C3%BAt-b%E1%BB%A5i-lau-nh%C3%A0-ES330-l%E1%BB%B1c-h%C3%BAt-c%E1%BB%B1c-m%E1%BA%A1nh-3000PA-qu%C3%A9t-h%C3%BAt-lau-c%C3%B9ng-l%C3%BAc-b%E1%BA%A3o-h%C3%A0nh-24-Th%C3%A1ng.-i.1318936772.26457939772?extraParams=%7B%22display_model_id%22%3A410201441997%2C%22model_selection_logic%22%3A3%7D&sp_atk=587a7335-189c-42ab-bf5e-fd859382cde4&xptdk=587a7335-189c-42ab-bf5e-fd859382cde4,robot hút bụi lau nhà,2026-01-08
"gói hàng đầy_đủ , tem_phiếu bảo_hành đầy_đủ",2,"gói hàng đầy đủ, tem phiếu bảo hành đầy đủ",5,https://shopee.vn/Robot-h%C3%BAt-b%E1%BB%A5i-lau-nh%C3%A0-ES330-l%E1%BB%B1c-h%C3%BAt-c%E1%BB%B1c-m%E1%BA%A1nh-3000PA-qu%C3%A9t-h%C3%BAt-lau-c%C3%B9ng-l%C3%BAc-b%E1%BA%A3o-h%C3%A0nh-24-Th%C3%A1ng.-i.1318936772.26457939772?extraParams=%7B%22display_model_id%22%3A410201441997%2C%22model_selection_logic%22%3A3%7D&sp_atk=587a7335-189c-42ab-bf5e-fd859382cde4&xptdk=587a7335-189c-42ab-bf5e-fd859382cde4,robot hút bụi lau nhà,2025-01-06
cửa_hàng tư_vấn nhiệt_tình lắm,2,shop tư vấn nhiệt tình lắm,5,https://shopee.vn/Robot-h%C3%BAt-b%E1%BB%A5i-lau-nh%C3%A0-ES330-l%E1%BB%B1c-h%C3%BAt-c%E1%BB%B1c-m%E1%BA%A1nh-3000PA-qu%C3%A9t-h%C3%BAt-lau-c%C3%B9ng-l%C3%BAc-b%E1%BA%A3o-h%C3%A0nh-24-Th%C3%A1ng.-i.1318936772.26457939772?extraParams=%7B%22display_model_id%22%3A410201441997%2C%22model_selection_logic%22%3A3%7D&sp_atk=587a7335-189c-42ab-bf5e-fd859382cde4&xptdk=587a7335-189c-42ab-bf5e-fd859382cde4,robot hút bụi lau nhà,2024-09-25
"đóng_gói chắc_chắn , giao hàng",2,"đóng gói chắc chắn , giao hàng nhanh",5,https://shopee.vn/Robot-h%C3%BAt-b%E1%BB%A5i-lau-nh%C3%A0-ES330-l%E1%BB%B1c-h%C3%BAt-c%E1%BB%B1c-m%E1%BA%A1nh-3000PA-qu%C3%A9t-h%C3%BAt-lau-c%C3%B9ng-l%C3%BAc-b%E1%BA%A3o-h%C3%A0nh-24-Th%C3%A1ng.-i.1318936772.26457939772?extraParams=%7B%22display_model_id%22%3A410201441997%2C%22model_selection_logic%22%3A3%7D&sp_atk=587a7335-189c-42ab-bf5e-fd859382cde4&xptdk=587a7335-189c-42ab-bf5e-fd859382cde4,robot hút bụi lau nhà,2024-11-07
cửa_hàng hỗ_trợ nhiệt_tình mua hàng,2,shop hỗ trợ nhiệt tình cả trước và sau khi mua hàng,5,https://shopee.vn/Robot-h%C3%BAt-b%E1%BB%A5i-lau-nh%C3%A0-ES330-l%E1%BB%B1c-h%C3%BAt-c%E1%BB%B1c-m%E1%BA%A1nh-3000PA-qu%C3%A9t-h%C3%BAt-lau-c%C3%B9ng-l%C3%BAc-b%E1%BA%A3o-h%C3%A0nh-24-Th%C3%A1ng.-i.1318936772.26457939772?extraParams=%7B%22display_model_id%22%3A410201441997%2C%22model_selection_logic%22%3A3%7D&sp_atk=587a7335-189c-42ab-bf5e-fd859382cde4&xptdk=587a7335-189c-42ab-bf5e-fd859382cde4,robot hút bụi lau nhà,2025-01-24
"giao , gói hàng cẩn_thận",2,"giao nhanh, gói hàng rất cẩn thận",5,https://shopee.vn/Robot-h%C3%BAt-b%E1%BB%A5i-lau-nh%C3%A0-ES330-l%E1%BB%B1c-h%C3%BAt-c%E1%BB%B1c-m%E1%BA%A1nh-3000PA-qu%C3%A9t-h%C3%BAt-lau-c%C3%B9ng-l%C3%BAc-b%E1%BA%A3o-h%C3%A0nh-24-Th%C3%A1ng.-i.1318936772.26457939772?extraParams=%7B%22display_model_id%22%3A410201441997%2C%22model_selection_logic%22%3A3%7D&sp_atk=587a7335-189c-42ab-bf5e-fd859382cde4&xptdk=587a7335-189c-42ab-bf5e-fd859382cde4,robot hút bụi lau nhà,2025-05-19
"đóng_gói cẩn_thận , giao hàng",2,"đóng gói cẩn thận, giao hàng nhanh",5,https://shopee.vn/Robot-h%C3%BAt-b%E1%BB%A5i-lau-nh%C3%A0-ES330-l%E1%BB%B1c-h%C3%BAt-c%E1%BB%B1c-m%E1%BA%A1nh-3000PA-qu%C3%A9t-h%C3%BAt-lau-c%C3%B9ng-l%C3%BAc-b%E1%BA%A3o-h%C3%A0nh-24-Th%C3%A1ng.-i.1318936772.26457939772?extraParams=%7B%22display_model_id%22%3A410201441997%2C%22model_selection_logic%22%3A3%7D&sp_atk=587a7335-189c-42ab-bf5e-fd859382cde4&xptdk=587a7335-189c-42ab-bf5e-fd859382cde4,robot hút bụi lau nhà,2024-11-04
"đóng_gói cẩn_thận , giao",2,"đóng gói cẩn thận, giao nhanh",5,https://shopee.vn/Robot-h%C3%BAt-b%E1%BB%A5i-lau-nh%C3%A0-ES330-l%E1%BB%B1c-h%C3%BAt-c%E1%BB%B1c-m%E1%BA%A1nh-3000PA-qu%C3%A9t-h%C3%BAt-lau-c%C3%B9ng-l%C3%BAc-b%E1%BA%A3o-h%C3%A0nh-24-Th%C3%A1ng.-i.1318936772.26457939772?extraParams=%7B%22display_model_id%22%3A410201441997%2C%22model_selection_logic%22%3A3%7D&sp_atk=587a7335-189c-42ab-bf5e-fd859382cde4&xptdk=587a7335-189c-42ab-bf5e-fd859382cde4,robot hút bụi lau nhà,2024-09-27
cửa_hàng tư_vấn nhiệt_tình mua hàng,2,shop tư vấn nhiệt tình cả trước và sau khi mua hàng,5,https://shopee.vn/Robot-h%C3%BAt-b%E1%BB%A5i-lau-nh%C3%A0-ES330-l%E1%BB%B1c-h%C3%BAt-c%E1%BB%B1c-m%E1%BA%A1nh-3000PA-qu%C3%A9t-h%C3%BAt-lau-c%C3%B9ng-l%C3%BAc-b%E1%BA%A3o-h%C3%A0nh-24-Th%C3%A1ng.-i.1318936772.26457939772?extraParams=%7B%22display_model_id%22%3A410201441997%2C%22model_selection_logic%22%3A3%7D&sp_atk=587a7335-189c-42ab-bf5e-fd859382cde4&xptdk=587a7335-189c-42ab-bf5e-fd859382cde4,robot hút bụi lau nhà,2024-09-14
quên yên_tâm mua cửa_hàng,2,là khách quên nên tôi rất yên tâm khi mua của shop này,5,https://shopee.vn/Robot-h%C3%BAt-b%E1%BB%A5i-lau-nh%C3%A0-ES330-l%E1%BB%B1c-h%C3%BAt-c%E1%BB%B1c-m%E1%BA%A1nh-3000PA-qu%C3%A9t-h%C3%BAt-lau-c%C3%B9ng-l%C3%BAc-b%E1%BA%A3o-h%C3%A0nh-24-Th%C3%A1ng.-i.1318936772.26457939772?extraParams=%7B%22display_model_id%22%3A410201441997%2C%22model_selection_logic%22%3A3%7D&sp_atk=587a7335-189c-42ab-bf5e-fd859382cde4&xptdk=587a7335-189c-42ab-bf5e-fd859382cde4,robot hút bụi lau nhà,2024-09-18
"hàng ổn , máy hút , sạch",2,"hàng ổn, máy hút mạnh, sạch",5,https://shopee.vn/Robot-h%C3%BAt-b%E1%BB%A5i-lau-nh%C3%A0-ES330-l%E1%BB%B1c-h%C3%BAt-c%E1%BB%B1c-m%E1%BA%A1nh-3000PA-qu%C3%A9t-h%C3%BAt-lau-c%C3%B9ng-l%C3%BAc-b%E1%BA%A3o-h%C3%A0nh-24-Th%C3%A1ng.-i.1318936772.26457939772?extraParams=%7B%22display_model_id%22%3A410201441997%2C%22model_selection_logic%22%3A3%7D&sp_atk=587a7335-189c-42ab-bf5e-fd859382cde4&xptdk=587a7335-189c-42ab-bf5e-fd859382cde4,robot hút bụi lau nhà,2025-03-31
"máy hoạt_động yếu , đồ_chơi hợp dù_sao phù_hợp giá tiền !",0,"Máy hoạt động yếu, làm đồ chơi thì hợp
Dù sao cũng phù hợp với giá tiền!",1,https://shopee.vn/Robot-h%C3%BAt-b%E1%BB%A5i-lau-nh%C3%A0-ES330-l%E1%BB%B1c-h%C3%BAt-c%E1%BB%B1c-m%E1%BA%A1nh-3000PA-qu%C3%A9t-h%C3%BAt-lau-c%C3%B9ng-l%C3%BAc-b%E1%BA%A3o-h%C3%A0nh-24-Th%C3%A1ng.-i.1318936772.26457939772?extraParams=%7B%22display_model_id%22%3A410201441997%2C%22model_selection_logic%22%3A3%7D&sp_atk=587a7335-189c-42ab-bf5e-fd859382cde4&xptdk=587a7335-189c-42ab-bf5e-fd859382cde4,robot hút bụi lau nhà,2024-11-20
"giao lắm , máy hoạt_động",2,"giao nhanh lắm, máy hoạt động tốt",5,https://shopee.vn/Robot-h%C3%BAt-b%E1%BB%A5i-lau-nh%C3%A0-ES330-l%E1%BB%B1c-h%C3%BAt-c%E1%BB%B1c-m%E1%BA%A1nh-3000PA-qu%C3%A9t-h%C3%BAt-lau-c%C3%B9ng-l%C3%BAc-b%E1%BA%A3o-h%C3%A0nh-24-Th%C3%A1ng.-i.1318936772.26457939772?extraParams=%7B%22display_model_id%22%3A410201441997%2C%22model_selection_logic%22%3A3%7D&sp_atk=587a7335-189c-42ab-bf5e-fd859382cde4&xptdk=587a7335-189c-42ab-bf5e-fd859382cde4,robot hút bụi lau nhà,2025-04-21
"máy , đẹp , cửa_hàng giao mẫu",2,"máy mới, đẹp, shop giao đúng mẫu",5,https://shopee.vn/Robot-h%C3%BAt-b%E1%BB%A5i-lau-nh%C3%A0-ES330-l%E1%BB%B1c-h%C3%BAt-c%E1%BB%B1c-m%E1%BA%A1nh-3000PA-qu%C3%A9t-h%C3%BAt-lau-c%C3%B9ng-l%C3%BAc-b%E1%BA%A3o-h%C3%A0nh-24-Th%C3%A1ng.-i.1318936772.26457939772?extraParams=%7B%22display_model_id%22%3A410201441997%2C%22model_selection_logic%22%3A3%7D&sp_atk=587a7335-189c-42ab-bf5e-fd859382cde4&xptdk=587a7335-189c-42ab-bf5e-fd859382cde4,robot hút bụi lau nhà,2025-02-06
"máy đẹp , hút bụi",2,"máy mới đẹp, hút bụi tốt",5,https://shopee.vn/Robot-h%C3%BAt-b%E1%BB%A5i-lau-nh%C3%A0-ES330-l%E1%BB%B1c-h%C3%BAt-c%E1%BB%B1c-m%E1%BA%A1nh-3000PA-qu%C3%A9t-h%C3%BAt-lau-c%C3%B9ng-l%C3%BAc-b%E1%BA%A3o-h%C3%A0nh-24-Th%C3%A1ng.-i.1318936772.26457939772?extraParams=%7B%22display_model_id%22%3A410201441997%2C%22model_selection_logic%22%3A3%7D&sp_atk=587a7335-189c-42ab-bf5e-fd859382cde4&xptdk=587a7335-189c-42ab-bf5e-fd859382cde4,robot hút bụi lau nhà,2024-09-26
"máy , đẹp , tem_phiếu bảo_hành đầy_đủ",2,"máy mới, đẹp, tem phiếu bảo hành đầy đủ",5,https://shopee.vn/Robot-h%C3%BAt-b%E1%BB%A5i-lau-nh%C3%A0-ES330-l%E1%BB%B1c-h%C3%BAt-c%E1%BB%B1c-m%E1%BA%A1nh-3000PA-qu%C3%A9t-h%C3%BAt-lau-c%C3%B9ng-l%C3%BAc-b%E1%BA%A3o-h%C3%A0nh-24-Th%C3%A1ng.-i.1318936772.26457939772?extraParams=%7B%22display_model_id%22%3A410201441997%2C%22model_selection_logic%22%3A3%7D&sp_atk=587a7335-189c-42ab-bf5e-fd859382cde4&xptdk=587a7335-189c-42ab-bf5e-fd859382cde4,robot hút bụi lau nhà,2025-02-03
"gói hàng cẩn_thận , giao lắm",2,"gói hàng cẩn thận, giao nhanh lắm",5,https://shopee.vn/Robot-h%C3%BAt-b%E1%BB%A5i-lau-nh%C3%A0-ES330-l%E1%BB%B1c-h%C3%BAt-c%E1%BB%B1c-m%E1%BA%A1nh-3000PA-qu%C3%A9t-h%C3%BAt-lau-c%C3%B9ng-l%C3%BAc-b%E1%BA%A3o-h%C3%A0nh-24-Th%C3%A1ng.-i.1318936772.26457939772?extraParams=%7B%22display_model_id%22%3A410201441997%2C%22model_selection_logic%22%3A3%7D&sp_atk=587a7335-189c-42ab-bf5e-fd859382cde4&xptdk=587a7335-189c-42ab-bf5e-fd859382cde4,robot hút bụi lau nhà,2024-12-28
"mua 2 , 1 tặng ng ta , xài test hút đc . pin lâu_nha , chạy chừng tầm 20 phút pin",1,"Đã mua 2 cái, 1 lần tặng ng ta, lần này mình xài mình test thấy Hút cũng đc. Nhưng pin ko lâu nha, chạy chừng tầm 20 phút là hết pin rồi",3,https://shopee.vn/Robot-h%C3%BAt-b%E1%BB%A5i-lau-nh%C3%A0-ES330-l%E1%BB%B1c-h%C3%BAt-c%E1%BB%B1c-m%E1%BA%A1nh-3000PA-qu%C3%A9t-h%C3%BAt-lau-c%C3%B9ng-l%C3%BAc-b%E1%BA%A3o-h%C3%A0nh-24-Th%C3%A1ng.-i.1318936772.26457939772?extraParams=%7B%22display_model_id%22%3A410201441997%2C%22model_selection_logic%22%3A3%7D&sp_atk=587a7335-189c-42ab-bf5e-fd859382cde4&xptdk=587a7335-189c-42ab-bf5e-fd859382cde4,robot hút bụi lau nhà,2025-03-24
"máy xịn_sò , đẹp , êm , lau sạch , sử_dụng . đầy_đủ giao hàng . bé mèo tiện , giải_phóng sức_lao_động .",2,"Máy xịn sò, đẹp, êm, lau rất sạch, dễ sử dụng. Đầy đủ và giao hàng nhanh.
Nhà có em bé và nhiều mèo rất tiện, giải phóng sức lao động.",5,https://shopee.vn/Roborock-Qrevo-C-Pro-robot-h%C3%BAt-b%E1%BB%A5i-lau-nh%C3%A0-Gi%E1%BA%B7t-gi%E1%BA%BB-75-%C4%91%E1%BB%99-S%E1%BA%A5y-kh%C3%B4-45-%C4%91%E1%BB%99-C-L%E1%BB%B1c-h%C3%BAt-18.500-pa-B%E1%BA%A3o-h%C3%A0nh-i.1145174818.25681011076?extraParams=%7B%22display_model_id%22%3A300775736954%2C%22model_selection_logic%22%3A3%7D&sp_atk=5321ffb7-a599-4e5c-9162-65b0edf0b748&xptdk=5321ffb7-a599-4e5c-9162-65b0edf0b748,robot hút bụi lau nhà,2024-10-27
"lau sạch sạch bóng ck bảo được_việc , bt lau 3 bóng lau 1 bóng sạch , con_em đi lau xúm lau . y đứa con_nít . cửa_hàng 5 nha tui giới_thiệu mua",2,"Lau sạch:sạch bóng

Ck bảo nó làm được việc, bt  nhà phải lau 3 lần mới bóng
Mà nó lau 1 lần bóng sạch, mỗi lần con em đi lau nhà là cả nhà xúm xem nó lau. Y đứa con nít trong nhà. Cho shop 5 sao nha

Này tui cũng đc bà chị giới thiệu mua",5,https://shopee.vn/Roborock-Qrevo-C-Pro-robot-h%C3%BAt-b%E1%BB%A5i-lau-nh%C3%A0-Gi%E1%BA%B7t-gi%E1%BA%BB-75-%C4%91%E1%BB%99-S%E1%BA%A5y-kh%C3%B4-45-%C4%91%E1%BB%99-C-L%E1%BB%B1c-h%C3%BAt-18.500-pa-B%E1%BA%A3o-h%C3%A0nh-i.1145174818.25681011076?extraParams=%7B%22display_model_id%22%3A300775736954%2C%22model_selection_logic%22%3A3%7D&sp_atk=5321ffb7-a599-4e5c-9162-65b0edf0b748&xptdk=5321ffb7-a599-4e5c-9162-65b0edf0b748,robot hút bụi lau nhà,2025-12-15
"ban_đầu mua qrevo s săn voucher sâu , 2 tuần đánh_giá nhin xứng_đáng_giá tiền . nuôi mèo tóc , lông_rụng khắp sàn , robot sạch , pin trầu hẳn , hút xong gọn_gàng hẳn . né đồ_vật cảm_nhận . nhân_viên cửa_hàng siu_dth nhắn hướng_dẫn cỡ 11 h đêm cửa_hàng trả_lời trả_lời hướng_dẫn đêm . giao_diện app , kết_nối , dở công_nghệ hướng . bận_rộn thú cưng cân_nhắc . thời_gian máy mua ủng_hộ cửa_hàng 1 máy lầu .",2,"Ban đầu mình mua Qrevo S vì săn được voucher giảm sâu, sau 2 tuần dùng mới lên đánh giá nhin chung thấy xứng đáng giá tiền. Nhà mình có nuôi mèo nên ngày nào cũng có tóc, lông rụng khắp sàn, robot làm sạch tốt, pin trầu hẳn, hút xong là gọn gàng hẳn. Né đồ vật trong nhà theo cảm nhận mình là tốt. 
Nhân viên shop siu dth mình nhắn nhờ hướng dẫn lúc cỡ 11h đêm nghĩ sáng shop mới trả lời thì các bạn trả lời hướng dẫn ngay trong đêm cho mình.
Giao diện app dùng dễ, không khó kết nối như nhiều người nói, mình dở công nghệ nhưng nghe hướng dùng thấy không khó.
Ai bận rộn hoặc có thú cưng giống mình thì nên cân nhắc em này. Nếu dùng thời gian dài máy tốt sẽ mua ủng hộ shop thêm 1 máy để trên lầu.",5,https://shopee.vn/Roborock-Qrevo-C-Pro-robot-h%C3%BAt-b%E1%BB%A5i-lau-nh%C3%A0-Gi%E1%BA%B7t-gi%E1%BA%BB-75-%C4%91%E1%BB%99-S%E1%BA%A5y-kh%C3%B4-45-%C4%91%E1%BB%99-C-L%E1%BB%B1c-h%C3%BAt-18.500-pa-B%E1%BA%A3o-h%C3%A0nh-i.1145174818.25681011076?extraParams=%7B%22display_model_id%22%3A300775736954%2C%22model_selection_logic%22%3A3%7D&sp_atk=5321ffb7-a599-4e5c-9162-65b0edf0b748&xptdk=5321ffb7-a599-4e5c-9162-65b0edf0b748,robot hút bụi lau nhà,2025-07-19
"mô_tả tính_năng nổi_bật hút_bụi lau_ướt chất_lượng sản_phẩm ok máy , mày_mò làm_quen thiết_lập . khôn hồi loay_hoay vứt tự_đo vẽ tự_lau , làm_gì miễn_là tí kiểm_tra sạch . sạch bắt_lau quà tặng đầy_đủ xài . 3/8 24 h quét hoàn_thiện bản_đồ , kế_hoạch lau dọn thông_minh . sàn sạch bong kin kít mn . nhũng lăn_tăn sắm , sắm khẩn_trương một_vài nâng tầm cuộc_sống . mua bao_nhiêu máy hút bụi robot ưng .",2,"Đúng với mô tả:đúng
Tính năng nổi bật:hút bụi và lau ướt
Chất lượng sản phẩm:ok

Mới nhận máy, đang mày mò làm quen cũng như thiết lập. Được cái em nó cũng khôn nên sau một hồi loay hoay mình vứt nó ra giữa nhà cho nó tự đo tự vẽ tự lau, muốn làm gì thì làm miễn là tí nữa mình lên kiểm tra thấy sạch là được. Không sạch bắt lau lại 🤣🤣🤣 Quà tặng thì đầy đủ nhưng mình chưa xài.
3/8: chưa đầy 24h em nó quét và hoàn thiện bản đồ nhà, ra kế hoạch lau dọn thông minh. Sàn sạch bong kin kít mn ạ. Nhũng ai còn đang lăn tăn thì nên sắm ngay, sắm khẩn trương một vài em để nâng tầm cuộc sống các bác ạ. Mua bao nhiêu máy hút bụi với robot rồi tới giờ mới ưng.",5,https://shopee.vn/Roborock-Qrevo-C-Pro-robot-h%C3%BAt-b%E1%BB%A5i-lau-nh%C3%A0-Gi%E1%BA%B7t-gi%E1%BA%BB-75-%C4%91%E1%BB%99-S%E1%BA%A5y-kh%C3%B4-45-%C4%91%E1%BB%99-C-L%E1%BB%B1c-h%C3%BAt-18.500-pa-B%E1%BA%A3o-h%C3%A0nh-i.1145174818.25681011076?extraParams=%7B%22display_model_id%22%3A300775736954%2C%22model_selection_logic%22%3A3%7D&sp_atk=5321ffb7-a599-4e5c-9162-65b0edf0b748&xptdk=5321ffb7-a599-4e5c-9162-65b0edf0b748,robot hút bụi lau nhà,2025-08-01
"qrevos - đóng_gói cẩn_thận , vận_chuyển hcm hn 4 - hàng hãng 5 vận_hàng tính_năng mô_tả thông_minh , vận_hành tự_động tính_năng , quét lau sạch , giặt_giẻ , lau góc lau góc tưởng mua tính_năng xòe_giẻ phân_khúc tìm_hiểu . app , sử_dụng cảm_nhận máy xứng_đáng mua , giải_tỏa sức_lao_động , sạch_sẽ hẳn sướng !",2,"QRevoS - Đóng gói cẩn thận, ship HCM ra HN ra mất 4 ngày - ok
Hàng chính hãng
Mình mới dùng được 5 ngày
Vận hàng tính năng theo mô tả tốt: thông minh, vận hành tự động nhiều tính năng, quét lau sạch , tự giặt giẻ, k lau được trong góc nhưng mình thấy ok vì muốn lau đc góc tưởng cần mua tính năng xoè giẻ ở phân khúc cao hơn như đã tìm hiểu .
App dùng tốt , dễ sử dụng 
Cảm nhận: máy xứng đáng mua, giải toả sức lao động nhiều, nhà sạch sẽ hẳn là sướng nhất !",5,https://shopee.vn/Roborock-Qrevo-C-Pro-robot-h%C3%BAt-b%E1%BB%A5i-lau-nh%C3%A0-Gi%E1%BA%B7t-gi%E1%BA%BB-75-%C4%91%E1%BB%99-S%E1%BA%A5y-kh%C3%B4-45-%C4%91%E1%BB%99-C-L%E1%BB%B1c-h%C3%BAt-18.500-pa-B%E1%BA%A3o-h%C3%A0nh-i.1145174818.25681011076?extraParams=%7B%22display_model_id%22%3A300775736954%2C%22model_selection_logic%22%3A3%7D&sp_atk=5321ffb7-a599-4e5c-9162-65b0edf0b748&xptdk=5321ffb7-a599-4e5c-9162-65b0edf0b748,robot hút bụi lau nhà,2025-05-11
chất_lượng sản_phẩm tính_năng nổi_bật mô_tả hàng chuẩn máy ngon khuyên_mn mua hẳn bé 5 ae full ngóc_ngách . dù_sao tiền mua lâu_dài,2,"Chất lượng sản phẩm:tốt
Tính năng nổi bật:tốt
Đúng với mô tả:hàng chuẩn

Máy ngon nhưng khuyên mn nên mua hẳn bé 5AE cho full mọi ngóc ngách. Dù sao cũng bỏ tiền rồi nên mua dùng cho lâu dài",5,https://shopee.vn/Roborock-Qrevo-C-Pro-robot-h%C3%BAt-b%E1%BB%A5i-lau-nh%C3%A0-Gi%E1%BA%B7t-gi%E1%BA%BB-75-%C4%91%E1%BB%99-S%E1%BA%A5y-kh%C3%B4-45-%C4%91%E1%BB%99-C-L%E1%BB%B1c-h%C3%BAt-18.500-pa-B%E1%BA%A3o-h%C3%A0nh-i.1145174818.25681011076?extraParams=%7B%22display_model_id%22%3A300775736954%2C%22model_selection_logic%22%3A3%7D&sp_atk=5321ffb7-a599-4e5c-9162-65b0edf0b748&xptdk=5321ffb7-a599-4e5c-9162-65b0edf0b748,robot hút bụi lau nhà,2025-04-28
"mô_tả ok tính_năng nổi_bật quét lau chất_lượng sản_phẩm tốt_nha săn sale 9 tr2 tốt_phết đi app thông_minh hiện_đại_nhe , app thiết_bị lau_nha sạch ưng hihi",2,"Đúng với mô tả:ok
Tính năng nổi bật:quét nhà lau nhà
Chất lượng sản phẩm:tốt nha

mình săn sale đc 9tr2 cũng oke phết mọi người ạ nó tự đi tự làm app thông minh hiện đại nhe mọi người,dùng app đc ở nhiều thiết bị lau nha sạch nhà mình rất ưng hihi",5,https://shopee.vn/Roborock-Qrevo-C-Pro-robot-h%C3%BAt-b%E1%BB%A5i-lau-nh%C3%A0-Gi%E1%BA%B7t-gi%E1%BA%BB-75-%C4%91%E1%BB%99-S%E1%BA%A5y-kh%C3%B4-45-%C4%91%E1%BB%99-C-L%E1%BB%B1c-h%C3%BAt-18.500-pa-B%E1%BA%A3o-h%C3%A0nh-i.1145174818.25681011076?extraParams=%7B%22display_model_id%22%3A300775736954%2C%22model_selection_logic%22%3A3%7D&sp_atk=5321ffb7-a599-4e5c-9162-65b0edf0b748&xptdk=5321ffb7-a599-4e5c-9162-65b0edf0b748,robot hút bụi lau nhà,2025-07-16
"mô_tả_dung chất_lượng sản_phẩm tot tính_năng nổi_bật hút mùi lau hàng test máy , máy thông_minh , mua",2,"Đúng với mô tả:Dung
Chất lượng sản phẩm:tot
Tính năng nổi bật:hút mùi và lau

Mới nhận hàng test máy ok , máy thông minh , đáng mua ạ",5,https://shopee.vn/Roborock-Qrevo-C-Pro-robot-h%C3%BAt-b%E1%BB%A5i-lau-nh%C3%A0-Gi%E1%BA%B7t-gi%E1%BA%BB-75-%C4%91%E1%BB%99-S%E1%BA%A5y-kh%C3%B4-45-%C4%91%E1%BB%99-C-L%E1%BB%B1c-h%C3%BAt-18.500-pa-B%E1%BA%A3o-h%C3%A0nh-i.1145174818.25681011076?extraParams=%7B%22display_model_id%22%3A300775736954%2C%22model_selection_logic%22%3A3%7D&sp_atk=5321ffb7-a599-4e5c-9162-65b0edf0b748&xptdk=5321ffb7-a599-4e5c-9162-65b0edf0b748,robot hút bụi lau nhà,2025-12-24
chất_lượng sản_phẩm mô_tả tính_năng nổi_bật hút bụi lau test thử 1 . cầm chổi .,2,"Chất lượng sản phẩm:tốt
Đúng với mô tả:đúng
Tính năng nổi bật:vừa hút bụi vừa lau nhà

Đang test thử được 1 tháng rồi. Dùng tốt không phải cầm đến cây chổi nữa.",5,https://shopee.vn/Roborock-Qrevo-C-Pro-robot-h%C3%BAt-b%E1%BB%A5i-lau-nh%C3%A0-Gi%E1%BA%B7t-gi%E1%BA%BB-75-%C4%91%E1%BB%99-S%E1%BA%A5y-kh%C3%B4-45-%C4%91%E1%BB%99-C-L%E1%BB%B1c-h%C3%BAt-18.500-pa-B%E1%BA%A3o-h%C3%A0nh-i.1145174818.25681011076?extraParams=%7B%22display_model_id%22%3A300775736954%2C%22model_selection_logic%22%3A3%7D&sp_atk=5321ffb7-a599-4e5c-9162-65b0edf0b748&xptdk=5321ffb7-a599-4e5c-9162-65b0edf0b748,robot hút bụi lau nhà,2024-12-31
"canh 5 ae mãi 1 , 13 tr700 , 12 tr700 , 12 tr331 . hôm hên vô trúng live gil lê_nhân tri ân_thẻ hạng member kim_cương sâu cỡ 11 tr550 dớt , trả_góp 2 free_phí . quyết_định sáng_suốt cviec bận , chồng bận gánh lu_bu . thế_là nhấn_lệnh ẽm làm_việc , trưa sạch tinh_tươm . mặc_dù cam_xịn mấy dòng cao_cấp , tuyệt_nhiên cảm_biến thông_minh . giá mềm chức_năng giặt giẻ_sấy nc nong đổ rác , hai thanh_lăn chống rối_tóc . đối_với . khuyến_khích ng mua e . tặng kèm nc_giặt bao rác hãng",2,"Mình canh em 5AE này mãi trong hơn 1 tháng, lúc thì 13tr700, lúc thì 12tr700, lúc thì 12tr331. Hôm đó hên sao vô trúng live của Gil Lê nhân ngày tri ân thẻ hạng member kim cương được giảm sâu còn cỡ 11tr550 nên mình dớt luôn, dc trả góp trong 2 tháng free phí. Quyết định sáng suốt do cviec mình bận, chồng cũng bận nên việc nhà là gánh nặng khi mà mình quá lu bu. Thế là trước khi ra khỏi nhà nhấn lệnh cho ẽm làm việc, trưa về nhà sạch tinh tươm. Mặc dù nó ko có con Cam xịn như mấy dòng cao cấp hơn, nhưng tuyệt nhiên cảm biến của nó vẫn rất thông minh. Giá lại mềm và đủ chức năng giặt giẻ sấy nc nong đổ rác, có hai thanh lăn chống rối tóc. Quá oke đối với mình. Khuyến khích mọi ng mua e này. Được tặng kèm nc giặt và bao rác của hãng",5,https://shopee.vn/Roborock-Qrevo-C-Pro-robot-h%C3%BAt-b%E1%BB%A5i-lau-nh%C3%A0-Gi%E1%BA%B7t-gi%E1%BA%BB-75-%C4%91%E1%BB%99-S%E1%BA%A5y-kh%C3%B4-45-%C4%91%E1%BB%99-C-L%E1%BB%B1c-h%C3%BAt-18.500-pa-B%E1%BA%A3o-h%C3%A0nh-i.1145174818.25681011076?extraParams=%7B%22display_model_id%22%3A300775736954%2C%22model_selection_logic%22%3A3%7D&sp_atk=5321ffb7-a599-4e5c-9162-65b0edf0b748&xptdk=5321ffb7-a599-4e5c-9162-65b0edf0b748,robot hút bụi lau nhà,2025-05-23
