clean_comment,label,comment,rating,source_url,keyword,date
"mua đồ điện_tử online_sợ vận_chuyển hàng . may đầu mua cửa_hàng hàng đóng chắc_chắn cẩn_thận , vận_chuyển . đầy_đủ phụ_tùng đi kèm yên_tâm . dân vp mua màn phụ 22 inch ổn tầm giá .",2,"Mua đồ điện tử online sợ nhất là khoảng ship hàng.
May quá lần đầu mua của shop mà hàng đóng chắc chắn cẩn thận, ship nhanh nữa.
Đầy đủ phụ tùng đi kèm rất là yên tâm.
Dân vp mua màn phụ như mình thì con 22 inch này là quá ổn trong tầm giá rồi.",5,https://shopee.vn/M%C3%80N-H%C3%8CNH-GAMING-EDRA-EGM24F100S-EGM27F120S-EGM22F100H-EGM24F100PV-GI%C3%81-R%E1%BA%BA-CH%C3%8DNH-H%C3%83NG-i.1019908131.25319004225?extraParams=%7B%22display_model_id%22%3A250945707308%2C%22model_selection_logic%22%3A3%7D&sp_atk=d4f08a34-49e4-437d-9696-86c4f235a728&xptdk=d4f08a34-49e4-437d-9696-86c4f235a728,màn hình giá rẻ,2026-01-18
"chất_lượng sản_phẩm đẹp , lắp_ráp , màn 100 hz ưng_mắt .",2,"Chất lượng sản phẩm:Đẹp, dễ lắp ráp, màn 100hz nhìn ưng mắt.",5,https://shopee.vn/M%C3%80N-H%C3%8CNH-GAMING-EDRA-EGM24F100S-EGM27F120S-EGM22F100H-EGM24F100PV-GI%C3%81-R%E1%BA%BA-CH%C3%8DNH-H%C3%83NG-i.1019908131.25319004225?extraParams=%7B%22display_model_id%22%3A250945707308%2C%22model_selection_logic%22%3A3%7D&sp_atk=d4f08a34-49e4-437d-9696-86c4f235a728&xptdk=d4f08a34-49e4-437d-9696-86c4f235a728,màn hình giá rẻ,2025-02-05
chất_lượng sản_phẩm màn đẹp tính_năng nổi_bật màu ổn_định giá_thành đi_đôi chất_lượng màn 1 củ,2,"Chất lượng sản phẩm:màn đẹp
Tính năng nổi bật:màu ổn định

Giá thành đi đôi với chất lượng màn này hơn 1củ mà được vậy là quá tốt",5,https://shopee.vn/M%C3%80N-H%C3%8CNH-GAMING-EDRA-EGM24F100S-EGM27F120S-EGM22F100H-EGM24F100PV-GI%C3%81-R%E1%BA%BA-CH%C3%8DNH-H%C3%83NG-i.1019908131.25319004225?extraParams=%7B%22display_model_id%22%3A250945707308%2C%22model_selection_logic%22%3A3%7D&sp_atk=d4f08a34-49e4-437d-9696-86c4f235a728&xptdk=d4f08a34-49e4-437d-9696-86c4f235a728,màn hình giá rẻ,2025-08-12
"màn đẹp ổn , giá hợp túi_tiền mua tầm_giá tội giao hơi 1 chút",2,"Màn đẹp ổn, giá hợp túi tiền nên mua trong tầm giá mỗi tội giao hơi lâu 1 chút 😙",5,https://shopee.vn/M%C3%80N-H%C3%8CNH-GAMING-EDRA-EGM24F100S-EGM27F120S-EGM22F100H-EGM24F100PV-GI%C3%81-R%E1%BA%BA-CH%C3%8DNH-H%C3%83NG-i.1019908131.25319004225?extraParams=%7B%22display_model_id%22%3A250945707308%2C%22model_selection_logic%22%3A3%7D&sp_atk=d4f08a34-49e4-437d-9696-86c4f235a728&xptdk=d4f08a34-49e4-437d-9696-86c4f235a728,màn hình giá rẻ,2025-10-26
chất_lượng sản_phẩm tot tính_năng nổi_bật màn đẹp có_thể tự_tin gọi cảm_thấy đi,2,"Chất lượng sản phẩm:tot
Tính năng nổi bật:màn đẹp

Có thể là do mình tự tin và gọi cho anh nhé em cảm thấy không được đâu mà không biết làm gì vậy anh không biết làm gì vậy anh không biết có đi",5,https://shopee.vn/M%C3%80N-H%C3%8CNH-GAMING-EDRA-EGM24F100S-EGM27F120S-EGM22F100H-EGM24F100PV-GI%C3%81-R%E1%BA%BA-CH%C3%8DNH-H%C3%83NG-i.1019908131.25319004225?extraParams=%7B%22display_model_id%22%3A250945707308%2C%22model_selection_logic%22%3A3%7D&sp_atk=d4f08a34-49e4-437d-9696-86c4f235a728&xptdk=d4f08a34-49e4-437d-9696-86c4f235a728,màn hình giá rẻ,2025-10-04
chất_lượng sản_phẩm tính_năng nổi_bật hình_ảnh đẹp săn giá hời . sản_phẩm đẹp . chất_lượng tiền mua hình_ảnh tính_chất xu,2,"Chất lượng sản phẩm:tốt
Tính năng nổi bật:hình ảnh đẹp

Săn được với giá hời . Sản phẩm đẹp. Chất lượng đáng tiền mua hình ảnh chỉ mang tính chất nhận xu",5,https://shopee.vn/M%C3%80N-H%C3%8CNH-GAMING-EDRA-EGM24F100S-EGM27F120S-EGM22F100H-EGM24F100PV-GI%C3%81-R%E1%BA%BA-CH%C3%8DNH-H%C3%83NG-i.1019908131.25319004225?extraParams=%7B%22display_model_id%22%3A250945707308%2C%22model_selection_logic%22%3A3%7D&sp_atk=d4f08a34-49e4-437d-9696-86c4f235a728&xptdk=d4f08a34-49e4-437d-9696-86c4f235a728,màn hình giá rẻ,2025-07-21
"cửa_hàng giao hàng , đóng_gói kỹ , sản_phẩm . cám_ơn cửa_hàng",2,"shop giao hàng nhanh, đóng gói kỹ, sp quá oke ạ. cám ơn shop",5,https://shopee.vn/M%C3%80N-H%C3%8CNH-GAMING-EDRA-EGM24F100S-EGM27F120S-EGM22F100H-EGM24F100PV-GI%C3%81-R%E1%BA%BA-CH%C3%8DNH-H%C3%83NG-i.1019908131.25319004225?extraParams=%7B%22display_model_id%22%3A250945707308%2C%22model_selection_logic%22%3A3%7D&sp_atk=d4f08a34-49e4-437d-9696-86c4f235a728&xptdk=d4f08a34-49e4-437d-9696-86c4f235a728,màn hình giá rẻ,2024-08-24
giai_đúng rẻ 1 màn bít_độ bền_ntn . ít_ra bh 2 nam,2,"giai đúng loại
quá rẻ so với 1 màn mới
chưa bít độ bền ntn. nhưng ít ra cũng dc bh 2nam",5,https://shopee.vn/M%C3%80N-H%C3%8CNH-GAMING-EDRA-EGM24F100S-EGM27F120S-EGM22F100H-EGM24F100PV-GI%C3%81-R%E1%BA%BA-CH%C3%8DNH-H%C3%83NG-i.1019908131.25319004225?extraParams=%7B%22display_model_id%22%3A250945707308%2C%22model_selection_logic%22%3A3%7D&sp_atk=d4f08a34-49e4-437d-9696-86c4f235a728&xptdk=d4f08a34-49e4-437d-9696-86c4f235a728,màn hình giá rẻ,2025-05-16
"cảm đẹp , giá ngon_bổ rẻ , ưng_ý hài_lòng chuâbr tất_cả okie ỉng gỗ dhpp",2,"Cảm đẹp, giá ngon bổ rẻ, ưng ý hài lòng chuâbr tất cả okie luôn sẽ ỉng gỗ dhpp thêm",5,https://shopee.vn/M%C3%80N-H%C3%8CNH-GAMING-EDRA-EGM24F100S-EGM27F120S-EGM22F100H-EGM24F100PV-GI%C3%81-R%E1%BA%BA-CH%C3%8DNH-H%C3%83NG-i.1019908131.25319004225?extraParams=%7B%22display_model_id%22%3A250945707308%2C%22model_selection_logic%22%3A3%7D&sp_atk=d4f08a34-49e4-437d-9696-86c4f235a728&xptdk=d4f08a34-49e4-437d-9696-86c4f235a728,màn hình giá rẻ,2025-07-12
"cửa_hàng nhiệt_tình , đóng_gói sản_phẩm kĩ_càng , sản_phẩm ( hình_ảnh tính_chất tham_khảo xu )",2,"Shop nhiệt tình, đóng gói sản phẩm kĩ càng, sản phẩm tốt ( Hình ảnh chỉ mang tính chất tham khảo để nhận Xu )",5,https://shopee.vn/M%C3%80N-H%C3%8CNH-GAMING-EDRA-EGM24F100S-EGM27F120S-EGM22F100H-EGM24F100PV-GI%C3%81-R%E1%BA%BA-CH%C3%8DNH-H%C3%83NG-i.1019908131.25319004225?extraParams=%7B%22display_model_id%22%3A250945707308%2C%22model_selection_logic%22%3A3%7D&sp_atk=d4f08a34-49e4-437d-9696-86c4f235a728&xptdk=d4f08a34-49e4-437d-9696-86c4f235a728,màn hình giá rẻ,2024-08-25
"cửa_hàng hỗ_trợ nhiệt_tình , màn_hình to đẹp , 10 . giao hàng , cửa_hàng đóng_gói cẩn_thận .",2,"Shop hỗ trợ nhiệt tình, màn hình to đẹp, 10 điểm.

Giao hàng nhanh, shop đóng gói cẩn thận.",5,https://shopee.vn/M%C3%80N-H%C3%8CNH-GAMING-EDRA-EGM24F100S-EGM27F120S-EGM22F100H-EGM24F100PV-GI%C3%81-R%E1%BA%BA-CH%C3%8DNH-H%C3%83NG-i.1019908131.25319004225?extraParams=%7B%22display_model_id%22%3A250945707308%2C%22model_selection_logic%22%3A3%7D&sp_atk=d4f08a34-49e4-437d-9696-86c4f235a728&xptdk=d4f08a34-49e4-437d-9696-86c4f235a728,màn hình giá rẻ,2024-08-24
"hàng mô_tả , giao hàng đóng_gói kĩ , hài_lòng cửa_hàng",2,"Hàng đúng như mô tả, giao hàng nhanh đóng gói kĩ, rất hài lòng về shop",5,https://shopee.vn/M%C3%80N-H%C3%8CNH-GAMING-EDRA-EGM24F100S-EGM27F120S-EGM22F100H-EGM24F100PV-GI%C3%81-R%E1%BA%BA-CH%C3%8DNH-H%C3%83NG-i.1019908131.25319004225?extraParams=%7B%22display_model_id%22%3A250945707308%2C%22model_selection_logic%22%3A3%7D&sp_atk=d4f08a34-49e4-437d-9696-86c4f235a728&xptdk=d4f08a34-49e4-437d-9696-86c4f235a728,màn hình giá rẻ,2024-10-14
lễ bàn_giao tác_phẩm đại_nguyên soái long đàn phượng_vũ nhà_vườn sản_huy nhà_vườn kiên_mơ nhà_vườn thành phù_hoa 30 giao_dịch lớn_nhỏ quý_vị chúc_mừng nhà_vườn huy_sản nói_riêng anh_em làng nói_chung namlebonsai bonsaivn bonsai bonsaitree quangtungart art bonsaiindonesia bonsaiworld banyantree penjing reesl caycanhvn,2,"🪴Tại buổi lễ bàn giao tác phẩm ĐẠI NGUYÊN SOÁI và LONG ĐÀN PHƯỢNG VŨ của nhà vườn Sản Huy cho nhà vườn KIÊN MƠ và nhà vườn THÀNH PHÙ HOA CÓ TRÊN 30 cuộc giao dịch lớn nhỏ khác quý vị ạ 
👉🏻Chúc mừng nhà vườn Huy sản nói riêng và anh em làng cây nói chung 
📌 #namlebonsai  #bonsaivn  #bonsai  #bonsaitree  #quangtungart  #art  #bonsaiindonesia  #bonsaiworld  #banyantree  #penjing  #reesl  #caycanhvn",5,https://shopee.vn/M%C3%80N-H%C3%8CNH-GAMING-EDRA-EGM24F100S-EGM27F120S-EGM22F100H-EGM24F100PV-GI%C3%81-R%E1%BA%BA-CH%C3%8DNH-H%C3%83NG-i.1019908131.25319004225?extraParams=%7B%22display_model_id%22%3A250945707308%2C%22model_selection_logic%22%3A3%7D&sp_atk=d4f08a34-49e4-437d-9696-86c4f235a728&xptdk=d4f08a34-49e4-437d-9696-86c4f235a728,màn hình giá rẻ,2025-04-06
"xài 3 lỗi , macos chữ hơi răng_cưa . 2 k ngon kkk",2,"Xài 3 ngày chưa có lỗi gì, trên macos chữ hơi bị răng cưa. Em này mà 2k thì ngon kkk",5,https://shopee.vn/M%C3%80N-H%C3%8CNH-GAMING-EDRA-EGM24F100S-EGM27F120S-EGM22F100H-EGM24F100PV-GI%C3%81-R%E1%BA%BA-CH%C3%8DNH-H%C3%83NG-i.1019908131.25319004225?extraParams=%7B%22display_model_id%22%3A250945707308%2C%22model_selection_logic%22%3A3%7D&sp_atk=d4f08a34-49e4-437d-9696-86c4f235a728&xptdk=d4f08a34-49e4-437d-9696-86c4f235a728,màn hình giá rẻ,2024-09-05
"chất_lượng sản_phẩm ưng tính_năng nổi_bật hiển_thị_sắc nét sản_phẩm , nổi_bật phân_khúc , dịp mua tiếp , chúc cửa_hàng buôn_may đắt",2,"Chất lượng sản phẩm:khá là ưng
Tính năng nổi bật:hiển thị sắc nét

Sản phẩm dùng tốt, nổi bật trong phân khúc, có dịp sẽ lại mua tiếp, chúc shop buôn may bán đắt 😉",5,https://shopee.vn/M%C3%80N-H%C3%8CNH-GAMING-EDRA-EGM24F100S-EGM27F120S-EGM22F100H-EGM24F100PV-GI%C3%81-R%E1%BA%BA-CH%C3%8DNH-H%C3%83NG-i.1019908131.25319004225?extraParams=%7B%22display_model_id%22%3A250945707308%2C%22model_selection_logic%22%3A3%7D&sp_atk=d4f08a34-49e4-437d-9696-86c4f235a728&xptdk=d4f08a34-49e4-437d-9696-86c4f235a728,màn hình giá rẻ,2025-05-21
"tính_năng nổi_bật chuẩn 100 hz , 24 to , nét chất_lượng sản_phẩm bảo_hành tận 24 , rẻ .",2,"Tính năng nổi bật:Chuẩn 100hz, 24 to, rõ nét
Chất lượng sản phẩm:Bảo hành tận 24 tháng, rẻ nữa.",5,https://shopee.vn/M%C3%80N-H%C3%8CNH-GAMING-EDRA-EGM24F100S-EGM27F120S-EGM22F100H-EGM24F100PV-GI%C3%81-R%E1%BA%BA-CH%C3%8DNH-H%C3%83NG-i.1019908131.25319004225?extraParams=%7B%22display_model_id%22%3A250945707308%2C%22model_selection_logic%22%3A3%7D&sp_atk=d4f08a34-49e4-437d-9696-86c4f235a728&xptdk=d4f08a34-49e4-437d-9696-86c4f235a728,màn hình giá rẻ,2025-02-16
"mua 3 shop , hài_lòng khâu đóng_gói chất_lượng sản_phẩm ! cám_ơn cửa_hàng",2,"Mua lần thứ 3 từ shop, vẫn hài lòng từ khâu đóng gói tới chất lượng sản phẩm! Cám ơn shop",5,https://shopee.vn/M%C3%80N-H%C3%8CNH-GAMING-EDRA-EGM24F100S-EGM27F120S-EGM22F100H-EGM24F100PV-GI%C3%81-R%E1%BA%BA-CH%C3%8DNH-H%C3%83NG-i.1019908131.25319004225?extraParams=%7B%22display_model_id%22%3A250945707308%2C%22model_selection_logic%22%3A3%7D&sp_atk=d4f08a34-49e4-437d-9696-86c4f235a728&xptdk=d4f08a34-49e4-437d-9696-86c4f235a728,màn hình giá rẻ,2024-12-26
"chất_lượng sản_phẩm tính_năng nổi_bật hình_ảnh sắc_nét công_ty uy_tín , đóng_gói chắc_chắn , màn đẹp",2,"Chất lượng sản phẩm:Rất tốt
Tính năng nổi bật:Hình ảnh sắc nét

Công ty uy tín, đóng gói chắc chắn, màn đẹp",5,https://shopee.vn/M%C3%80N-H%C3%8CNH-GAMING-EDRA-EGM24F100S-EGM27F120S-EGM22F100H-EGM24F100PV-GI%C3%81-R%E1%BA%BA-CH%C3%8DNH-H%C3%83NG-i.1019908131.25319004225?extraParams=%7B%22display_model_id%22%3A250945707308%2C%22model_selection_logic%22%3A3%7D&sp_atk=d4f08a34-49e4-437d-9696-86c4f235a728&xptdk=d4f08a34-49e4-437d-9696-86c4f235a728,màn hình giá rẻ,2025-11-20
giao hàng . cửa_hàng đóng_gói chống sốc cẩn_thận . ủng_hộ tiếp,2,"Giao hàng nhanh. Shop đóng gói chống sốc cẩn thận. 
Lần sau ủng hộ tiếp",5,https://shopee.vn/M%C3%80N-H%C3%8CNH-GAMING-EDRA-EGM24F100S-EGM27F120S-EGM22F100H-EGM24F100PV-GI%C3%81-R%E1%BA%BA-CH%C3%8DNH-H%C3%83NG-i.1019908131.25319004225?extraParams=%7B%22display_model_id%22%3A250945707308%2C%22model_selection_logic%22%3A3%7D&sp_atk=d4f08a34-49e4-437d-9696-86c4f235a728&xptdk=d4f08a34-49e4-437d-9696-86c4f235a728,màn hình giá rẻ,2024-09-02
"màn tầm_giá , cửa_hàng đóng_gói chắc_chắn giao",2,"Màn ok dùng tốt trong tầm giá, shop đóng gói chắc chắn giao nhanh",5,https://shopee.vn/M%C3%80N-H%C3%8CNH-GAMING-EDRA-EGM24F100S-EGM27F120S-EGM22F100H-EGM24F100PV-GI%C3%81-R%E1%BA%BA-CH%C3%8DNH-H%C3%83NG-i.1019908131.25319004225?extraParams=%7B%22display_model_id%22%3A250945707308%2C%22model_selection_logic%22%3A3%7D&sp_atk=d4f08a34-49e4-437d-9696-86c4f235a728&xptdk=d4f08a34-49e4-437d-9696-86c4f235a728,màn hình giá rẻ,2024-11-15
"chất_lượng sản_phẩm tính_năng nổi_bật fhd đóng_gói cẩn_thận , chất_lượng",2,"Chất lượng sản phẩm:mới
Tính năng nổi bật:fhd

Đóng gói cẩn thận,  chất lượng tốt",5,https://shopee.vn/M%C3%80N-H%C3%8CNH-GAMING-EDRA-EGM24F100S-EGM27F120S-EGM22F100H-EGM24F100PV-GI%C3%81-R%E1%BA%BA-CH%C3%8DNH-H%C3%83NG-i.1019908131.25319004225?extraParams=%7B%22display_model_id%22%3A250945707308%2C%22model_selection_logic%22%3A3%7D&sp_atk=d4f08a34-49e4-437d-9696-86c4f235a728&xptdk=d4f08a34-49e4-437d-9696-86c4f235a728,màn hình giá rẻ,2025-10-08
hàng giao chất_lượng sản_phẩm tiếp_tục ủng_hộ cửa_hàng,2,Hàng giao nhanh chất lượng sản phẩm tốt sẽ tiếp tục ủng hộ shop lần sau,5,https://shopee.vn/M%C3%80N-H%C3%8CNH-GAMING-EDRA-EGM24F100S-EGM27F120S-EGM22F100H-EGM24F100PV-GI%C3%81-R%E1%BA%BA-CH%C3%8DNH-H%C3%83NG-i.1019908131.25319004225?extraParams=%7B%22display_model_id%22%3A250945707308%2C%22model_selection_logic%22%3A3%7D&sp_atk=d4f08a34-49e4-437d-9696-86c4f235a728&xptdk=d4f08a34-49e4-437d-9696-86c4f235a728,màn hình giá rẻ,2025-09-04
"chất_lượng sản_phẩm tính_năng nổi_bật màn_hình to , màu_sắc_đẹp cửa_hàng gói hàng kỹ , hi_vọng sản_phẩm ổn .",2,"Chất lượng sản phẩm:tốt
Tính năng nổi bật:màn hình to, màu sắc đẹp

Shop gói hàng rất kỹ, hi vọng sp dùng ổn.",5,https://shopee.vn/M%C3%80N-H%C3%8CNH-GAMING-EDRA-EGM24F100S-EGM27F120S-EGM22F100H-EGM24F100PV-GI%C3%81-R%E1%BA%BA-CH%C3%8DNH-H%C3%83NG-i.1019908131.25319004225?extraParams=%7B%22display_model_id%22%3A250945707308%2C%22model_selection_logic%22%3A3%7D&sp_atk=d4f08a34-49e4-437d-9696-86c4f235a728&xptdk=d4f08a34-49e4-437d-9696-86c4f235a728,màn hình giá rẻ,2025-05-14
"tphcm gởi đồng_nai cửa_hàng gói cẩn_thận , hình_ảnh đẹp_sắc nét hàng điện_tử hên_xui lắm bền chờ thời_gian",2,"Ở TpHCM nhưng gởi Đồng Nai khá lâu
Shop gói cẩn thận, hình ảnh đẹp sắc nét
Hàng điện tử cũng hên xui lắm bền hay ko phải chờ thời gian",5,https://shopee.vn/M%C3%80N-H%C3%8CNH-GAMING-EDRA-EGM24F100S-EGM27F120S-EGM22F100H-EGM24F100PV-GI%C3%81-R%E1%BA%BA-CH%C3%8DNH-H%C3%83NG-i.1019908131.25319004225?extraParams=%7B%22display_model_id%22%3A250945707308%2C%22model_selection_logic%22%3A3%7D&sp_atk=d4f08a34-49e4-437d-9696-86c4f235a728&xptdk=d4f08a34-49e4-437d-9696-86c4f235a728,màn hình giá rẻ,2025-04-03
tính_năng nổi_bật lm chất_lượng sản_phẩm ok ngiuu bảo mua thử cửa_hàng nha hàng uy_tínnnn khsao ncl 10 điểmmmm,2,"Tính năng nổi bật:lm
Chất lượng sản phẩm:ok

Đặt cho ngiuu kh thấy bảo gì chắc oke á
Nên mua thử của shop nha hàng uy tínnnn khsao hết
Ncl 10 điểmmmm",5,https://shopee.vn/M%C3%80N-H%C3%8CNH-GAMING-EDRA-EGM24F100S-EGM27F120S-EGM22F100H-EGM24F100PV-GI%C3%81-R%E1%BA%BA-CH%C3%8DNH-H%C3%83NG-i.1019908131.25319004225?extraParams=%7B%22display_model_id%22%3A250945707308%2C%22model_selection_logic%22%3A3%7D&sp_atk=d4f08a34-49e4-437d-9696-86c4f235a728&xptdk=d4f08a34-49e4-437d-9696-86c4f235a728,màn hình giá rẻ,2025-08-08
màn_hình có_lẽ quốc_dân giá rẻ full box 100 hz mượt ae chiến_game ! ! !,2,Màn hình này có lẽ là quốc dân giá rẻ mà full box 100hz đủ mượt cho ae chiến game!!!,5,https://shopee.vn/M%C3%80N-H%C3%8CNH-GAMING-EDRA-EGM24F100S-EGM27F120S-EGM22F100H-EGM24F100PV-GI%C3%81-R%E1%BA%BA-CH%C3%8DNH-H%C3%83NG-i.1019908131.25319004225?extraParams=%7B%22display_model_id%22%3A250945707308%2C%22model_selection_logic%22%3A3%7D&sp_atk=d4f08a34-49e4-437d-9696-86c4f235a728&xptdk=d4f08a34-49e4-437d-9696-86c4f235a728,màn hình giá rẻ,2024-09-10
màn đẹp rẻ thời_gian kiểm_chứng độ bền màn,2,Màn đẹp rẻ cần thời gian để kiểm chứng độ bền của màn,5,https://shopee.vn/M%C3%80N-H%C3%8CNH-GAMING-EDRA-EGM24F100S-EGM27F120S-EGM22F100H-EGM24F100PV-GI%C3%81-R%E1%BA%BA-CH%C3%8DNH-H%C3%83NG-i.1019908131.25319004225?extraParams=%7B%22display_model_id%22%3A250945707308%2C%22model_selection_logic%22%3A3%7D&sp_atk=d4f08a34-49e4-437d-9696-86c4f235a728&xptdk=d4f08a34-49e4-437d-9696-86c4f235a728,màn hình giá rẻ,2024-07-09
"màn dẹp , sắc_nét , mỏng hợp_lý màn phụ , giá rẻ hảng",2,"Màn dẹp, sắc nét, mỏng nhé hợp lý làm màn phụ , giá rẻ so với các hảng",5,https://shopee.vn/M%C3%80N-H%C3%8CNH-GAMING-EDRA-EGM24F100S-EGM27F120S-EGM22F100H-EGM24F100PV-GI%C3%81-R%E1%BA%BA-CH%C3%8DNH-H%C3%83NG-i.1019908131.25319004225?extraParams=%7B%22display_model_id%22%3A250945707308%2C%22model_selection_logic%22%3A3%7D&sp_atk=d4f08a34-49e4-437d-9696-86c4f235a728&xptdk=d4f08a34-49e4-437d-9696-86c4f235a728,màn hình giá rẻ,2024-10-01
"hàng đẹp , đobgs_gói chắc_chắn , vận_chuyển siêu lỗi hở góc 1 tí_ti , chấp_nhận",2,"Hàng đẹp , đobgs gói chắc chắn , ship siêu nhanh lỗi hở góc 1 tí ti , chấp nhận được",5,https://shopee.vn/M%C3%80N-H%C3%8CNH-GAMING-EDRA-EGM24F100S-EGM27F120S-EGM22F100H-EGM24F100PV-GI%C3%81-R%E1%BA%BA-CH%C3%8DNH-H%C3%83NG-i.1019908131.25319004225?extraParams=%7B%22display_model_id%22%3A250945707308%2C%22model_selection_logic%22%3A3%7D&sp_atk=d4f08a34-49e4-437d-9696-86c4f235a728&xptdk=d4f08a34-49e4-437d-9696-86c4f235a728,màn hình giá rẻ,2024-05-31
"giao hàng nhanh_chóng , sản_phẩm , mua , mua hộ anh_em bạn_bè tin_tưởng ủng_hộ cửa_hàng",2,"Giao hàng nhanh chóng, sp khá tốt, đã mua rất nhiều lần, mua hộ anh em bạn bè ai cũng tin tưởng ủng hộ shop",5,https://shopee.vn/M%C3%80N-H%C3%8CNH-GAMING-EDRA-EGM24F100S-EGM27F120S-EGM22F100H-EGM24F100PV-GI%C3%81-R%E1%BA%BA-CH%C3%8DNH-H%C3%83NG-i.1019908131.25319004225?extraParams=%7B%22display_model_id%22%3A250945707308%2C%22model_selection_logic%22%3A3%7D&sp_atk=d4f08a34-49e4-437d-9696-86c4f235a728&xptdk=d4f08a34-49e4-437d-9696-86c4f235a728,màn hình giá rẻ,2025-10-13
"màn đẹp , to , đóng_gói kỹ , chất_lượng tạm ổn , màu chuẩn lắm , văn_phòng . mua có_lẽ",2,"Màn đẹp, to, đóng gói kỹ, chất lượng cũng tạm ổn, màu không chuẩn lắm, dùng văn phòng thôi.ăn chưa đủ để mua lại thì thấy có lẽ sẽ có",5,https://shopee.vn/M%C3%80N-H%C3%8CNH-GAMING-EDRA-EGM24F100S-EGM27F120S-EGM22F100H-EGM24F100PV-GI%C3%81-R%E1%BA%BA-CH%C3%8DNH-H%C3%83NG-i.1019908131.25319004225?extraParams=%7B%22display_model_id%22%3A250945707308%2C%22model_selection_logic%22%3A3%7D&sp_atk=d4f08a34-49e4-437d-9696-86c4f235a728&xptdk=d4f08a34-49e4-437d-9696-86c4f235a728,màn hình giá rẻ,2025-03-08
"chất_lượng sản_phẩm 10 giao hàng , hàng_không vỡ vận_chuyển kích_thước chỉ_số hộp ghi hdmi hộp",2,"Chất lượng sản phẩm:10₫

Giao hàng nhanh, hàng không bị vỡ khi vận chuyển 
Kích thước và chỉ số đều đúng nhưng hộp ghi HDMI nhưng trong hộp lại không có 😢",5,https://shopee.vn/M%C3%80N-H%C3%8CNH-GAMING-EDRA-EGM24F100S-EGM27F120S-EGM22F100H-EGM24F100PV-GI%C3%81-R%E1%BA%BA-CH%C3%8DNH-H%C3%83NG-i.1019908131.25319004225?extraParams=%7B%22display_model_id%22%3A250945707308%2C%22model_selection_logic%22%3A3%7D&sp_atk=d4f08a34-49e4-437d-9696-86c4f235a728&xptdk=d4f08a34-49e4-437d-9696-86c4f235a728,màn hình giá rẻ,2025-03-30
giao ha ng . ma n re du_ng cu ng ô_n . hy_vo ng du_ng bê n ô_n đi nh,2,Giao hàng nhanh. Màn rẻ dùng cũng ổn. Hy vọng dùng bền ổn định,5,https://shopee.vn/M%C3%80N-H%C3%8CNH-GAMING-EDRA-EGM24F100S-EGM27F120S-EGM22F100H-EGM24F100PV-GI%C3%81-R%E1%BA%BA-CH%C3%8DNH-H%C3%83NG-i.1019908131.25319004225?extraParams=%7B%22display_model_id%22%3A250945707308%2C%22model_selection_logic%22%3A3%7D&sp_atk=d4f08a34-49e4-437d-9696-86c4f235a728&xptdk=d4f08a34-49e4-437d-9696-86c4f235a728,màn hình giá rẻ,2024-08-18
sản_phẩm đóng_gói kỹ_càng . cửa_hàng 5 tiếp_tục ủng_hộ,2,Sản phẩm tốt đóng gói kỹ càng. Cho shop 5 sao và sẽ tiếp tục ủng hộ dài dài,5,https://shopee.vn/M%C3%80N-H%C3%8CNH-GAMING-EDRA-EGM24F100S-EGM27F120S-EGM22F100H-EGM24F100PV-GI%C3%81-R%E1%BA%BA-CH%C3%8DNH-H%C3%83NG-i.1019908131.25319004225?extraParams=%7B%22display_model_id%22%3A250945707308%2C%22model_selection_logic%22%3A3%7D&sp_atk=d4f08a34-49e4-437d-9696-86c4f235a728&xptdk=d4f08a34-49e4-437d-9696-86c4f235a728,màn hình giá rẻ,2025-05-08
"chất_lượng sản_phẩm ổn tính_năng nổi_bật ko phù_hợp giá tiền , cửa_hàng trả_lời nhắn",1,"Chất lượng sản phẩm:ổn
Tính năng nổi bật:ko

phù hợp với giá tiền,nhưng shop trả lời tin nhắn lâu",3,https://shopee.vn/M%C3%80N-H%C3%8CNH-GAMING-EDRA-EGM24F100S-EGM27F120S-EGM22F100H-EGM24F100PV-GI%C3%81-R%E1%BA%BA-CH%C3%8DNH-H%C3%83NG-i.1019908131.25319004225?extraParams=%7B%22display_model_id%22%3A250945707308%2C%22model_selection_logic%22%3A3%7D&sp_atk=d4f08a34-49e4-437d-9696-86c4f235a728&xptdk=d4f08a34-49e4-437d-9696-86c4f235a728,màn hình giá rẻ,2025-04-10
cửa_hàng giao hàng nhanh_chóng gói hàng cẩn_thận chu_đáo chất_lượng,2,Shop giao hàng nhanh chóng và gói hàng cẩn thận chu đáo và chất lượng,5,https://shopee.vn/M%C3%80N-H%C3%8CNH-GAMING-EDRA-EGM24F100S-EGM27F120S-EGM22F100H-EGM24F100PV-GI%C3%81-R%E1%BA%BA-CH%C3%8DNH-H%C3%83NG-i.1019908131.25319004225?extraParams=%7B%22display_model_id%22%3A250945707308%2C%22model_selection_logic%22%3A3%7D&sp_atk=d4f08a34-49e4-437d-9696-86c4f235a728&xptdk=d4f08a34-49e4-437d-9696-86c4f235a728,màn hình giá rẻ,2024-07-28
"sản_phẩm , cửa_hàng phục_vụ tận_tình . gói hàng chu_đáo giao hàng . đánh_giá 5 shop .",2,"Sản phẩm tốt, shop phục vụ tận tình. Gói hàng chu đáo giao hàng nhanh. Đánh giá 5 sao cho shop.",5,https://shopee.vn/M%C3%80N-H%C3%8CNH-GAMING-EDRA-EGM24F100S-EGM27F120S-EGM22F100H-EGM24F100PV-GI%C3%81-R%E1%BA%BA-CH%C3%8DNH-H%C3%83NG-i.1019908131.25319004225?extraParams=%7B%22display_model_id%22%3A250945707308%2C%22model_selection_logic%22%3A3%7D&sp_atk=d4f08a34-49e4-437d-9696-86c4f235a728&xptdk=d4f08a34-49e4-437d-9696-86c4f235a728,màn hình giá rẻ,2025-01-12
mua hộ màn_hình đăng_ảnh video xu màn tốt_đẹp,2,Mình mua hộ màn hình nên đăng ảnh với video để nhận xu thôi màn dùng tốt đẹp nhé,5,https://shopee.vn/M%C3%80N-H%C3%8CNH-GAMING-EDRA-EGM24F100S-EGM27F120S-EGM22F100H-EGM24F100PV-GI%C3%81-R%E1%BA%BA-CH%C3%8DNH-H%C3%83NG-i.1019908131.25319004225?extraParams=%7B%22display_model_id%22%3A250945707308%2C%22model_selection_logic%22%3A3%7D&sp_atk=d4f08a34-49e4-437d-9696-86c4f235a728&xptdk=d4f08a34-49e4-437d-9696-86c4f235a728,màn hình giá rẻ,2024-08-02
"chất_lượng sản_phẩm tuyệt_vời chê tính_năng nổi_bật cảm_ứng sản_phẩm ok , nét , cảm_ứng ngon .",2,"Chất lượng sản phẩm:tuyệt vời không chê gì
Tính năng nổi bật:cảm ứng tốt sáng rõ

Sản phẩm ok, sáng rõ nét, nhận cảm ứng ngon.",5,https://shopee.vn/M%C3%A0n-h%C3%ACnh-di-%C4%91%E1%BB%99ng-c%C3%B3-c%E1%BA%A3m-%E1%BB%A9ng-%C4%91a-%C4%91i%E1%BB%83m-H%E1%BB%97-tr%E1%BB%A3-Samsung-DeX-PC-Switch-T%E1%BA%B7ng-k%C3%A8m-bao-da-i.49282974.22148809883?extraParams=%7B%22display_model_id%22%3A119569163116%2C%22model_selection_logic%22%3A3%7D&sp_atk=c5df7a5f-b109-44b2-8e2e-45e0d9afed8e&xptdk=c5df7a5f-b109-44b2-8e2e-45e0d9afed8e,màn hình giá rẻ,2025-07-15
"chất_lượng sản_phẩm sử_dụng tính_năng nổi_bật cảm_ứng cửa_hàng hỗ_trợ đóng_gói kỹ_càng , phụ_kiện , quà tặng . test màn hiển_thị_ok , cảm_ứng , test màu . 1 chết bật màu tím , màu , ảnh_hưởng .",2,"Chất lượng sản phẩm:Sử dụng OK
Tính năng nổi bật:Cảm ứng OK

Shop hỗ trợ tốt
Đóng gói kỹ càng, đủ phụ kiện, quà tặng. 
Test màn hiển thị OK, cảm ứng đủ dùng, chưa test màu. 
Bị 1 điểm chết khi bật màu tím, màu khác ko thấy, không ảnh hưởng.",5,https://shopee.vn/M%C3%A0n-h%C3%ACnh-di-%C4%91%E1%BB%99ng-c%C3%B3-c%E1%BA%A3m-%E1%BB%A9ng-%C4%91a-%C4%91i%E1%BB%83m-H%E1%BB%97-tr%E1%BB%A3-Samsung-DeX-PC-Switch-T%E1%BA%B7ng-k%C3%A8m-bao-da-i.49282974.22148809883?extraParams=%7B%22display_model_id%22%3A119569163116%2C%22model_selection_logic%22%3A3%7D&sp_atk=c5df7a5f-b109-44b2-8e2e-45e0d9afed8e&xptdk=c5df7a5f-b109-44b2-8e2e-45e0d9afed8e,màn hình giá rẻ,2024-12-14
